StrRef,SpeakerType,SpeakerName,TextEng,Text,DLG,Scripts,Conditions,DialogueContext,SoundRef,VolumeVariance,PitchVariance
44733,Dialog,DAMA,"Hey! This is the Commander's quarters! I don't want you enlisted men traipsing through... oh, sorry, my <Lord/Lady>. I thought you were one of my soldiers.","이봐! 여기는 지휘관의 숙소요! 사병들이 함부로 드나드는 꼴은 보고 싶지... 오, 실례했소, 모험가 양반. 내 부하인 줄 알았소.",M3Q02A11DAMA,,,,vs_nnwgrdm1_056,0,0
44734,Dialog,DAMA,Please forgive my outburst - I would not have it said that Commander Damas is a man without class. How may I be of service to you?,무례를 용서해 주시오-지휘관 다마스가 품위 없는 사람이라 소문나고 싶진 않소. 무엇을 도와드리면 되겠소?,M3Q02A11DAMA,m3q02a11damaelc1,,,vs_nnwgrdm1_057,0,0
44735,Dialog,DAMA,"As you wish, my <Lord/Lady>. If you need anything else, I am at your disposal.","분부대로 하겠소, 모험가 양반. 다른 필요가 있으면 내게 명하시오.",M3Q02A11DAMA,,,,,0,0
44736,Dialog,DAMA,I suppose I could spare you some time. Though between the catapults bombarding us and the endless complaints of my recruits I've already got enough headaches.,시간을 조금 내 줄 수는 있겠소. 다만 우리를 퍼붓는 투석기들과 신병들의 끝없는 불평 때문에 벌써 골치가 아픈지라오.,M3Q02A11DAMA,,,,,0,0
44737,Dialog,DAMA,"I suppose I could spare you some time, though between the Uthgardt siege and the endless complaints of my recruits I've already got enough headaches.",시간을 조금 내 줄 수는 있겠소. 하지만 우스가르트의 포위와 신병들의 끝없는 불평 때문에 벌써 머리가 아프오.,M3Q02A11DAMA,,,,,0,0
44738,Dialog,DAMA,"I suppose I could spare you some time, though between endless complaints of my recruits and the alliance between the Uthgardt Elk tribe and Luskan I've already got enough headaches.",시간을 조금 내 줄 수는 있겠소. 하지만 신병들의 끝없는 불평과 우스가르트 큰사슴 부족과 러스칸의 동맹 문제 때문에 벌써 머리가 아프오.,M3Q02A11DAMA,,,,,0,0
44739,Dialog,DAMA,"As you wish, though between the endless complaints of my soldiers and this war against Luskan I don't have much time to spare.","분부대로 하겠소만, 병사들의 끝없는 불평과 러스칸과의 전쟁 탓에 내줄 시간이 많지 않소.",M3Q02A11DAMA,,,,,0,0
44740,Dialog,DAMA,Who knows how the minds of those animals works? They probably just saw a chance to kill and pillage and jumped at it!,그 짐승들 머리가 어떻게 굴러가는지 누가 알겠소? 아마 죽이고 약탈할 기회다 싶으니 그대로 뛰어든 것이겠지!,M3Q02A11DAMA,,,,,0,0
44741,Dialog,DAMA,"How can you even ask that? The Uthgardt are ruthless killers who prey on the weak and defenseless! They must be exterminated like the disease they are! Now, if there is nothing else... ","그런 걸 어떻게 묻소? 우스가르트는 약자와 무방비한 자를 노리는 무자비한 살인자들이오! 그 역병 같은 것들은 뿌리째 뽑아야 하오! 자, 다른 일이 없으면...",M3Q02A11DAMA,,,,,0,0
44742,Dialog,DAMA,They are soft and weak! They whine about missing their families and cry about going back to their farms and homesteads! Don't they realize this is war!,"놈들은 물러터지고 나약하오! 가족이 그립다느니, 농장과 영지로 돌아가겠다느니 칭얼대지! 여기가 전쟁터라는 걸 모르는 게요?",M3Q02A11DAMA,,,,,0,0
44743,Dialog,DAMA,"Fort Ilkard has to be defended if we are to win this war! And it would help if my soldiers wouldn't question my every command. Now, if there is nothing else... ","우리가 이 전쟁에서 이기려면 일카드 요새를 지켜야 하오! 내 명령 하나하나에 토 달지 않는다면 더 도움이 될 것이오. 자, 다른 일이 없으면...",M3Q02A11DAMA,,,,,0,0
44744,Dialog,DAMA,"Tell you what: you go out and disable all six catapults attacking the fort, and I'll make sure you get a healthy reward from the Fort Ilkard treasury. Now, if there is nothing else... ","제안 하나 하겠소. 나가서 요새를 공격하는 투석기 여섯 대를 전부 무력화하시오. 그러면 일카드 요새 금고에서 넉넉한 보상을 받게 해 주겠소. 자, 다른 일이 없으면...",M3Q02A11DAMA,m3q02a11damacat,,,,0,0
44745,Dialog,DAMA,"You don't seem like the brightest <man/woman> I've ever met, but I can't be too picky at this time.","지금까지 본 <man/woman> 중에 특히 총명해 보이진 않소만, 지금은 가릴 처지가 아니오.",M3Q02A11DAMA,,,,,0,0
44746,Dialog,DAMA,"You could bring me the head of Arness, the Uthgardt sub-chief in charge of this siege! I stick his melon on a pole outside the gates, and the Uthgardt will think twice before attacking Fort Ilkard again!","우스가르트 하위족장 아르네스의 머리를 내게 가져오면 어떻겠소? 그 수박 같은 머리를 성문 밖 장대에 꽂아 두면, 우스가르트도 다음부턴 일카드 요새에 함부로 못 덤빌 것이오!",M3Q02A11DAMA,,,,,0,0
44747,Dialog,DAMA,"You might be dull, but I like your attitude! I could use more soldiers like you!",둔해 보여도 태도는 마음에 드오! 그대 같은 병사가 더 있었으면 하오!,M3Q02A11DAMA,,,,,0,0
44748,Dialog,DAMA,"Of course I would see you are justly rewarded for bringing me such a prize. Now, if there is nothing else... ","물론 그런 전리품을 가져오면 정당한 보상을 받게 해 주겠소. 자, 다른 일이 없으면...",M3Q02A11DAMA,,,,,0,0
44749,Dialog,DAMA,"That's the spirit! Jump right in there! You know, you're so incredibly stupid but you could teach the rest of my troops so, so much!","바로 그거요! 곧장 뛰어드시오! 그대는 믿을 수 없을 만큼 어리석지만, 내 부하들에게 정말, 정말 많은 걸 가르쳐 줄 수 있겠소!",M3Q02A11DAMA,,,,,0,0
44750,Dialog,DAMA,"The best way to break the Luskan - Elk tribe alliance is to kill off the Uthgardt chief, Zokan Thunderer. Without Zokan to guide them, the Elk tribe will fall apart. And that will be the end of the alliance.","러스칸-큰사슴 부족 동맹을 깨뜨리는 가장 좋은 방법은 우스가르트 족장 천둥의 조칸을 죽이는 것이오. 조칸이 없으면 큰사슴 부족은 와해될 것이고, 동맹도 그 끝일 것이오.",M3Q02A11DAMA,m3q02a11damazok,,,,0,0
44751,Dialog,DAMA,"The Uthgardt chief is holed up in an old fort just west of here. Damn coward hasn't come out in weeks! Bring me his head and I'll give you a fine reward. Now, if there's nothing else... ","우스가르트 족장은 여기서 서쪽의 오래된 요새에 틀어박혀 있소. 비겁한 작자가 몇 주째 나오질 않지! 머리를 가져오면 좋은 보상을 주겠소. 자, 다른 일이 없으면...",M3Q02A11DAMA,,,,,0,0
44752,Dialog,DAMA,This is excellent news! Of course I must assume that you are the one responsible for this. Therefore you shall be the one to receive your reward.,훌륭한 소식이오! 물론 그대의 공이라 가정해야 하겠지. 그러니 보상도 그대가 받게 될 것이오.,M3Q02A11DAMA,,,,,0,0
44753,Dialog,DAMA,"Well done! What did you do, bludgeon them with that rock-hard noggin of yours? I am only joking, of course.","잘했소! 무엇으로 찍어눌렀소? 그 바위처럼 단단한 대가리로? 농이오, 물론.",M3Q02A11DAMA,,,,,0,0
44754,Dialog,DAMA,"Here, 500 gold pieces for your act of wanton destruction. A fine payday, wouldn't you agree?","자, 금화 500이오. 그 무차별 파괴의 대가지. 꽤 괜찮은 벌이라 생각하오?",M3Q02A11DAMA,m3q2a11_damar1,,,,0,0
44755,Dialog,DAMA,"I'd think twice before threatening me here in my own fort! My troops may not love me, but they will slay you if you kill their commander!","내 요새에서 나를 협박하겠다면 두 번 생각하시오! 내 부하들이 날 사랑하진 않아도, 지휘관을 죽인 자를 가만두진 않을 것이오!",M3Q02A11DAMA,,,,,0,0
44756,Dialog,DAMA,"If you desire even more gold, I have another job you might be interested in. The Uthgardt siege is still a problem, even without their catapults lobbing death from above.","금화를 더 원한다면, 그대가 관심 가질 만한 일이 하나 더 있소. 투석기가 비를 멈췄어도 우스가르트의 포위는 여전한 문제요.",M3Q02A11DAMA,m3q02a11damasub,,,,0,0
44757,Dialog,DAMA,"<StartCheck>[Failure]</Start> We don't always get what we deserve in life now, do we?","<StartCheck>[실패]</Start> 우리는 삶에서 마땅한 대가를 항상 받는 것은 아니오, 그렇지 않소?",M3Q02A11DAMA,,,,,0,0
44758,Dialog,DAMA,Excellent! I will have this placed on a pole outside Fort Ilkard's gates at once!,훌륭하오! 이것은 즉시 일카드 요새 성문 밖 장대에 걸어 두겠소!,M3Q02A11DAMA,,,,,0,0
44759,Dialog,DAMA,"Excellent! For one so lacking in brains, your success is truly amazing! I will have this head mounted on a pole outside Fort Ilkard's gates right away.",훌륭하오! 머리가 그리 모자란데도 성공하다니 참으로 놀랍소! 이 머리는 곧장 일카드 요새 성문 밖 장대에 걸어 두겠소.,M3Q02A11DAMA,m3q02a11damaegb1,,,,0,0
44760,Dialog,DAMA,"For ending the siege of Fort Ilkard, I am pleased to give you this gift of 750 gold pieces!","일카드 요새의 포위를 끝내 준 대가로, 금화 750을 드리겠소!",M3Q02A11DAMA,m3q02a11damaegb1,,,,0,0
44761,Dialog,DAMA,"Don't be a fool! My soldiers may not like me, but they won't stand idly by while I am attacked. Your threats will get you nothing, I say! But I do have an offer you may wish to hear...","어리석은 짓은 하지 마시오! 내 부하들이 날 좋아하진 않아도, 지휘관이 공격받는데 팔짱 끼고 있진 않을 것이오. 협박해 봐야 그대가 얻을 것은 없소! 다만 귀가 솔깃할 제안이 하나 있소...",M3Q02A11DAMA,,,,,0,0
44762,Dialog,DAMA,"Since you have proven yourself so useful already, there is something else I would ask of you.","이미 쓸모를 입증했으니, 그대에게 더 부탁할 일이 있소.",M3Q02A11DAMA,,,,,0,0
44763,Dialog,DAMA,"<StartCheck>[Success]</Start> I suppose I am being a bit stingy. I can't spare anymore gold for this particular task, but I have a powerful shield here you can have. None of the soldiers under my command are worthy of it, anyway.","<StartCheck>[성공]</Start> 내가 조금 인색했나 보오. 이 일에 더 줄 금화는 없으나, 강력한 방패 하나를 드리겠소. 내 지휘 아래 있는 놈들에겐 과분한 물건이니 말이오.",M3Q02A11DAMA,m3q2a11_damar2,,,,0,0
44764,Dialog,DAMA,"<StartCheck>[Failure]</Start> Greed disgusts me, unless it is my own. If you want more from my coffers, you will have to earn it! Luckily, I know just how you can do that.","<StartCheck>[실패]</Start> 남의 탐욕은 역겹소-내 것 말고는. 더 원하면 그만한 값을 하시오! 다행히도, 딱 맞는 일이 있소.",M3Q02A11DAMA,,,,,0,0
44765,Dialog,DAMA,"I have to admit, I didn't like your looks when I first saw you. But maybe I was wrong. After all, you've earned your reward. 500 gold pieces.",처음 봤을 땐 영 마음에 안 들었소. 하지만 내가 틀렸을지도 모르오. 어쨌든 보상은 받을 자격이 있소. 금화 500이오.,M3Q02A11DAMA,m3q02a11damaegb1,,,,0,0
44766,Dialog,DAMA,I knew from the first moment I laid eyes on you that you'd come through for me. You just have that aura of success. Take this reward: 1000 gold pieces for ending the siege of Fort Ilkard.,"처음 보자마자 확신했소, 내 일을 해낼 거라고. 자, 보상이오: 일카드 요새 포위를 끝낸 대가로 금화 1000이오.",M3Q02A11DAMA,m3q02a11damaegb1,,,,0,0
44767,Dialog,DAMA,"And the Elk tribe is no more! The world is rid of their vile presence. At last, the lands have been cleansed of those wandering savages!",그리고 큰사슴 부족은 사라졌소! 세상이 그 더러운 족속들에서 해방되었소. 드디어 이 땅이 떠돌이 야만인들로부터 깨끗해졌구려!,M3Q02A11DAMA,nw_d1_talklevel,,,,0,0
44768,Dialog,DAMA,"So what if I did? Damn savages, running loose like animals over the land, causing trouble whenever the settlers tried to build their homes and plant their crops.","그래, 그래서 무엇이오? 젠장할 야만인들, 땅 위를 짐승처럼 날뛰며, 정착민들이 집을 짓고 밭을 일구려 하면 언제나 사고만 치지 않소.",M3Q02A11DAMA,,,,,0,0
44769,Dialog,DAMA,"That's exactly the kind of bleeding heart talk I don't need! Look, I tried to do this nice and quiet. Slipped them Uthgardt a bunch of plague-infected blankets. It didn't kill them off quick enough, that was the problem!",바로 그런 동정심 타령은 필요 없소! 좋게 처리하려 했소. 우스가르트 놈들에게 역병 묻은 담요를 한 무더기 흘려 보냈지. 문제는 놈들이 빨리 안 죽더라는 거였소!,M3Q02A11DAMA,,,,,0,0
44770,Dialog,DAMA,"Then this war came along and my problem was solved. Wipe the tribe out because they allied with Luskan, and the land is empty for the settlers now. Works out good for everyone... except the Elk tribe. Ha! ","마침 전쟁이 터지면서 내 고민도 풀렸지. 러스칸과 동맹 맺었다는 명분으로 그 부족을 쓸어 버리면, 정착민들이 쓸 텅 빈 땅이 생기는 법이오. 모두에게 좋지... 큰사슴 부족만 빼고. 하!",M3Q02A11DAMA,,,,,0,0
44771,Dialog,DAMA,"Who are you going to tell? Who's going to care? The Elk tribe are gone now, thanks to you! It's too late, there's nothing you can do. So just take the reward...","누구에게 고하겠소? 누가 신경이나 쓰겠소? 큰사슴 부족은 그대 덕분에 이미 끝났소! 너무 늦었지, 그대가 할 수 있는 건 없소. 그러니 보상이나 받으시오...",M3Q02A11DAMA,,,,,0,0
44772,Dialog,DAMA,"Careful, you don't want to try anything here in the fort! My troops may not like me much, but they won't stand idly by while their Commander is under attack! Just let this go. Take the reward and be done with it.","조심하시오, 이 요새에서 나를 어찌해 보려 들지 말라고! 내 부하들이 날 싫어하더라도, 지휘관이 공격당하면 가만있지 않을 것이오! 그냥 잊으시오. 보상이나 받고 끝내는 게 좋소.",M3Q02A11DAMA,,,,,0,0
44773,Dialog,DAMA,"I can't tell if you're principled or just stupid but if you don't want the money, fine. That just means more stays in the Fort Ilkard treasury. Now if you'll excuse me, I think our business here is done.","그대가 원칙이 있어서인지, 아니면 그냥 어리석어서인지 알 수는 없소만, 돈을 원치 않겠다니 좋을 대로 하시오. 그만큼 일카드 요새 금고에 금화가 더 남는 것이오. 이만, 우리 일은 끝난 듯하오.",M3Q02A11DAMA,,,,,0,0
44774,Dialog,DAMA,"Your reward. Of course. 1000 gold pieces for you, friend. You may be one ugly <man/woman>, but at least now you're rich, right? Ha-ha!","보상이오. 물론이오. 금화 1000, 친구. 못생긴 <man/woman>인 건 변함없어도, 적어도 이젠 부자요? 하하!",M3Q02A11DAMA,m3q1a11damar2,,,,0,0
44775,Dialog,DAMA,Your reward. Of course. 1200 gold pieces seems fair. You're becoming quite the wealthy <man/woman> working for me.,"보상이오. 물론이오. 금화 1200이면 공정하오. 내 밑에서 일하더니 제법 부자가 되는군, <man/woman>.",M3Q02A11DAMA,m3q1a11damar2,,,,0,0
44776,Dialog,DAMA,"Your reward. Of course. 1500 gold pieces for you, my friend. Now you're not only physically attractive, you're also stinking rich! Ha-ha!","보상이오. 물론이오. 금화 1500이오, 친구. 이제는 외모도 출중한 데다 돈 냄새도 풀풀 나겠소! 하하!",M3Q02A11DAMA,m3q1a11damar2,,,,0,0
44777,Dialog,DAMA,"The pleasure has been all mine. I doubt there is little more you can do for me here at Fort Ilkard, but if anything comes up I will surely keep you in mind. Good day to you, <Sir/Madam>.","즐거웠소. 이 일카드 요새에서 그대가 더 해 줄 일은 아마 없을 것이오만, 무슨 일이 생기면 기억해 두겠소. 그럼 실례하겠소, 선생.",M3Q02A11DAMA,,,,,0,0
44778,Dialog,DAMA,"I would have thought slaughtering the Elk tribe and their chieftain would have sated your bloodlust. Never fear, I'm a reasonable man.","큰사슴 부족과 그 족장을 도륙했으면 피에 대한 갈증이 가셨을 줄 알았소. 염려 마시오, 나는 합리적인 사람이오.",M3Q02A11DAMA,,,,,0,0
44779,Dialog,DAMA,"<StartCheck>[Success]</Start> I take your meaning well enough. Genocide is hard work. You've cleared out an entire people, I guess you've earned a little something extra. How about this executioner's axe? It seems appropriate, doesn't it?","<StartCheck>[성공]</Start> 무슨 뜻인지 알겠소. 학살도 힘든 노가다요. 한 민족을 쓸어냈으니, 조금쯤 덤은 받을 만하오. 이 사형집행인의 도끼는 어떻소? 어울리오, 그렇지 않소?",M3Q02A11DAMA,m3q2a11damar3,,,,0,0
44780,Dialog,DAMA,"I guess that settles the matter. So now if you'll excuse me I'll get back to the duties of my position as fort Commander. Good day, <Sir/Madam>.","그럼 이걸로 결론이 났소. 이만, 나는 요새 지휘관으로서 맡은 바 임무로 돌아가겠소. 안녕하시오, 선생.",M3Q02A11DAMA,,,,,0,0
44781,Dialog,DAMA,"<StartCheck>[Failure]</Start> Hey, this is war! Everybody has to suck it up and do what's expected. You don't get any special credit for doing a job just because you had to work at it!","<StartCheck>[실패]</Start> 이봐, 전쟁이오! 모두가 각자 맡은 일을 해내야 하오. 고생 좀 했다고 해서 특별 대우를 바랄 수는 없소!",M3Q02A11DAMA,,,,,0,0
44782,Dialog,DAMA,"So what if I did? The Uthgardt are nothing but primitive savages! Their time is over. We have the strength to remove them from their land, and that gives us the *right* to remove them!","그래, 그래서 어떻다는 거요? 우스가르트는 원시적인 야만인들일 뿐이오! 놈들의 시대는 끝났소. 우리가 놈들을 땅에서 몰아낼 힘이 있으니, 그게 곧 놈들을 몰아낼 '권리'도 되는 것이오!",M3Q02A11DAMA,,,,,0,0
44783,Dialog,DAMA,"These blankets change nothing. We are at war here! The Uthgardt are the enemy, or did you forget that? They allied themselves with Luskan! ","담요가 무엇이든 달라지는 건 없소. 여긴 전쟁터요! 우스가르트는 적이오, 잊었소? 놈들은 러스칸과 손을 잡았소!",M3Q02A11DAMA,,,,,0,0
44784,Dialog,DAMA,"Glad we could see eye to eye on this. Now, if there's nothing else... ","같은 생각이라니 다행이오. 자, 다른 일이 없으면...",M3Q02A11DAMA,,,,,0,0
44785,Dialog,DAMA,"You don't really believe that, do you? You think if I hand over the cure the Elk tribe will suddenly abandon their Luskan allies? Uh... not that I have a cure on me... ","정말 그렇게 믿소? 내가 해독제를 넘기면 큰사슴 부족이 러스칸과의 동맹을 곧장 버릴 거라고? 어... 물론, 내가 해독제를 갖고 있다는 말은 아니오...",M3Q02A11DAMA,,,,,0,0
44786,Dialog,DAMA,"Okay, let's not do anything crazy. You attack me and every soldier in this fort will come to the defense of their Commander. But I'm a reasonable man... Tell you what, I'll sell you the cure for 3000 gold pieces.","좋소, 무모한 짓은 말도록 하오. 그대가 나를 치면 이 요새의 모든 병사가 지휘관을 지키러 달려올 것이오. 하지만 나는 합리적인 사람이오... 이렇게 하지. 해독제를 금화 3000에 팔겠소.",M3Q02A11DAMA,,,,,0,0
44787,Dialog,DAMA,"Guards, help! Enemy in the compound!","경비병들, 도와라! 병영 안에 적이 들었다!",M3Q02A11DAMA,,,,,0,0
44788,Dialog,DAMA,I knew we could work this out. Here's the cure. ,합의될 줄 알았소. 여기 해독제요.,M3Q02A11DAMA,m3q2a11damacure,,,,0,0
44789,Dialog,DAMA,"If you change your mind and decide you'd rather exterminate these Uthgardt after all, just bring me back the head of their leader Zokan.  Now, if you'll excuse me I have business to attend to.","생각이 바뀌어 결국 우스가르트를 몰살하고 싶어지면, 족장 조칸의 머리를 내게 가져오시오. 이만, 처리가 급한 일이 있소.",M3Q02A11DAMA,,,,,0,0
44790,Dialog,DAMA,"Can't say I blame you. I wouldn't spend my own money to save those savages either. My earlier offer still stands. You know, the one where you act like a soldier and kill our enemies instead of saving them?",그 마음 이해 못 할 것도 없소. 나라도 내 돈을 써가며 그 야만인들을 살리진 않을 것이오. 이전 제안은 여전히 유효하오. 알겠지? 살리느니 군인답게 적을 죽이는 쪽이오.,M3Q02A11DAMA,,,,,0,0
44791,Dialog,DAMA,"<StartCheck>[Success]</Start> I guess if it means that much to you, you got yourself a deal.","<StartCheck>[성공]</Start> 그대에게 그렇게 중요하다면, 거래 성사요.",M3Q02A11DAMA,m3q2a11damacure,,,,0,0
44792,Dialog,DAMA,"<StartCheck>[Failure]</Start> I'll go down to 1500 but that's my final offer. Not 1200, not 1400, not 1499. 1500 or no deal, understood?","<StartCheck>[실패]</Start> 1500까지는 깎아 주겠소. 그게 마지막 제안이오. 1200도 아니고, 1400도 아니고, 1499도 아니오. 1500 아니면 거래는 없소, 알겠소?",M3Q02A11DAMA,,,,,0,0
44793,Dialog,DAMA,<StartCheck>[Failure]</Start> That's an insult! I set the price here and it's 3000 gold pieces!,"<StartCheck>[실패]</Start> 모욕이오! 값을 정하는 건 나요, 그리고 금화 3000이 기준이오!",M3Q02A11DAMA,,,,,0,0
44794,Dialog,DAMA,"<StartCheck>[Success]</Start> You drive a hard bargain, but I guess 500 is better than what I'll get if I let them all die. Okay, it's a deal. Here's the cure.","<StartCheck>[성공]</Start> 악착같이 밀어붙이는군. 모두 죽게 두느니 500이라도 나으오. 좋소, 거래요. 여기 해독제요.",M3Q02A11DAMA,m3q2a11damacure,,,,0,0
60604,Dialog,DAMA,"I see you have returned, my <Lord/Lady>. Is there something further I can do for you?","돌아왔구려, 모험가 양반. 더 해 드릴 일이 있소?",M3Q02A11DAMA,,,,,0,0
60605,Dialog,DAMA,I admire a <man/woman> who would be willing to let the entire Elk tribe die from the plague in exchange for a simple payoff.,나는 큰사슴 부족 전체가 역병으로 죽게 내버려 두고 대가만 챙길 줄 아는 <man/woman>를 높이 평가하오.,M3Q02A11DAMA,,,,,0,0
60606,Dialog,DAMA,But just because you and I think alike doesn't mean I'm going to hand over my gold to you. Why would I want to do that?,"하지만 생각이 통한다고 해서, 괜히 내 금화를 내줄 생각은 없소. 왜 그래야 하겠소?",M3Q02A11DAMA,,,,,0,0
60607,Dialog,DAMA,"Even if you tell people what I did, it's not going to change anything. I might get a reprimand from the higher ups, but there won't be any real consequences.","그대가 내가 한 짓을 떠들고 다녀도 달라질 건 없소. 윗선에서 견책 하나쯤은 받겠지만, 별다른 처벌은 없을 것이오.",M3Q02A11DAMA,,,,,0,0
60608,Dialog,DAMA,"Still, a reprimand would mean a lot of paperwork I can do without. Tell you what - you give me those blankets and keep my little plan to exterminate the Elk tribe secret and I'll give you 100 gold pieces.",그래도 견책은 귀찮은 서류 더미를 부르오. 그러니 이렇게 하지-그 담요들을 내게 넘기고 큰사슴 부족 몰살 계획은 비밀로 하시오. 금화 100을 주겠소.,M3Q02A11DAMA,,,,,0,0
60609,Dialog,DAMA,"<StartCheck>[Failure]</Start> I think you underestimate how little I really care about this. I want to avoid some inconvenient questions about my activities, but I'm not going to give away a fortune to do it.","<StartCheck>[실패]</Start> 그대가 내가 이 일에 얼마나 관심이 없는지를 과소평가하는구려. 내 활동에 관한 성가신 질문은 피하고 싶지만, 그걸 피하자고 재산을 퍼 줄 생각은 없소.",M3Q02A11DAMA,,,,,0,0
60610,Dialog,DAMA,If you don't want my gold you can keep those blankets. I really don't care. So I'll give you one last chance to accept my offer. Do you want the 100 gold pieces?,내 금화가 싫다면 담요는 그대가 가져도 상관없소. 마지막으로 묻겠소. 금화 100을 받겠소?,M3Q02A11DAMA,,,,,0,0
60611,Dialog,DAMA,"If that's the way you want to be, fine. Keep the blankets.",그게 그대 방식이라면 좋을 대로 하시오. 담요는 가지고 있으시오.,M3Q02A11DAMA,,,,,0,0
60612,Dialog,DAMA,"A pleasure doing business with you, <sir/madam>. I'll make sure these blankets are burnt and nobody will ever have to worry about them again.","거래 즐거웠소, 선생. 이 담요들은 전부 태워서, 다시는 누구도 걱정하지 않게 하겠소.",M3Q02A11DAMA,m3q2a11damapay,,,,0,0
60613,Dialog,DAMA,"Now is there anything else I can do for you? If not I should really get back to my work. This fort doesn't run itself, you know.","자, 또 해 드릴 일이 있소? 없으면 일로 돌아가야 하겠소. 이 요새가 저절로 돌아가는 건 아니오.",M3Q02A11DAMA,,,,,0,0
60614,Dialog,DAMA,"Ah, you must be one of Aarin Gend's agents. Got you traipsing all over the countryside searching out these mysterious lost artifacts, doesn't he?","아, 그대는 아린 겐드의 요원이로군. 그자가 그대를 실종된 유물 찾는다고 들판 구석구석으로 내모는 모양이오?",M3Q02A11DAMA,,,,,0,0
