StrRef,SpeakerType,SpeakerName,TextEng,Text,DLG,Scripts,Conditions,DialogueContext,SoundRef,VolumeVariance,PitchVariance
60615,Dialog,DAMA,"Sounds like a fool's errand to me. This war will be won with soldiers, not these so called Words of Power.","내게는 허탕치는 심부름으로 들리는구려. 이 전쟁은 병사들이 이기는 것이지, 이른바 '권능의 언령' 따위로 이기는 게 아니오.",M3Q02A11DAMA,,,,,0,0
60616,Dialog,DAMA,"However, I wouldn't want anyone to think I'm being uncooperative with one of Aarin's agents. Have you searched those old ruins to the south? That's your best bet.",하지만 아린의 요원에게 비협조적이라는 소리는 듣고 싶지 않소. 남쪽의 오래된 폐허들을 뒤져 봤소? 거기가 가장 유력하오.,M3Q02A11DAMA,,,,,0,0
60617,Dialog,DAMA,"Really? Well, then I guess I can't be much help to you then. Those old ruins way to the south are the only place I know of that might have some kind of ancient magic.","정말이오? 그렇다면 더 도와줄 말은 없겠소. 내가 아는 한, 남쪽 먼 곳의 그 오래된 폐허만이 고대 마법이 있을 만한 곳이오.",M3Q02A11DAMA,,,,,0,0
60618,Dialog,DAMA,"So, I guess you'll be going now and letting me get back to commanding this fort.",그럼 이만 가보시오. 나는 이 요새를 지휘하러 돌아가야 하오.,M3Q02A11DAMA,,,,,0,0
60619,Dialog,DAMA,There's some deserted ruins in the land to the south of this fort. One of my scouting parties was down there and they came across some strange columns of magical light.,이 요새 남쪽 땅에는 버려진 폐허가 좀 있소. 정찰대가 내려갔다가 기묘한 마법의 빛기둥을 발견했다 하더이다.,M3Q02A11DAMA,,,,,0,0
60620,Dialog,DAMA,"Nearby they found a glowing cave entrance, and inside were some ancient ruins. Nobody seems to know who built them, but according to my scouts they didn't look like dwarven, elven or human architecture.","그 근처에서 빛나는 동굴 입구를 찾았고, 안에는 고대의 유적이 있었소. 누가 지었는지 아무도 모르지만, 내 정찰병들 말로는 드워프도, 엘프도, 인간도 아닌 양식이었다 하오.",M3Q02A11DAMA,,,,,0,0
60621,Dialog,DAMA,"Like I said, I think these Words of Power are a waste of time. But if you're determined to search them out I'd suggest you head south until you see those pillars of light. The glowing cave entrance should be just east of there.","말했듯이, 그 '권능의 언령'은 시간 낭비라고 보오. 그래도 찾을 작정이라면 남쪽으로 내려가 빛의 기둥을 찾으시오. 빛나는 동굴 입구는 바로 그 동쪽에 있을 것이오.",M3Q02A11DAMA,,,,,0,0
68343,Dialog,DAMA,"Ah, welcome back, my <Lord/Lady>. Do you bring me news of Zokan Thunderer? Is the Uthgardt chieftain dead?","아, 잘 돌아왔소, 모험가 양반. 천둥의 조칸의 소식을 가져왔소? 우스가르트 족장은 죽었소?",M3Q02A11DAMA,,,,,0,0
68344,Dialog,DAMA,"You are back, my <Lord/Lady>. Do you bring me news of the Uthgardt sub-chieftan, or is there something else you need? ","돌아왔구려, 모험가 양반. 우스가르트 하위족장의 소식을 가져왔소, 아니면 다른 볼일이 있소?",M3Q02A11DAMA,,,,,0,0
68345,Dialog,DAMA,"Yes, my <Lord/Lady>, what can I do for you? Have you come to report on the six catapults bombarding the Fort, or is there something else you need? ","예, 모험가 양반. 무엇을 도와드리오? 요새를 퍼붓던 투석기 여섯 대에 대한 보고요, 아니면 다른 용무요?",M3Q02A11DAMA,,,,,0,0
68346,Dialog,DAMA,Why have you come back? I already gave you the cure for the Elk tribe - what more do you want from me?,왜 돌아왔소? 큰사슴 부족에게 줄 해독제는 이미 넘겼잖소-아직 더 무엇을 원하오?,M3Q02A11DAMA,,,,,0,0
