StrRef,SpeakerType,SpeakerName,TextEng,Text,DLG,Scripts,Conditions,DialogueContext,SoundRef,VolumeVariance,PitchVariance
59366,Dialog,FRMER,"Aye? I'll answer whatever I can, <lad/lass>.","그래? 할 수 있는 대로 답해주지, <lad/lass>.",M2Q5A04FRMER,,,,,0,0
59367,Dialog,FRMER,"Fair enough. Like I said, I'll give you what reward I can, if you help me out. It's the same offer I've made to any other adventurer that's come by.","좋아. 말했듯이, 날 도와주면 할 수 있는 만큼 보상하겠네. 여기 들른 다른 모험가들에게도 똑같이 제안했지.",M2Q5A04FRMER,,,,,0,0
59368,Dialog,FRMER,"I... I certainly hope so, <lad/lass>. It all depends on what Dergiab wants with his prisoners. I've braced myself for the worst, to be honest.","나... 나도 그러길 바라네, <lad/lass>. 데지압이 포로들을 어떻게 하려는지에 달려 있지. 솔직히 말해서, 최악의 상황에 대비하고 있어.",M2Q5A04FRMER,,,,,0,0
59369,Dialog,FRMER,"A cult? You mean in connection to Dergiab and these creatures? Hmm. Can't say that I do, really... though that'd explain Dergiab's sudden ambition.",사교도라고? 데지압이랑 그 생명체들과 관련이 있다는 말인가? 흠. 솔직히 모르겠는데... 하지만 그게 데지압의 갑작스런 야심을 설명해 주긴 하겠군.,M2Q5A04FRMER,,,,,0,0
59370,Dialog,FRMER,"To be honest, I always thought Dergiab fashioned himself as a bit of a god amongst them other monsters. I'd be surprised if he allied with anyone else. You never know, however.","솔직히 말해서, 데지압은 항상 자신을 다른 괴물들 사이에서 신처럼 여기고 있다고 생각했어. 다른 누구와 동맹을 맺었다면 놀랄 일이지. 하지만 알 수는 없는 일이고.",M2Q5A04FRMER,,,,,0,0
59371,Dialog,FRMER,"There's a few of them spread out in the hills. They all connect together underground in a large warren, however... be sure you don't get lost.",언덕 곳곳에 몇 개 퍼져 있지. 하지만 모두 지하에서 거대한 미로로 연결되어 있어... 길을 잃지 않도록 조심하게.,M2Q5A04FRMER,,,,,0,0
59372,Dialog,FRMER,There's one entrance in the hills just north of here. Most like Dergiab's followers will find you before you find them.,여기서 바로 북쪽 언덕에 입구가 하나 있어. 아마 데지압의 추종자들이 자네가 그들을 찾기 전에 자네를 찾을 거야.,M2Q5A04FRMER,,,,,0,0
59373,Dialog,FRMER,"Well, he's an ogre mage... smarter than his brutish cousins and a fair bit more powerful, too. He can become invisible and has plenty of spells, I'd say.","음, 오우거 마법사지... 야만적인 사촌들보다 더 똑똑하고 훨씬 더 강력해. 투명해질 수 있고 주문도 많이 쓸 수 있어.",M2Q5A04FRMER,,,,,0,0
59374,Dialog,FRMER,"Dergiab's led a lot of the other creatures for quite some time, now. Never been brave enough to really do anything drastic, however... I'm not sure why he would start now.",데지압은 꽤 오랫동안 다른 생명체들 중 많은 것들을 이끌어 왔어. 하지만 정말로 뭔가 과감한 일을 할 만큼 대담하진 않았는데... 왜 지금 시작했는지 모르겠어.,M2Q5A04FRMER,,,,,0,0
59375,Dialog,FRMER,"To be honest, I haven't much left from my adventuring days. I'd be happy to offer what gold I have, though, to have some proof of what happened to my wife... or, better yet, to have her returned.","솔직히 말해서, 모험가 시절의 재산이 많이 남아있지 않네. 하지만 내 아내에게 무슨 일이 일어났는지 증거를 가져오거나... 더 좋게는, 그녀를 되찾아 준다면 가진 금화를 기꺼이 주겠어.",M2Q5A04FRMER,,,,,0,0
59376,Dialog,FRMER,"I'd also offer gold for Dergiab's head, to know for sure that he won't be pestering anyone else in these parts. I know it's not much... chances are Dergiab will have plenty to loot, himself.","데지압의 머리에도 금화를 주겠네, 그놈이 이 지역 사람들을 더 이상 괴롭히지 않을 거라 확신하기 위해서. 많지 않다는 건 알아... 아마 데지압 자신에게서 약탈할 게 많을 거야.",M2Q5A04FRMER,,,,,0,0
59377,Dialog,FRMER,"Aye, a few have passed this way and headed into the hills to check out the creatures for themselves. None have returned, I'm afraid to say.","그래, 몇 명이 이곳을 지나 언덕으로 가서 직접 생명체들을 확인했지. 유감스럽게도 아무도 돌아오지 않았어.",M2Q5A04FRMER,,,,,0,0
59378,Dialog,FRMER,"Farming, mostly. Though to be perfectly honest, there hasn't been much of that since this area became so dangerous.","주로 농사일이지. 하지만 완전히 솔직히 말하면, 이 지역이 이렇게 위험해진 이후로는 별로 하지 못했어.",M2Q5A04FRMER,,,,,0,0
59379,Dialog,FRMER,"It wasn't always this way, of course. In recent days it seems like the entire north is under siege. All us common folk can try to do is help each other as much as we can.",물론 항상 이랬던 건 아니야. 최근엔 북부 전체가 포위당한 것 같아. 우리 평범한 사람들이 할 수 있는 건 서로를 최대한 도우려고 노력하는 것뿐이지.,M2Q5A04FRMER,,,,,0,0
59380,Dialog,FRMER,"He did, did he? He's a fine lad, he is. I expect, then, that you're some manner of adventurer that he thought could help us, aye?","그랬단 말인가? 좋은 아이야. 그렇다면, 자네는 아들이 우리를 도울 수 있다고 생각한 어떤 종류의 모험가겠군?",M2Q5A04FRMER,,,,,0,0
59381,Dialog,FRMER,"I didn't mean to imply that you'd agreed to anything, <lad/lass>. I'm just pleased that you've come. Let me explain what's been happening, here.","자네가 뭔가에 동의했다고 암시하려던 건 아니야, <lad/lass>. 와줘서 기쁠 뿐이지. 여기서 무슨 일이 벌어지고 있는지 설명하지.",M2Q5A04FRMER,,,,,0,0
59382,Dialog,FRMER,"It's a dangerous thing to ask of anyone, but it might be worth your while, <lad/lass>. Let me fill you in, in case the boy didn't.","누구에게든 요청하기엔 위험한 일이지만, 자네한테는 가치가 있을 거야, <lad/lass>. 아들이 말하지 않았을 경우를 대비해서 설명해 주지.",M2Q5A04FRMER,,,,,0,0
59383,Dialog,FRMER,"Well, now, that's a bit of a tale. I'm surprised the boy didn't fill you in.","음, 좀 긴 얘기거든. 아들이 설명하지 않았다니 놀랍네.",M2Q5A04FRMER,,,,,0,0
