StrRef,SpeakerType,SpeakerName,TextEng,Text,DLG,Scripts,Conditions,DialogueContext,SoundRef,VolumeVariance,PitchVariance
82522,Creature,Garrick Halassar,"With luck, the woman will not know how to activate it, either. Anything else?","운이 좋으면 그 여자도 활성화 방법을 모를 거예요. 다른 건요?",Q5B_GARRICK,,,,,0,0
82523,Creature,Garrick Halassar,"Once you get in the ruins, you will have to find your way down. The portal room was the last place we reached, so you should be able to find it, if you just keep moving.","유적에 들어가면 아래로 가는 길을 찾아야 해요. 차원문 방은 우리가 마지막으로 도달한 곳이니, 계속 이동하면 찾을 수 있을 거예요.",Q5B_GARRICK,,,,,0,0
82524,Creature,Garrick Halassar,"That is probably a good idea anyways, since the ruins may still be crawling with those demonic creatures. Anything else?","어쨌든 좋은 생각이에요, 유적에 아직 그 악마 놈들이 우글거릴 수 있으니까요. 다른 건요?",Q5B_GARRICK,,,,,0,0
82525,Creature,Garrick Halassar,"There is an entrance in the cliff face north of the temple... go through it and make your way to the Valley of Winds. We marked it well, so it shouldn't be too difficult to find. Anything else?","신전 북쪽 절벽 면에 입구가 있어요... 그곳을 통과해서 바람의 계곡으로 가세요. 잘 표시해뒀으니 찾기 어렵지 않을 거예요. 다른 건요?",Q5B_GARRICK,q5a_at_garrick1,,,,0,0
82526,Creature,Garrick Halassar,I am still getting ready. I warned you that this could take a while.,"아직 준비 중이에요. 시간이 좀 걸릴 수 있다고 말씀드렸잖아요.",Q5B_GARRICK,,,,,0,0
82527,Creature,Garrick Halassar,"Take the mythallar, go to the excavation site and find the portal room in the ruins. Stop the hooded woman from going through... and if she has already gone, you must follow her.","미살라를 가지고 발굴지로 가서 유적의 차원문 방을 찾으세요. 두건 쓴 여자가 통과하지 못하게 막고... 이미 갔다면 뒤따라 가셔야 해요.",Q5B_GARRICK,,,,,0,0
82528,Creature,Garrick Halassar,"Try to find out how to use the mythallar to defeat this demoness. It is a tall order, but I am sure you can do it. I will keep trying to reach Drogan for help.","미살라로 이 악마 여자를 물리치는 방법을 찾아보세요. 어려운 일이지만, 해내실 수 있을 거예요. 저는 계속 드로건에게 도움을 요청해볼게요.",Q5B_GARRICK,,,,,0,0
82529,Creature,Garrick Halassar,I hope Drogan found you. *Whew* I am exhausted! Good luck with everything.,"드로건이 당신을 찾았길 바라요. *휴* 지쳤네요! 모든 일에 행운을 빕니다.",Q5B_GARRICK,,,,,0,0
82994,Creature,Garrick Halassar,Garrick,가릭,Q5B_GARRICK,,,,,0,0
82995,Creature,Garrick Halassar,Halassar,할라사르,Q5B_GARRICK,,,,,0,0
