StrRef,SpeakerType,SpeakerName,TextEng,Text,DLG,Scripts,Conditions,DialogueContext,SoundRef,VolumeVariance,PitchVariance
77338,Henchman,Henchman_DOR,"I was the upstart that made the clan elders all huffy, and she wanted to be like me. She thought all it took was going against what they said.","내가 씨족 장로들을 화나게 한 반항아였고, 그녀는 나처럼 되고 싶어 했어. 그들이 말한 것에 반대만 하면 된다고 생각했지.",DOR,,,,,0,0
77339,Henchman,Henchman_DOR,She never wanted to cause any harm... it all just got blown out of proportion.,그녀는 누구를 해치고 싶지 않았어... 그냥 다 과장되게 불어난 거야.,DOR,,,,,0,0
77340,Henchman,Henchman_DOR,Her name? I'll get to that. I have to say a few other things first to make it clear what happened. It was such a little thing.,그녀 이름? 그건 나중에 말할게. 무슨 일이 있었는지 명확히 하려면 먼저 몇 가지를 말해야 해. 정말 사소한 일이었거든.,DOR,,,,,0,0
77341,Henchman,Henchman_DOR,It's hard to accept that she was punished over so little a thing. It seems so pointless... so sad.,그녀가 그렇게 사소한 일로 처벌받았다는 걸 받아들이기 힘들어. 너무 무의미해 보여... 너무 슬퍼.,DOR,,,,,0,0
77342,Henchman,Henchman_DOR,I am. Just give me time. It's hard to accept that she was punished over so little a thing. It seems so pointless.,그래. 시간만 줘. 그녀가 그렇게 사소한 일로 처벌받았다는 걸 받아들이기 힘들어. 너무 무의미해 보이거든.,DOR,,,,,0,0
77343,Henchman,Henchman_DOR,"I followed the spiritual path. Trickery too, but spiritual. She was all blades and glory. She wanted to follow our father into the elite guard.","난 영적인 길을 따랐어. 속임수도, 하지만 영적으로. 그녀는 온통 칼날과 영광이었지. 우리 아버지를 따라 정예 경비대에 들어가고 싶어 했어.",DOR,,,,,0,0
77344,Henchman,Henchman_DOR,"There was no obvious sign that this should be tolerated, not like in my case, so the elders forbade it. She sought training anyway.","이걸 용인해야 할 명백한 징후가 없었어, 내 경우처럼은. 그래서 장로들이 금지했지. 그녀는 어쨌든 훈련을 받았어.",DOR,,,,,0,0
77345,Henchman,Henchman_DOR,"When it was discovered that she had ""defied what was best for her,"" she was banished for a time to learn what she had lost.","그녀에게 최선인 것을 거역했다는 게 발각되자, 그녀는 잃은 걸 배우라고 한동안 추방당했어.",DOR,,,,,0,0
77346,Henchman,Henchman_DOR,"Perhaps, but not at the time. She made a life as an adventurer but there were unforeseen consequences.","그럴지도 모르지만, 그땐 아니었어. 그녀는 모험가로 살았지만 예상 못 한 결과들이 있었어.",DOR,,,,,0,0
77347,Henchman,Henchman_DOR,"She would have said the same thing. She managed as an adventurer for a while, but there were unforeseen consequences.","그녀도 같은 말을 했을 거야. 한동안 모험가로 버텼지만, 예상 못 한 결과들이 있었어.",DOR,,,,,0,0
77348,Henchman,Henchman_DOR,Much more. She made a life as an adventurer but... there were unforeseen consequences.,훨씬 더. 그녀는 모험가로 살았지만... 예상 못 한 결과들이 있었어.,DOR,,,,,0,0
77349,Henchman,Henchman_DOR,Suffice it to say that all did not go well and in the end I decided I felt better away from certain... influences. I hope you understand.,"간단히 말하면 모든 게 잘 풀리지 않았고, 결국 특정... 영향에서 멀어지는 게 낫다고 느꼈어. 이해해줬으면 해.",DOR,,,,,0,0
77350,Henchman,Henchman_DOR,"Maybe you're right, but that doesn't mean I want to run at the mouth for an hour. This isn't the most pleasant of memories.","네 말이 맞을지도 모르지만, 그렇다고 한 시간 동안 떠들고 싶진 않아. 이건 가장 즐거운 기억은 아니거든.",DOR,,,,,0,0
77351,Henchman,Henchman_DOR,I shouldn't be telling you anything really. We dwarves are not used to sharing. Maybe I've been on the surface too long.,사실 아무것도 말하지 말아야 해. 우리 드워프들은 공유하는 데 익숙하지 않거든. 지상에 너무 오래 있었나 봐.,DOR,,,,,0,0
77352,Henchman,Henchman_DOR,"In any case, I'm done talking for now. Maybe later.","어쨌든, 일단 얘기는 여기까지. 나중에 할지도.",DOR,,,,,0,0
77353,Henchman,Henchman_DOR,"Ah, I just need some time to figure it all out. I've been avoiding this subject for quite a while now. Just give me a little time.","아, 그냥 다 정리할 시간이 좀 필요해. 이 주제를 꽤 오래 피해왔거든. 시간만 좀 줘.",DOR,,,,,0,0
77354,Henchman,Henchman_DOR,"We'll talk again, I'm sure.","다시 얘기하겠지, 분명히.",DOR,,,,,0,0
77355,Henchman,Henchman_DOR,"I didn't give it up, I've just chosen not to use it for now. It was a very personal decision. I'm not sure I could make you understand.","포기한 게 아냐, 지금은 쓰지 않기로 선택한 것뿐이야. 아주 개인적인 결정이었어. 네가 이해하게 만들 수 있을지 모르겠어.",DOR,,,,,0,0
77356,Henchman,Henchman_DOR,"You see, dwarven surnames are granted by the clan elders. You must honor it or be stripped of it and exiled.","있잖아, 드워프 성은 씨족 장로들이 부여하는 거야. 그걸 명예롭게 여기지 않으면 박탈당하고 추방돼.",DOR,,,,,0,0
77357,Henchman,Henchman_DOR,"I couldn't abide by some of the decisions of the elders, so I have chosen to not associate with them. It was... not an easy thing to do.","장로들의 일부 결정을 따를 수 없어서, 그들과 연관되지 않기로 선택했어. 그건... 쉬운 일이 아니었어.",DOR,,,,,0,0
77358,Henchman,Henchman_DOR,"What would you know of it? I can try and explain, but I don't think I'll want to cover it all at once. It was not a good time in my life.","네가 뭘 알겠어? 설명해볼 순 있지만, 한 번에 다 다루고 싶진 않을 것 같아. 내 인생에서 좋은 시절이 아니었거든.",DOR,,,,,0,0
77359,Henchman,Henchman_DOR,I'd have to tell you a bit about myself to really explain. I don't think I want to go into everything all at once. It was not a good time in my life.,제대로 설명하려면 나에 대해 좀 말해야 해. 한 번에 다 털어놓고 싶진 않아. 내 인생에서 좋은 시절이 아니었거든.,DOR,,,,,0,0
77360,Henchman,Henchman_DOR,"See, I follow Vergadain, the Short Father, God of Wealth and Luck. It wasn't that long ago that females weren't allowed to be clerics in his service.","있잖아, 난 베르가데인, 작은 아버지, 부와 행운의 신을 따라. 얼마 전까지만 해도 여성은 그의 성직자가 될 수 없었어.",DOR,,,,,0,0
77361,Henchman,Henchman_DOR,"1358 DR saw a reordering of the gods and Vergadain began accepting us. Clan elders didn't like it, but they certainly couldn't say a god was wrong.","1358 DR에 신들의 재편이 있었고 베르가데인이 우릴 받아들이기 시작했어. 씨족 장로들은 마음에 안 들어 했지만, 신이 틀렸다고는 말할 수 없었지.",DOR,,,,,0,0
77362,Henchman,Henchman_DOR,"Most of the elders came to accept it over time, though there are those that shunned me from time to time. Nothing official, but it was evident.","대부분의 장로들은 시간이 지나면서 받아들였지만, 때때로 날 피하는 사람들도 있었어. 공식적이진 않았지만, 분명했지.",DOR,,,,,0,0
77363,Henchman,Henchman_DOR,"Oh, I really couldn't care less about being accepted by those old rock-pushers. No, there were other things that bothered me.","아, 난 그 늙은 바위 밀이들한테 인정받는 건 전혀 신경 안 써. 아니, 날 괴롭힌 건 다른 것들이었어.",DOR,,,,,0,0
77364,Henchman,Henchman_DOR,I didn't care about their opinion at all. There were... other things that caused me to walk away.,그들 의견은 전혀 신경 안 썼어. 날 떠나게 만든 건... 다른 것들이었어.,DOR,,,,,0,0
77365,Henchman,Henchman_DOR,"See, my family suffered for my forward thinking. I had a sister and she... had some trouble because of me.","있잖아, 내 가족이 내 진보적 사고 때문에 고통받았어. 여동생이 있었는데 그녀가... 나 때문에 곤란을 겪었지.",DOR,,,,,0,0
77366,Henchman,Henchman_DOR,"She didn't fare as well as I did. She was younger, you see, and she... well... maybe I should take a while to dig up what I really need to say.","그녀는 나만큼 잘 해내지 못했어. 더 어렸거든, 그리고... 음... 내가 정말 하고 싶은 말을 파내려면 시간이 좀 걸릴 것 같아.",DOR,,,,,0,0
77367,Henchman,Henchman_DOR,"This is not easy, <FirstName>. Look, if you want to hear this, give me a bit of time. If not, just don't ask again. It's that simple.","이거 쉽지 않아, <FirstName>. 봐, 이 얘길 듣고 싶으면 시간 좀 줘. 아니면, 다시 묻지만 마. 그렇게 간단해.",DOR,,,,,0,0
77368,Henchman,Henchman_DOR,"It is. Thank you for your patience, <FirstName>.","그래. 참아줘서 고마워, <FirstName>.",DOR,,,,,0,0
77369,Henchman,Henchman_DOR,"Then I am even less interested in telling you in a timely manner. Talk to me when you want to continue. If you don't, just keep walking.",그럼 적시에 말해줄 생각은 더욱 없어. 계속하고 싶을 때 얘기해. 아니면 그냥 계속 걸어.,DOR,,,,,0,0
77370,Henchman,Henchman_DOR,"As you know, being a dwarf yourself, dwarven surnames are granted by the clan elders. You must honor it or be stripped of it and exiled.","네가 알다시피, 너도 드워프니까, 드워프 성은 씨족 장로들이 부여하는 거야. 그걸 명예롭게 여기지 않으면 박탈당하고 추방돼.",DOR,,,,,0,0
77371,Henchman,Henchman_DOR,"Oh, that's nothing special. I had heard his reputation for training and that he was accepting students. You don't leave your clan without preparation, you know.","아, 그건 특별한 게 아냐. 그의 훈련 명성을 듣고 학생을 받는다는 걸 알았거든. 준비 없이 씨족을 떠나진 않잖아.",DOR,,,,,0,0
77372,Henchman,Henchman_DOR,That's not it at all. I don't expect you to understand. There were just some things that I couldn't support anymore.,전혀 그런 게 아냐. 네가 이해하리라 기대하진 않아. 더 이상 지지할 수 없는 것들이 있었을 뿐이야.,DOR,,,,,0,0
77373,Henchman,Henchman_DOR,I would have preferred to stay but... there were things I just couldn't support anymore. It's not something you will be able to understand.,머물고 싶었지만... 더 이상 지지할 수 없는 것들이 있었어. 네가 이해할 수 있는 건 아니야.,DOR,,,,,0,0
77374,Henchman,Henchman_DOR,"This dwarf would and did. I don't expect you to understand, even if we are the same race. There were things I couldn't support any more.",이 드워프는 그렇게 했고 그랬어. 같은 종족이어도 네가 이해하리라 기대하진 않아. 더 이상 지지할 수 없는 것들이 있었어.,DOR,,,,,0,0
77375,Henchman,Henchman_DOR,"I haven't really said I don't want to be a part of the clan, there are just a few things that have to get resolved before I go back.","씨족의 일부가 되고 싶지 않다고 정말 말한 건 아냐, 돌아가기 전에 해결해야 할 것들이 몇 가지 있을 뿐이야.",DOR,,,,,0,0
77376,Henchman,Henchman_DOR,It's not like that. My parents were very supportive of me. There were a few policies that I just couldn't agree with.,그런 게 아냐. 부모님은 날 아주 지지해주셨어. 동의할 수 없는 정책들이 몇 가지 있었을 뿐이야.,DOR,,,,,0,0
77377,Henchman,Henchman_DOR,"I wouldn't call it simple, no, but it had to be done. I didn't fit in with the way things were.",간단하다고는 안 할 거야. 하지만 해야 했어. 상황에 맞지 않았거든.,DOR,,,,,0,0
77378,Henchman,Henchman_DOR,"No, I left on my own accord. It was... well, it was just a matter of disagreeing with a few fundamental clan policies.","아니, 스스로 떠났어. 그건... 뭐, 몇 가지 근본적인 씨족 정책에 동의하지 않는 문제였어.",DOR,,,,,0,0
77379,Henchman,Henchman_DOR,It might seem a strong reaction... you'll notice that my chosen surname of Trapspringer isn't a traditional dwarven name. It was just something I had to do.,강한 반응처럼 보일지도... 내가 선택한 이름인 함정사냥꾼이 전통적인 드워프 이름이 아니라는 걸 알 거야. 해야만 했던 일이었어.,DOR,,,,,0,0
77380,Henchman,Henchman_DOR,"Not to a dwarf, it isn't. I'm not sure I can make you understand why I did this. Let's just get back to our job. We've important work to do.",드워프에게는 아니야. 내가 왜 이랬는지 네가 이해하게 만들 수 있을지 모르겠어. 그냥 일하러 가자. 중요한 일이 있잖아.,DOR,,,,,0,0
77381,Henchman,Henchman_DOR,"That's... my own business. I'm sorry, but I don't know if I'm ready to talk about it. Besides, we've got important things to do.","그건... 내 일이야. 미안하지만, 얘기할 준비가 됐는지 모르겠어. 게다가 중요한 일이 있어.",DOR,,,,,0,0
77382,Henchman,Henchman_DOR,"I suppose you think I was exiled and stripped of it. Well, no I wasn't. As hard as it is for you to understand, this was my choice.","내가 추방당하고 박탈당했다고 생각하겠지. 아니, 아니었어. 네가 이해하기 힘들겠지만, 이건 내 선택이었어.",DOR,,,,,0,0
77383,Henchman,Henchman_DOR,I really don't feel like continuing this conversation right now. Could we leave it for now? We've important work to do.,지금은 이 대화 계속하고 싶지 않아. 일단 놔둘 수 있을까? 중요한 일이 있거든.,DOR,,,,,0,0
77384,Henchman,Henchman_DOR,Talk to me some other time. Maybe I'll feel more like it then.,다음에 얘기해. 그때는 더 하고 싶을지도.,DOR,,,,,0,0
77385,Henchman,Henchman_DOR,"Well, all right, but don't keep me waiting too long. I want to help in this. ","좋아, 알았어, 근데 너무 오래 기다리게 하진 마. 이거 돕고 싶거든.",DOR,,,,,0,0
77386,Henchman,Henchman_DOR,"I'm right behind you. We'll have this wrapped up in no time. Relatively speaking, I mean. There's a lot to do.",바로 뒤에 있어. 금방 끝낼 거야. 상대적으로 말이야. 할 일이 많거든.,DOR,,,,,0,0
77387,Henchman,Henchman_DOR,I welcome being able to move again. A medusa... how do you fight that? Could you feel anything while turned to stone? I thought I felt cold... if I thought at all.,다시 움직일 수 있어서 다행이야. 메두사... 어떻게 싸워? 돌로 변했을 때 뭔가 느껴졌어? 추웠던 것 같은데... 생각이나 했다면 말이지.,DOR,x0_d1_meet,,,,0,0
77388,Henchman,Henchman_DOR,Does that seem right to you? It was so frightening. Wait... what is this collar you're wearing?,너도 그렇게 느껴? 너무 무서웠어. 잠깐... 네가 목에 찬 이 목걸이는 뭐야?,DOR,,,,,0,0
77389,Henchman,Henchman_DOR,Blast! I wish Master Drogan was here!,젠장! 드로건 스승님이 여기 계셨으면!,DOR,,,,,0,0
77390,Henchman,Henchman_DOR,I thought you always had a plan. Maybe you needed Master Drogan more than you are willing to admit.,넌 항상 계획이 있는 줄 알았어. 네가 인정하고 싶은 것보다 드로건 스승님이 더 필요한 거 아냐.,DOR,,,,,0,0
77391,Henchman,Henchman_DOR,Will it? I'd rather have him here in person. He had the skills to teach us; our abilities are just hand-me-downs.,그럴까? 직접 여기 계셨으면 좋겠어. 스승님은 우릴 가르칠 기술이 있으셨어. 우리 능력은 그저 물려받은 것뿐이야.,DOR,,,,,0,0
77392,Henchman,Henchman_DOR,"I am, and I think we would be better off with Master Drogan here. He gave his life so we could get trapped? I don't think so!","그래, 드로건 스승님이 여기 계시면 더 나을 것 같아. 우릴 가두려고 목숨을 바치신 거야? 그럴 리 없어!",DOR,,,,,0,0
77393,Henchman,Henchman_DOR,I'm sorry. It's just... we're in the most amazing city I've ever seen and all we've managed to do is get enslaved by the Asabi.,미안해. 그냥... 우리가 지금껏 본 중 가장 놀라운 도시에 있는데 고작 아사비한테 노예가 되는 일만 해냈잖아.,DOR,,,,,0,0
77394,Henchman,Henchman_DOR,I should be studying this place... scoping out what we can pocket. Instead I'm worrying like I'm still in my first pair of boots.,이곳을 연구하고... 우리가 챙길 수 있는 게 뭔지 둘러봐야 하는데. 대신 아직도 첫 신발 신었을 때처럼 걱정만 하고 있어.,DOR,,,,,0,0
77395,Henchman,Henchman_DOR,"I... of course, <FirstName>. I apologize. I just... miss Master Drogan so. The pain is still so fresh. But we have much to do, don't we?","나... 물론이지, <FirstName>. 미안해. 그냥... 드로건 스승님이 너무 그리워. 아직도 아픔이 생생해. 하지만 할 일이 많지, 그렇지?",DOR,,,,,0,0
77396,Henchman,Henchman_DOR,"No, that wouldn't help. Don't worry, I'm not going to start bawling. I just wanted some time to mourn, but I guess it has to wait.","아니, 그건 도움이 안 될 거야. 걱정 마, 울음 터뜨리진 않을 거야. 그냥 애도할 시간이 좀 필요했을 뿐인데, 기다려야 할 것 같네.",DOR,,,,,0,0
77397,Henchman,Henchman_DOR,"I know. I just want time to mourn Master Drogan, that's all. It shouldn't have to wait, but I guess it has to.","알아. 그냥 드로건 스승님을 애도할 시간이 필요할 뿐이야. 기다릴 필요는 없어야 하는데, 어쩔 수 없나 봐.",DOR,,,,,0,0
77398,Henchman,Henchman_DOR,I'm ready. Just tell me what to do. We'll make it... I'm sure.,준비됐어. 뭘 하면 되는지만 말해줘. 해낼 거야... 확신해.,DOR,,,,,0,0
77399,Henchman,Henchman_DOR,"If you want to scout around, go ahead. I can wait here for a bit. It's not like there's a shortage of things to look at... or appraise.",주변을 정찰하고 싶으면 그렇게 해. 여기서 잠깐 기다릴 수 있어. 볼 것... 아니 감정할 것이 부족한 것도 아니니까.,DOR,,,,,0,0
77400,Henchman,Henchman_DOR,I'm right behind you. Keep on your toes... for danger and treasure both.,바로 뒤에 있어. 조심해... 위험과 보물 둘 다.,DOR,x0_d1_hen_hired,,,,0,0
77401,Henchman,Henchman_DOR,"And... thank you, <FirstName>, for saving me. Truly, I appreciate it.","그리고... 고마워, <FirstName>, 구해줘서. 정말, 고마워.",DOR,,,,,0,0
77402,Henchman,Henchman_DOR,"Just because I want to see the place doesn't mean I'll be distracted by it. Look, if you want me along, great. I don't really care one way or the other.","이곳을 보고 싶다고 해서 주의가 흐트러질 거라는 건 아냐. 봐, 날 데려가고 싶으면 좋아. 사실 어느 쪽이든 별로 상관없어.",DOR,,,,,0,0
77403,Henchman,Henchman_DOR,"More like an interest in this particular period. The Netherese disappeared so completely and suddenly, and it's still a mystery as to why.","이 시대에 대한 관심이라고 해야겠지. 네더릴인들이 너무 완전히, 갑자기 사라져서, 왜 그랬는지는 아직도 수수께끼거든.",DOR,,,,,0,0
77404,Henchman,Henchman_DOR,"Make no mistake, however. It's a passing interest and nothing I've dedicated myself to. This is human history we're talking about, after all.",하지만 오해하진 마. 지나가는 관심일 뿐이고 헌신한 건 아냐. 결국 인간 역사 얘기니까.,DOR,,,,,0,0
77405,Henchman,Henchman_DOR,"Still, it might be useful if we travel together. Whatever you find out here in this desert is bound to be as dangerous as it is intriguing.","그래도, 함께 여행한다면 유용할지도 몰라. 이 사막에서 네가 찾는 건 뭐든 위험한 만큼 흥미로울 거야.",DOR,,,,,0,0
77406,Henchman,Henchman_DOR,You too. Perhaps we should stick together... this seems a dangerous place.,너도 그래. 함께 가는 게 좋을 것 같아... 여기 위험해 보이거든.,DOR,,,,,0,0
77407,Henchman,Henchman_DOR,"As you will.  If you change your mind, I shouldn't be far off.",네 뜻대로. 마음 바뀌면 멀지 않을 곳에 있을게.,DOR,,,,,0,0
77408,Henchman,Henchman_DOR,I agree.  Stay alert... I smell trouble ahead.,동의해. 경계해... 앞에 문제가 있는 냄새가 나.,DOR,x0_d1_hen_hired,,,,0,0
77409,Henchman,Henchman_DOR,"If you're here to help Master Drogan, you'll need to get underway as soon as possible. Do you need my help?",드로건 스승님 돕기 위해 왔다면 가능한 한 빨리 출발해야 해. 내 도움이 필요해?,DOR,x0_d1_meet,,,vs_nx0dornf_057,0,0
77410,Henchman,Henchman_DOR,"You're only one <man/woman>. Would it hurt to have someone to watch your back? Come on, take me. I want to use what I've been taught.","넌 <man/woman> 한 명뿐이잖아. 누가 뒤를 봐주면 나쁠까? 어서, 날 데려가. 배운 걸 쓰고 싶단 말이야.",DOR,,,,,0,0
77411,Henchman,Henchman_DOR,"Well, you know me... if you need sharp eyes to watch for ambushes, or a nasty trap dealt with, I'm your girl.  What do you say?","뭐, 날 알잖아... 매복을 경계할 예리한 눈이나 골치 아픈 함정을 처리할 사람이 필요하면, 내가 딱이지. 어때?",DOR,,,,,0,0
77412,Henchman,Henchman_DOR,"Well, I'll be here once you've made up your mind.","뭐, 네 마음이 정해지면 여기 있을게.",DOR,,,,,0,0
77413,Henchman,Henchman_DOR,Great! We'll have Master Drogan's artifacts back in no time... and maybe pick up a coin or two for ourselves along the way. Let's go.,좋아! 드로건 스승님의 유물들을 금방 되찾을 거야... 그리고 어쩌면 가는 길에 우리도 한두푼 챙기고. 가자.,DOR,,,,,0,0
77414,Henchman,Henchman_DOR,There's no need to be like that. I'll just wait until you think you're ready. Yeesh.,그럴 필요는 없잖아. 준비됐다고 생각할 때까지 기다릴게. 쳇.,DOR,x0_d1_hen_inter0,,,,0,0
77415,Henchman,Henchman_DOR,"I suppose it can, but we should talk about a few things when there is time.","그럴 수 있지만, 시간 나면 몇 가지 얘기해야 할 것 같아.",DOR,x0_d1_hen_inter0,,,,0,0
77416,Henchman,Henchman_DOR,The farm... it seems familiar. Maybe from overhearing Master Drogan and one of his visitors.,농장이... 익숙해 보여. 어쩌면 드로건 스승님과 방문객 중 한 명 대화를 엿들은 것 같아.,DOR,x0_d1_hen_inter0,,,,0,0
77417,Henchman,Henchman_DOR,"Of course, you know all about it now, having talked with that Nathan Hurst character. The less said about him, I think, the better.","물론, 넌 이제 다 알겠지, 네이선 허스트라는 인물과 얘기했으니까. 그 사람에 대해선 말이 적을수록 좋을 것 같아.",DOR,,,,,0,0
77418,Henchman,Henchman_DOR,"Of course, what is one dwarf's opinion when a man has powerful friends? I don't care who he knows, Hurst is what he is and that's all I'll say.","물론, 강력한 친구가 있는 사람 앞에서 드워프 한 명 의견이 뭐가 중요하겠어? 누굴 아는지 상관없어, 허스트는 그 모습 그대로야. 그것만 말할게.",DOR,,,,,0,0
77419,Henchman,Henchman_DOR,Let's just get moving.,그냥 가자.,DOR,,,,,0,0
77420,Henchman,Henchman_DOR,"My tone and words both. I don't care who he knows, Hurst is what he is. Ah, I've already given him too much attention.","말투와 말 둘 다. 누굴 아는지 상관없어, 허스트는 그 모습 그대로야. 아, 벌써 너무 신경 쓰게 됐네.",DOR,,,,,0,0
77421,Henchman,Henchman_DOR,Hurst! Nathan Hurst. That's who lives there. I heard him and Master Drogan discussing something... he described how to get here in good detail.,허스트! 네이선 허스트. 거기 사는 사람이야. 스승님과 뭔가 논의하는 걸 들었는데... 여기 오는 법을 아주 자세히 설명하더라.,DOR,,,,,0,0
77422,Henchman,Henchman_DOR,A dwarf knows how to interpret directions and the lay of the land. This has to be the place.,드워프는 방향과 지형을 해석하는 법을 알거든. 여기가 그곳이 틀림없어.,DOR,,,,,0,0
77423,Henchman,Henchman_DOR,"I remembered it because of what he is, not because of what he said. Duergar. A deep-dwelling duergar out of his proper place.",그가 한 말 때문이 아니라 그가 뭔지 때문에 기억했어. 듀에가르. 제자리에 있지 않은 깊은 땅의 듀에가르.,DOR,,,,,0,0
77424,Henchman,Henchman_DOR,He is no dwarf. Duergar. A deep-dwelling duergar out of his proper place. Be careful near him.,그는 드워프가 아냐. 듀에가르. 제자리에 있지 않은 깊은 땅의 듀에가르야. 그 근처에서 조심해.,DOR,,,,,0,0
77425,Henchman,Henchman_DOR,They are the darker side of a history we would like to forget. Twisted by illithids they long ago became something evil... not to be trusted.,그들은 우리가 잊고 싶은 역사의 어두운 면이야. 일리시드에게 뒤틀린 그들은 오래전에 사악한 무언가가 됐어... 믿을 수 없지.,DOR,,,,,0,0
77426,Henchman,Henchman_DOR,"They live deep underground with the most foul of neighbors. Don't trust him, <FirstName>, you'll regret it.","그들은 가장 더러운 이웃들과 함께 지하 깊은 곳에 살아. 그를 믿지 마, <FirstName>, 후회할 거야.",DOR,,,,,0,0
77427,Henchman,Henchman_DOR,"Not as such, but it doesn't hurt to be on guard. His kind are naturally driven to evil. I didn't say to torch his farm, just that you should be careful.","그렇진 않지만, 경계하는 게 나빠질 건 없어. 그 종족은 자연스럽게 악으로 향하거든. 그의 농장을 불태우라고 한 건 아니야, 그냥 조심하라는 거지.",DOR,,,,,0,0
