StrRef,SpeakerType,SpeakerName,TextEng,Text,DLG,Scripts,Conditions,DialogueContext,SoundRef,VolumeVariance,PitchVariance
77428,Henchman,Henchman_DOR,"It's just a matter of fact that his kind are driven to the darker things in life. I didn't say we should torch his farm, just that you should be careful.","그 종족이 삶의 어두운 것들로 향한다는 건 사실이야. 그의 농장을 불태워야 한다고 한 건 아냐, 그냥 조심하라는 거지.",DOR,,,,,0,0
77429,Henchman,Henchman_DOR,"I'm glad. He's probably no threat, but we don't know what he's capable of. Just be careful, that's all I'm saying.","다행이야. 아마 위협은 아닐 거야, 하지만 그가 뭘 할 수 있는지 모르잖아. 조심하라는 것뿐이야.",DOR,,,,,0,0
77430,Henchman,Henchman_DOR,"He doesn't have to be *all* bad to hurt our mission. Just be careful, that's all I'm saying.",*완전히* 나쁘지 않아도 우리 임무를 방해할 수 있어. 조심하라는 것뿐이야.,DOR,,,,,0,0
77431,Henchman,Henchman_DOR,"Well, I was concerned a dragon wouldn't be enough trouble for us. Heh, it seems we are caught between some powerful players.","뭐, 용이 우리한테 충분한 곤란거리가 안 될까 봐 걱정했는데. 헤, 우리가 강력한 플레이어들 사이에 끼인 것 같네.",DOR,x0_d1_hen_inter0,,,,0,0
77432,Henchman,Henchman_DOR,Both J'Nah and Tymofarrar seem willing to go to any lengths to get Master Drogan's artifacts. I wish I knew what was really going on.,즈나와 티모파라르 둘 다 드로건 스승님의 유물을 얻기 위해 무슨 짓이든 할 것 같아. 진짜 무슨 일인지 알고 싶어.,DOR,,,,,0,0
77433,Henchman,Henchman_DOR,"Oh, I'm sure it all looks so neat and tidy when it's printed up in your journal. All the possible paths clearly laid out, hmm?","아, 네 일지에 인쇄되면 아주 깔끔하고 정돈돼 보일 거야. 가능한 모든 경로가 명확히 제시되겠지, 응?",DOR,,,,,0,0
77434,Henchman,Henchman_DOR,"Well, lead on, then. I won't give a thought to the little things, like why such powerful creatures are interested in that whelp Deekin and his statue.","그럼 이끌어. 난 사소한 것들, 왜 그렇게 강력한 생명체들이 저 꼬마 디킨과 그의 조각상에 관심 있는지 따위는 생각하지 않을게.",DOR,,,,,0,0
77435,Henchman,Henchman_DOR,"Just don't blame me if we run into more than we can handle. Dragons, artifacts, a dodgy sorceress... what's next?","우리가 감당할 수 없는 걸 만나도 날 탓하진 마. 용, 유물, 수상한 요술사... 다음은 뭐야?",DOR,,,,,0,0
77436,Henchman,Henchman_DOR,"Do we know who we are taking it from, or why? What do these powerful creatures want with that little Deekin fool and his statue?","누구한테서 가져가는 건지, 왜인지 알아? 이 강력한 생명체들이 저 작은 디킨 바보와 그의 조각상으로 뭘 하려는 거야?",DOR,,,,,0,0
77437,Henchman,Henchman_DOR,"Good. This J'Nah wasn't telling us everything, that's for sure. I wonder why there's so much more interest in that Deekin creature's statue?",좋아. 저 즈나가 모든 걸 말하지 않은 건 확실해. 왜 저 디킨 생명체의 조각상에 그렇게 많은 관심이 있는지 궁금해.,DOR,,,,,0,0
77438,Henchman,Henchman_DOR,"I don't like the thought that there's someone even further above us involved. Like that ""mistress"" we overheard J'Nah speaking to.","우리 위에 더 높은 누군가가 관련됐다는 생각이 싫어. 즈나가 얘기하는 걸 엿들은 그 ""여주인"" 같은.",DOR,,,,,0,0
77439,Henchman,Henchman_DOR,"Hey, I didn't say I was going anywhere. I just want to be careful. We have to find what we need and get home in one piece, right? Let's get going.","야, 어디 간다는 말은 안 했어. 그냥 조심하고 싶은 거야. 필요한 걸 찾아서 무사히 집으로 돌아가야 하잖아, 그렇지? 가자.",DOR,,,,,0,0
77440,Henchman,Henchman_DOR,"I'll follow, but the only thing that will stop me from worrying is finding what we need and getting back home.","따라갈게, 하지만 걱정을 멈추게 할 유일한 방법은 필요한 걸 찾아서 집으로 돌아가는 거야.",DOR,,,,,0,0
77441,Henchman,Henchman_DOR,It better serve a purpose or I'm losing sleep for nothing. Let's just find what we need and try to get home in one piece.,"목적이 있는 게 낫겠어, 아니면 헛되이 잠을 못 자는 거거든. 그냥 필요한 걸 찾아서 무사히 집에 가자.",DOR,,,,,0,0
77442,Henchman,Henchman_DOR,"I don't know that we can trust what this kobold said, no matter how smart or different he seems. His kind are usually pawns of greater evils.","이 코볼트가 한 말을 믿을 수 있을지 모르겠어, 아무리 똑똑하거나 달라 보여도. 그 종족은 보통 더 큰 악의 졸개거든.",DOR,x0_d1_hen_inter0,,,,0,0
77443,Henchman,Henchman_DOR,"Ah, so you view all your companions with equal suspicion, is that it? Does that apply to me as well? Do you trust me no further than this Deekin?","아, 그럼 모든 동료를 똑같이 의심한다는 거야? 나한테도 해당돼? 이 디킨만큼만 날 믿는 거야?",DOR,,,,,0,0
77444,Henchman,Henchman_DOR,I suppose it doesn't really matter either way. I'm just here to support you. Just remember that I've an interest in the outcome of this little adventure as well.,어느 쪽이든 별로 상관없는 것 같긴 해. 난 그냥 널 지원하기 위해 여기 있을 뿐이야. 그냥 이 작은 모험의 결과에 내 관심도 있다는 걸 기억해.,DOR,,,,,0,0
77445,Henchman,Henchman_DOR,"Even if he was being honest, does he really understand what he's talking about? He could lead you into a trap without knowing the danger.","솔직하다고 해도, 그가 정말 자기가 뭘 말하는지 이해하는 걸까? 위험을 모르고 널 함정으로 이끌 수도 있어.",DOR,,,,,0,0
77446,Henchman,Henchman_DOR,He talked of dragons as well. They don't give up their trinkets easily.,용 얘기도 하더라. 그것들은 보물을 쉽게 포기하지 않거든.,DOR,,,,,0,0
77447,Henchman,Henchman_DOR,"I don't know. I suppose we can follow his lead for a time, but don't let your guard down. He talked of dragons, and they don't give up their trinkets easily.","모르겠어. 한동안 그의 안내를 따라갈 수는 있지만, 경계를 늦추지 마. 용 얘기를 했잖아, 그것들은 보물을 쉽게 포기하지 않아.",DOR,,,,,0,0
77448,Henchman,Henchman_DOR,"That's called intelligence, you fool. It's a *dragon*! What else is there to fear if you don't fear giant, toothy, manipulating lizards?","그걸 지능이라고 하는 거야, 이 바보야. *용*이라고! 거대하고 이빨 많고 교활한 도마뱀을 안 두려워하면 뭘 두려워해?",DOR,,,,,0,0
77449,Henchman,Henchman_DOR,"That's easy enough to guess. Anyone it couldn't buy it would simply threaten. Not a lot of people can say ""no"" to a giant lizard. Not and live, anyway.","그건 충분히 짐작할 수 있어. 돈으로 살 수 없는 건 위협하면 되니까. 거대한 도마뱀한테 ""싫어""라고 말할 수 있는 사람은 많지 않아. 살아남으면서 말이지.",DOR,,,,,0,0
77450,Henchman,Henchman_DOR,"Well... no, but I've heard a few tales. I suppose my sources really aren't any more reliable than this creature. Still, this worries me.","뭐... 아니, 하지만 몇 가지 이야기는 들었어. 내 출처가 정말 이 생명체보다 더 신뢰할 만한 건 아닌 것 같긴 해. 그래도 이거 걱정돼.",DOR,,,,,0,0
77451,Henchman,Henchman_DOR,Why would this thing even be interested in the artifacts? I don't suppose there's any way to verify what this Deekin said.,이 생명체는 왜 유물에 관심이 있는 걸까? 이 디킨이 한 말을 확인할 방법은 없겠지.,DOR,,,,,0,0
77452,Henchman,Henchman_DOR,We'll have to move forward and trust we can handle what comes. I doubt Master Drogan thought we would be facing such creatures so early in our training.,앞으로 나아가면서 뭐가 와도 감당할 수 있을 거라 믿어야 해. 드로건 스승님은 우리가 훈련 초기에 이런 생명체들을 맞닥뜨릴 거라곤 생각 안 하셨을 거야.,DOR,,,,,0,0
77453,Henchman,Henchman_DOR,The crypt... even just inside you can smell the death in the air. I suppose that's appropriate but I'd still rather do without the memory of it.,무덤... 안으로 들어가기만 해도 공기에서 죽음 냄새가 나. 그게 적절하긴 하지만 그래도 그 기억은 없었으면 좋겠어.,DOR,x0_d1_hen_inter0,,,,0,0
77454,Henchman,Henchman_DOR,"Of course, if we get rich off the place, I'll still manage to sleep at night.","물론, 이곳에서 부자가 되면, 그래도 밤에 잘 수는 있을 거야.",DOR,,,,,0,0
77455,Henchman,Henchman_DOR,"Whoa, slow down. I'm not interested in gutting the place. I juts figure that any gold or gems are better off with me. It's an Elven crypt, after all.","워, 천천히. 이곳을 약탈할 생각은 없어. 그냥 금이나 보석은 나한테 있는 게 낫다는 거지. 어쨌든 엘프 무덤이잖아.",DOR,,,,,0,0
77456,Henchman,Henchman_DOR,"What does it hurt? It won't slow us down that much. Besides, any gold or gems are better off with me. It's an Elven crypt, after all.",뭐가 문제야? 그렇게 늦춰지진 않을 거야. 게다가 금이나 보석은 나한테 있는 게 낫거든. 어쨌든 엘프 무덤이잖아.,DOR,,,,,0,0
77457,Henchman,Henchman_DOR,"I wouldn't take everything, but if you are talking about gold and gems, I'm sure they are better off with me. It's an Elven crypt, after all.","전부 가져가진 않을 거야, 하지만 금과 보석 얘기라면, 나한테 있는 게 더 낫다고 확신해. 어쨌든 엘프 무덤이잖아.",DOR,,,,,0,0
77458,Henchman,Henchman_DOR,"Not as such, and I've no interest in whatever fanciful cloaks are draped over their dead, but mined valuables belong with dwarves.","그렇진 않고, 그들 죽은 자 위에 덮인 화려한 망토 따위엔 관심 없지만, 채굴한 가치 있는 것들은 드워프 것이야.",DOR,,,,,0,0
77459,Henchman,Henchman_DOR,"Consider it my way of keeping the Elves consistent. Elves don't dig. They excavate, sure, but they don't dig.","엘프를 일관되게 유지하는 내 방식이라고 생각해. 엘프들은 땅을 안 파. 발굴은 하지만, 땅은 안 파.",DOR,,,,,0,0
77460,Henchman,Henchman_DOR,It just seems to me that Elves shouldn't put these things back in the ground if they didn't take them out in the first place.,내 생각엔 엘프들이 애초에 꺼내지도 않은 걸 다시 땅에 묻으면 안 될 것 같아.,DOR,,,,,0,0
77461,Henchman,Henchman_DOR,"Now just a minute, I haven't done anything yet. I just think burying ""wealthy dead"" is a waste of good gold.","잠깐, 난 아직 아무것도 안 했어. 그냥 ""부유한 죽은 자""를 묻는 건 좋은 금의 낭비라고 생각할 뿐이야.",DOR,,,,,0,0
77462,Henchman,Henchman_DOR,There are far worse things to do to a burial site than taking excess gold. I'd hope the dead would understand that.,매장지에 할 수 있는 일 중엔 남는 금을 가져가는 것보다 훨씬 나쁜 일들이 있어. 죽은 자들도 이해할 거라 믿고 싶어.,DOR,,,,,0,0
77463,Henchman,Henchman_DOR,"Come on, let's just get on with our task at hand.","자, 그냥 당면 과제를 하자고.",DOR,,,,,0,0
77464,Henchman,Henchman_DOR,I don't mean any offense. It just seems to me that Elves shouldn't put these things back in the ground if they didn't take them out in the first place.,기분 나쁘게 하려는 건 아냐. 그냥 내 생각엔 엘프들이 애초에 꺼내지도 않은 걸 다시 땅에 묻으면 안 될 것 같아.,DOR,,,,,0,0
77465,Henchman,Henchman_DOR,I'm not looking for trouble. I'll keep to myself and let you lead. It just seems like a waste to me.,문제 일으킬 생각은 없어. 조용히 있으면서 네가 이끌게 할게. 그냥 낭비처럼 보일 뿐이야.,DOR,,,,,0,0
77466,Henchman,Henchman_DOR,"Well, think about it. I don't care if they drape their dead in fanciful cloaks or wood-carved whatever, but mined valuables belong with dwarves.","뭐, 생각해봐. 그들이 죽은 자를 화려한 망토나 나무 조각 뭐시기로 덮든 상관없지만, 채굴한 가치 있는 것들은 드워프 것이야.",DOR,,,,,0,0
77467,Henchman,Henchman_DOR,"I just had a flash of memory as we entered Hilltop... it's a lot different now, that's for sure. Kobolds everywhere. Must have been a big fight.",힐탑에 들어서면서 기억이 번쩍 떠올랐어... 지금은 정말 많이 달라졌네. 코볼트가 도처에. 큰 싸움이 있었나 봐.,DOR,x0_d1_hen_inter0,,,,0,0
77468,Henchman,Henchman_DOR,"Fine, I'll shut up, but you should spend a little time looking around, <FullName>. It's important to remember things like this.","좋아, 입 다물게, 하지만 주변 좀 둘러봐야 해, <FullName>. 이런 걸 기억하는 게 중요하거든.",DOR,,,,,0,0
77469,Henchman,Henchman_DOR,"I like a good dust-up as much as anyone but this wasn't a fair fight, and neither was the one back at the school.","난 누구만큼이나 격렬한 싸움을 좋아하지만 이건 공정한 싸움이 아니었어, 학교에서의 싸움도 마찬가지고.",DOR,,,,,0,0
77470,Henchman,Henchman_DOR,I don't think the people had much of a choice. They may have been on their home turf but I doubt they had Master Drogan's skill to draw on.,사람들은 선택의 여지가 별로 없었을 거야. 자기 터전에 있었어도 드로건 스승님의 기술을 쓸 순 없었을 거야.,DOR,,,,,0,0
77471,Henchman,Henchman_DOR,Nothing they could do but pick up a shovel and hope for the best. Looks like they did all right. Well... relatively. People still died.,삽을 들고 최선을 바라는 것 외엔 할 수 있는 게 없었어. 꽤 잘한 것 같네. 뭐... 상대적으로. 사람들은 여전히 죽었지만.,DOR,,,,,0,0
77472,Henchman,Henchman_DOR,"That's a bit cold to say. I mean, you're right that they could have been better trained, but this really isn't the time to say it.","좀 냉정한 말이야. 뭐, 더 잘 훈련받았어야 한다는 건 맞지만, 지금 그걸 말할 때는 정말 아냐.",DOR,,,,,0,0
77473,Henchman,Henchman_DOR,"You won't make any friends if you lecture while people are down. It all rolls off of me, but I doubt others will be so understanding.","사람들이 무너졌을 때 설교하면 친구 못 만들어. 난 다 넘기지만, 다른 사람들이 그렇게 이해해줄지 의심스러워.",DOR,,,,,0,0
77474,Henchman,Henchman_DOR,"Good idea. With this many attacking there'd have to be some hiding somewhere. We'll get our share, I don't doubt it.","좋은 생각이야. 이렇게 많이 공격하면 어딘가에 숨어 있을 수밖에 없어. 우리 몫을 얻을 거야, 의심치 않아.",DOR,,,,,0,0
77475,Henchman,Henchman_DOR,"Things aren't that grim yet. Master Drogan could still pull through if we get back the stolen artifacts. Get mad, sure, but stay on track too.","아직 그렇게 암울하진 않아. 도난당한 유물들을 되찾으면 드로건 스승님은 회복하실 수 있어. 화내는 건 좋지만, 목표도 유지해.",DOR,,,,,0,0
77476,Henchman,Henchman_DOR,"Let's scout around a bit more. We'll fight through a few stragglers and pick up a few coins, all while looking like heroes to the locals.","조금 더 정찰하자. 낙오자 몇 명과 싸우고 동전 좀 챙기면서, 주민들한테는 영웅처럼 보이는 거지.",DOR,,,,,0,0
77477,Henchman,Henchman_DOR,"Come on, let's get moving. We've a lot left to do.","자, 가자. 아직 할 일이 많아.",DOR,,,,,0,0
77478,Henchman,Henchman_DOR,"Of course not, but padding my pocket while helping out doesn't hurt anyone in the least.","물론 아니지만, 도우면서 주머니를 채우는 건 누구한테도 해가 안 돼.",DOR,,,,,0,0
77479,Henchman,Henchman_DOR,"Well, it's just that this is a big thing. We're leaving everything behind to find these kobolds and artifacts we didn't even know about.","뭐, 이건 큰일이야. 알지도 못했던 코볼트와 유물들을 찾으러 모든 걸 뒤로 하고 떠나는 거니까.",DOR,x0_d1_hen_inter0,,,,0,0
77480,Henchman,Henchman_DOR,I don't even know where to start. All I can think about is Master Drogan... lying there.,어디서 시작해야 할지도 모르겠어. 드로건 스승님이... 누워 계신 것만 생각나.,DOR,,,,,0,0
77481,Henchman,Henchman_DOR,"You may be able to just shut everything out, but I can't. Where I'm from, when someone is hurt you make the guilty pay for it.","넌 모든 걸 그냥 차단할 수 있을지 모르지만, 난 못 해. 내가 온 곳에선 누군가 다치면 죄인이 대가를 치르게 해.",DOR,,,,,0,0
77482,Henchman,Henchman_DOR,"So I'll shut up for now, but you just remember that Master Drogan needs us and we need him. Let's go.","그러니 지금은 입 다물게, 하지만 드로건 스승님이 우릴 필요로 하고 우리도 스승님이 필요하다는 걸 기억해. 가자.",DOR,,,,,0,0
77483,Henchman,Henchman_DOR,"Sure, you've progressed farther than all of us so you're not worried at all. I have a couple doubts, I guess, but I trained hard too.","그래, 넌 우리 모두보다 더 발전했으니까 전혀 걱정 안 하는 거지. 나도 의심은 좀 있지만, 나도 열심히 훈련했어.",DOR,,,,,0,0
77484,Henchman,Henchman_DOR,"That's what I was thinking, but I'm not going to let it get me down if you don't. He trained us well. I can do things I never thought possible.","나도 그렇게 생각했는데, 네가 낙담하지 않으면 나도 안 할 거야. 스승님이 우릴 잘 훈련시키셨어. 불가능하다 생각했던 일들을 할 수 있거든.",DOR,,,,,0,0
77485,Henchman,Henchman_DOR,Master Drogan has always been a good teacher. I owe it to him to try my best to help him.,드로건 스승님은 항상 좋은 스승이셨어. 스승님을 돕기 위해 최선을 다하는 게 내가 할 수 있는 보답이지.,DOR,,,,,0,0
77486,Henchman,Henchman_DOR,"You know, <FirstName>, I was thinking a little about that myself. I'm not above pocketing a few coins here and there. Just so long as we get the job done.","있잖아, <FirstName>, 나도 그것에 대해 좀 생각해봤어. 여기저기서 동전 몇 푼 챙기는 데 거부감은 없어. 일만 제대로 하면 되지.",DOR,,,,,0,0
77487,Henchman,Henchman_DOR,"It will be interesting to see these things. I bet they are impressive. I won't let them distract me too much, though. I'll be looking for the odd coin, I think.",그것들을 보는 건 흥미로울 거야. 인상적일 거라 확신해. 근데 너무 주의가 흐트러지진 않을 거야. 이상한 동전들을 찾아볼 생각이거든.,DOR,,,,,0,0
77488,Henchman,Henchman_DOR,"Well, don't forget that we'll be on our own soon and need to think about ourselves too. The odd coin here and there could fall our way.","뭐, 우리가 곧 혼자가 될 거고 우리 자신도 생각해야 한다는 걸 잊지 마. 여기저기서 이상한 동전이 우리한테 올 수도 있어.",DOR,,,,,0,0
77489,Henchman,Henchman_DOR,"That's the way of Vergadain. A little luck, a little skill, and a little bit of something for yourself in your pocket at the end of the day. ","그게 베르가데인의 방식이야. 약간의 운, 약간의 기술, 그리고 하루 끝에 주머니에 약간 자기 것을 챙기는 거지.",DOR,,,,,0,0
77490,Henchman,Henchman_DOR,"We've talked enough, I think. The sooner we head out, the sooner Master Drogan is better and we can count up the spoils. Let's go!",충분히 얘기한 것 같아. 빨리 출발할수록 드로건 스승님이 빨리 나아지고 전리품도 셀 수 있어. 가자!,DOR,,,,,0,0
77491,Henchman,Henchman_DOR,So... this is it. Heurodis is just ahead.,그래... 이거야. 헤우로디스가 바로 앞에 있어.,DOR,x0_d1_hen_inter0,,,,0,0
77492,Henchman,Henchman_DOR,Very. To come all this way... through all of this. She has to pay for everything. Coin for coin... everything. I'll see to it.,아주. 여기까지 오느라... 이 모든 걸 지나서. 그녀는 모든 것에 대가를 치러야 해. 한 푼 한 푼... 모든 것. 내가 확실히 할 거야.,DOR,,,,,0,0
77493,Henchman,Henchman_DOR,Is it? I hadn't noticed. It's seemed kind of muddy up until now. I guess I'm ready. She's got a lot to answer for.,그래? 몰랐네. 지금까지 좀 혼란스러웠던 것 같아. 준비된 것 같긴 해. 그녀가 답해야 할 게 많거든.,DOR,,,,,0,0
77494,Henchman,Henchman_DOR,"No, I'm well past that. This creature has taken a lot from me. I think it's time I took something back.","아니, 그건 이미 넘어섰어. 이 생명체는 나한테서 많은 걸 빼앗아갔어. 이제 뭔가 되찾아올 시간인 것 같아.",DOR,,,,,0,0
77495,Henchman,Henchman_DOR,"I'm right behind you, <FirstName>. Just give me a fair shot at her. I want her last sight to be me rifling through her pockets.","바로 뒤에 있어, <FirstName>. 그녀한테 공정한 기회만 줘. 그녀가 마지막으로 볼 광경은 내가 그녀 주머니를 뒤지는 모습이었으면 좋겠어.",DOR,,,,,0,0
77496,Henchman,Henchman_DOR,"It's so frustrating. This creature... Heurodis, we don't even know if we can survive fighting her but we have to jump through hoops to even try.","정말 좌절스러워. 이 생명체... 헤우로디스, 싸워서 살아남을 수 있을지도 모르는데 시도조차 하려면 온갖 장애물을 넘어야 해.",DOR,x0_d1_hen_inter0,,,,0,0
77497,Henchman,Henchman_DOR,"Find the Three Winds... it's always something, you know?","세 바람을 찾아라... 늘 뭔가 있잖아, 알지?",DOR,,,,,0,0
77498,Henchman,Henchman_DOR,"I never said I would either. Not that I wouldn't mind returing to some simpler concerns. Take some simple gold coins? Oh no, I have to defeat a medusa in an ancient floating city. Bah!","난 그런 말 안 했어. 좀 더 단순한 고민으로 돌아가고 싶지 않은 건 아니지만. 단순하게 금화 좀 챙긴다고? 안 돼, 고대 부유 도시에서 메두사를 물리쳐야 한대. 젠장!",DOR,,,,,0,0
77499,Henchman,Henchman_DOR,"Is that so bad? I get tired of these big concerns being dumped on us all the time. Take some simple gold coins? Oh no, I have to defeat a medusa in an ancient floating city. Bah!","그게 그렇게 나빠? 늘 이런 큰 고민들이 우리한테 떨어지는 게 지쳐. 단순하게 금화 좀 챙긴다고? 안 돼, 고대 부유 도시에서 메두사를 물리쳐야 한대. 젠장!",DOR,,,,,0,0
77500,Henchman,Henchman_DOR,"Where would I go? Besides, all I meant was that I miss having small concerns. Take some simple gold coins? Oh no, I have to defeat a medusa in an ancient floating city. Bah!","어디 가겠어? 게다가 내 말은 그냥 작은 고민들이 그립다는 거였어. 단순하게 금화 좀 챙긴다고? 안 돼, 고대 부유 도시에서 메두사를 물리쳐야 한대. 젠장!",DOR,,,,,0,0
77501,Henchman,Henchman_DOR,I guess Master Drogan trained us to look for this sort of trouble. His skills would be wasted on the petty thief I used to be.,드로건 스승님이 우릴 이런 문제를 찾도록 훈련시키신 것 같아. 스승님의 기술이 예전의 나 같은 하찮은 도둑한테는 낭비였겠지.,DOR,,,,,0,0
77502,Henchman,Henchman_DOR,"Fine, fine, whatever you want. We have to find the Three Winds to enter Temple of the Winds and defeat Heurodis. That sums it up, all nice and neat.","좋아, 좋아, 네가 원하는 대로. 우린 세 바람을 찾아서 바람의 신전에 들어가 헤우로디스를 물리쳐야 해. 요약하면 그래, 깔끔하고 정돈되게.",DOR,,,,,0,0
77503,Henchman,Henchman_DOR,"I'll try to be all business, like you want.",네가 원하는 대로 일에만 집중하려고 할게.,DOR,,,,,0,0
77504,Henchman,Henchman_DOR,"He prepared us for it anyway, knowing or not. I never knew what he saw in any of us, really. I guess I was just scared of seeing it too.","어쨌든 우릴 준비시키셨어, 알았든 몰랐든. 우리 중 누구에게서 뭘 보셨는지 정말 몰랐어. 나도 그걸 보는 게 두려웠던 것 같아.",DOR,,,,,0,0
77505,Henchman,Henchman_DOR,And here we are... wherever that is. Are you ready to go on?,그리고 여기 있어... 어디든 간에. 계속 갈 준비됐어?,DOR,,,,,0,0
77506,Henchman,Henchman_DOR,"I think we always do. Me, I choose to keep going... and keep an eye out for valuables along the way.",늘 그런 것 같아. 나는 계속 가기로 선택해... 가는 길에 귀중품도 눈 여겨보면서.,DOR,,,,,0,0
77507,Henchman,Henchman_DOR,"Even this high up, it's important to stay grounded, you know.",이렇게 높은 곳에서도 발을 땅에 붙이고 있는 게 중요하거든.,DOR,,,,,0,0
77508,Henchman,Henchman_DOR,"Me too. We'll find what we need, and maybe a few valuables along the way as well, heh?","나도 그래. 필요한 걸 찾을 거야, 어쩌면 가는 길에 귀중품도 몇 개, 헤?",DOR,,,,,0,0
77509,Henchman,Henchman_DOR,"Anything is possible, though I'd hope that if I could see the future, I'd do a better job of avoiding my own death. I don't think he knew.","뭐든 가능하지만, 미래를 볼 수 있다면 내 죽음을 피하는 데 더 잘했을 거라 바라고 싶어. 스승님은 몰랐던 것 같아.",DOR,,,,,0,0
77510,Henchman,Henchman_DOR,"That tremor... there's no fooling a dwarf, the whole place is moving. There's not a calm spot in this whole city.","저 진동... 드워프를 속일 순 없어, 이 전체가 움직이고 있어. 이 도시 전체에 조용한 곳이 하나도 없어.",DOR,x0_d1_hen_inter0,,,,0,0
