StrRef,SpeakerType,SpeakerName,TextEng,Text,DLG,Scripts,Conditions,DialogueContext,SoundRef,VolumeVariance,PitchVariance
54681,Henchman,Henchman_GRI,The Silent Lord claims many during this stage of the initiation. Those whom he has chosen to yet serve him in this world - those who survive - continue their training.,침묵의 군주는 입문의 이 단계에서 많은 이들을 거두어 가셔. 그분이 이 세상에서 아직 그분을 섬기도록 택하신 자들 - 살아남은 자들 - 은 훈련을 계속하지.,GRI,,,,,0,0
54682,Henchman,Henchman_GRI,"In the next stage of our initiation we must become true servants of the Silent Lord. We must murder three people - a rich old man, a poor young woman and a new born child.","입문의 다음 단계에서 우린 침묵의 군주의 진정한 종이 되어야 해. 세 사람을 살해해야 하지 - 부유한 노인, 가난한 젊은 여자, 그리고 갓 태어난 아기.",GRI,,,,,0,0
54683,Henchman,Henchman_GRI,"By slaying a rich old man, a poor young woman and a new born babe we learn that all of us are subjects of the Silent Lord - male, female, young, old, rich, poor. Death has dominion over us all.","부유한 노인, 가난한 젊은 여자, 갓 태어난 아기를 죽임으로써 우리 모두가 침묵의 군주의 신하임을 배우지 - 남자, 여자, 젊은이, 늙은이, 부자, 가난한 자. 죽음은 우리 모두를 지배해.",GRI,,,,,0,0
54684,Henchman,Henchman_GRI,"Next we must face the wheel, a simple test but one which delivers more initiates into the hands of the Silent Lord than any other.","다음으로 우린 수레바퀴에 맞서야 해, 단순한 시험이지만 다른 어떤 것보다 더 많은 입문자들을 침묵의 군주의 손에 넘기는 시험이지.",GRI,,,,,0,0
54685,Henchman,Henchman_GRI,"The wheel teaches us that the Silent Lord chooses at His pleasure, not ours. We are subject to whims and chance, death is random.","수레바퀴는 우리에게 침묵의 군주가 우리의 선택이 아닌 그분의 기쁨대로 택하신다는 걸 가르쳐. 우린 변덕과 우연에 종속돼, 죽음은 무작위야.",GRI,,,,,0,0
54686,Henchman,Henchman_GRI,The wheel is made of alternating white and black squares. If the pointer stops on a white square we move on to the final initiation. If it stops on a black square we are slain on the spot.,수레바퀴는 번갈아 나타나는 하얀색과 검은색 사각형들로 이루어져 있어. 바늘이 하얀 사각형에 멈추면 우린 최종 입문으로 나아가. 검은 사각형에 멈추면 그 자리에서 살해당하지.,GRI,,,,,0,0
54687,Henchman,Henchman_GRI,"When I began the initiation there were six of us seeking to enter the Order. Two died on the torture racks, one was captured after murdering a wealthy, elderly merchant and hung. ","내가 입문을 시작했을 때 우리는 여섯이었어. 둘은 고문 틀에서 죽었고, 하나는 부유한 노인 상인을 살해한 후 붙잡혀 교수형에 처해졌지.",GRI,,,,,0,0
54688,Henchman,Henchman_GRI,That left three of us to face the wheel. I alone survived to face the final challenge.,수레바퀴에 맞서기 위해 우리 셋이 남았어. 최종 도전에 맞서기 위해 나 혼자 살아남았지.,GRI,,,,,0,0
54689,Henchman,Henchman_GRI,"I am a monk of the Long Death, <FirstName>. The final challenge is necessary only if I ever wish to enter the inner circle of my Order.","난 오랜 죽음의 수도사야, <FirstName>. 최종 도전은 내가 우리 교단의 핵심층에 들어가길 원할 때만 필요하지.",GRI,,,,,0,0
54690,Henchman,Henchman_GRI,"You are a tool of the Silent Lord. You enact His will upon this world, spreading death everywhere you go. The Silent Lord has brought us together for a reason!","넌 침묵의 군주의 도구야. 이 세상에서 그분의 뜻을 실행하며, 가는 곳마다 죽음을 퍼뜨리지. 침묵의 군주가 이유가 있어서 우릴 함께 모으신 거야!",GRI,,,,,0,0
54691,Henchman,Henchman_GRI,I must assassinate one of the inner circle's members. Only by delivering one of their number into the Silent Lord's hands am I worthy to join them.,핵심층의 일원 중 한 명을 암살해야 해. 그들 중 한 명을 침묵의 군주의 손에 넘김으로써만 내가 그들과 합류할 자격이 있는 거지.,GRI,,,,,0,0
54692,Henchman,Henchman_GRI,If I am meant to find one of the sacred weapons it will be in your service as you continue to carve out your blood steeped legend.,"성스러운 무기 중 하나를 찾게 되어 있다면, 네가 피로 물든 네 전설을 계속 새겨나가는 동안 널 섬기며 찾게 될 거야.",GRI,,,,,0,0
54693,Henchman,Henchman_GRI,"I could not have spoken it more truly myself, <FirstName>.","나 자신도 그보다 더 진실되게 말할 순 없었을 거야, <FirstName>.",GRI,,,,,0,0
54694,Henchman,Henchman_GRI,"You are an instrument of the Silent Lord, <FirstName>. I will continue to serve you even as you continue to serve Death itself.","넌 침묵의 군주의 도구야, <FirstName>. 네가 죽음 그 자체를 계속 섬기는 동안 난 계속 널 섬길 거야.",GRI,,,,,0,0
54695,Henchman,Henchman_GRI,Yes - this is the mark of my Order. Wait... I fell a faint aura emanating from the blade. Yes - this is one of the weapons blessed by the inner circle!,그래 - 이게 우리 교단의 표식이야. 잠깐... 칼날에서 희미한 기운이 뿜어져 나오는 게 느껴져. 그래 - 이게 핵심층이 축복한 무기 중 하나야!,GRI,,,,,0,0
54696,Henchman,Henchman_GRI,"The talisman has powerful magical properties bestowed by my Order, <FirstName>. Its power is not to be underestimated. ","그 부적은 우리 교단이 부여한 강력한 마법 속성을 가지고 있어, <FirstName>. 그 힘은 과소평가될 게 아니야.",GRI,c3jour_grim04,,,,0,0
54697,Henchman,Henchman_GRI,"I suspect in practice we are similar to your own Order, though our beliefs and values may be somewhat different.","실제로 우린 네 자신의 교단과 비슷할 거라 생각해, 우리의 신념과 가치는 다소 다를 수 있지만.",GRI,,,,,0,0
54698,Henchman,Henchman_GRI,But during our mission I will not give up my search for the mummified hand of an inanimate corpse that can release my brethren from undeath. ,하지만 우리 임무 동안 내 형제들을 언데드에서 풀어줄 수 있는 살아 움직이지 않는 시체의 미라의 손을 찾는 걸 포기하진 않을 거야.,GRI,,,,,0,0
54699,Henchman,Henchman_GRI,"Once again, <FirstName>, I thank you. Now let us return to the task at hand - those behind the Wailing Death must still be dealt with!","다시 한번, <FirstName>, 고마워. 이제 당면한 일로 돌아가자 - 울부짖는 죽음 배후의 놈들은 아직 처리되어야 하니까!",GRI,,,,,0,0
54700,Henchman,Henchman_GRI,"The dagger is only the beginning for me, <FirstName>. I now have the ability - and the right - to deliver one of the inner circle to the Silent Lord.","단검은 내게 시작일 뿐이야, <FirstName>. 이제 난 핵심층 중 한 명을 침묵의 군주께 넘길 능력과 - 권리를 - 가지게 됐어.",GRI,,,,,0,0
54701,Henchman,Henchman_GRI,"Yet the inner circle are among the most powerful of my order, and if I am to defeat one of them I must become a master of all I have learned.","하지만 핵심층은 우리 교단 중 가장 강력한 자들이고, 그들 중 한 명을 물리치려면 내가 배운 모든 것의 대가가 되어야 해.",GRI,,,,,0,0
54702,Henchman,Henchman_GRI,"Once I feel I am worthy I will challenge one of the inner circle to a battle to the death. But of course, all this must wait.","자격이 있다고 느끼면 핵심층 중 한 명에게 죽음의 전투를 도전하겠지. 하지만 물론, 이 모든 건 기다려야 해.",GRI,,,,,0,0
54703,Henchman,Henchman_GRI,"Your task here is not yet done, <FirstName>. You still seek the Words of Power, and in doing so you still bring death and destruction to your foes.","여기서 네 임무는 아직 끝나지 않았어, <FirstName>. 넌 여전히 권능의 언령을 찾고 있고, 그러면서 네 적들에게 여전히 죽음과 파괴를 가져다주지.",GRI,,,,,0,0
54704,Henchman,Henchman_GRI,It has been an honor to serve you and I will not abandon you until your task is done.,널 섬기는 건 영광이었고 네 임무가 끝날 때까지 널 저버리지 않을 거야.,GRI,,,,,0,0
54705,Henchman,Henchman_GRI,"Your words are cruel, but there is truth in them. However, I will not simply abandon my quest.","네 말은 잔인하지만, 거기엔 진실이 있어. 하지만, 난 그냥 내 탐구를 포기하진 않을 거야.",GRI,,,,,0,0
54706,Henchman,Henchman_GRI,"I am Grimgnaw, a monk of the Order of the Long Death. The grisly account of the Academy is no great secret, <FirstName>. Not to those who seek such things out.","난 그림노, 오랜 죽음의 교단의 수도사야. 사관학교의 소름 끼치는 이야기는 대단한 비밀이 아니야, <FirstName>. 그런 걸 찾아다니는 자들에겐.",GRI,,,,,0,0
54707,Henchman,Henchman_GRI,"In truth my skills are not so different from any soldier or hired blade, though I embrace the beauty and perfection of my enemy's death with a zeal others often lack.","사실 내 기술은 어떤 병사나 고용된 칼잡이와 크게 다르지 않아, 다른 이들이 자주 부족한 열정으로 내 적의 죽음의 아름다움과 완벽함을 받아들이긴 하지만.",GRI,,,,,0,0
54708,Henchman,Henchman_GRI,Instead I discovered the plague is a foul abomination. It robs Death of its rightful claim and denies its victims the cold embrace of the Silent Lord.,대신 역병이 끔찍한 저주라는 걸 알게 됐지. 죽음의 정당한 권리를 빼앗고 희생자들을 침묵의 군주의 차가운 품에서 멀어지게 하니까.,GRI,,,,,0,0
54709,Henchman,Henchman_GRI,"You are an agent of death, <FirstName>, just as I am. We both serve the Silent Lord in our own fashion, though you refuse to acknowledge what you are.","넌 죽음의 대리인이야, <FirstName>, 나처럼. 우린 둘 다 나름의 방식으로 침묵의 군주를 섬기지, 네가 그걸 인정하지 않으려 해도.",GRI,,,,,0,0
54710,Henchman,Henchman_GRI,"Well spoken, <FirstName>. I tremble in anticipation of the carnage we shall unleash upon the Realms!","잘 말했어, <FirstName>. 우리가 이 세상에 쏟아부을 학살을 기대하니 몸이 떨려!",GRI,,,,,0,0
54711,Henchman,Henchman_GRI,"I do not know how we might stop the Wailing Death, though I am eager to search the Beggar's Nest for answers.","울부짖는 죽음을 어떻게 막을지는 모르겠지만, 거지 소굴에서 답을 찾고 싶어.",GRI,,,,,0,0
54712,Henchman,Henchman_GRI,"Alone I am not likely to survive the dangers of the district, and throwing my life away is a foolish way to serve the Silent Lord. My death will come in its appointed time.","혼자선 그 지역의 위험을 버틸 수 없을 거고, 목숨을 헛되이 버리는 건 침묵의 군주를 섬기는 어리석은 방법이야. 내 죽음은 정해진 때가 오면 오겠지.",GRI,,,,,0,0
54713,Henchman,Henchman_GRI,But Death itself is always present. The Silent Lord is the name we give to the concept - the very essence - of Death.,하지만 죽음 자체는 항상 존재해. 침묵의 군주는 우리가 그 개념 - 죽음의 본질 그 자체 - 에 부여한 이름일 뿐이야.,GRI,,,,,0,0
54714,Henchman,Henchman_GRI,"There are some who call what we do evil, but my Order transcends morality. Good, evil - these things mean nothing, for eventually we all bow down to the Silent Lord.","우리가 하는 일을 악이라고 부르는 자들도 있지만, 우리 교단은 도덕을 초월해. 선, 악 - 그런 건 아무 의미도 없어, 결국엔 우리 모두 침묵의 군주 앞에 무릎 꿇게 되니까.",GRI,,,,,0,0
54715,Henchman,Henchman_GRI,"The monks of my order bow down to Death, <FirstName>. We may swear allegiance to another, but only as it serves the will of the Silent Lord.","우리 교단의 수도사들은 죽음 앞에 무릎 꿇어, <FirstName>. 다른 이에게 충성을 맹세할 수도 있지만, 그건 오직 침묵의 군주의 뜻을 섬기는 한에서야.",GRI,,,,,0,0
54716,Henchman,Henchman_GRI,"The monks of my order bow down to Death, <FirstName>. We may swear allegiance to another, but only as it serves the will of the Silent Lord.","우리 교단의 수도사들은 죽음 앞에 무릎 꿇어, <FirstName>. 다른 이에게 충성을 맹세할 수도 있지만, 그건 오직 침묵의 군주의 뜻을 섬기는 한에서야.",GRI,,,,,0,0
54717,Henchman,Henchman_GRI,"We bring pain, torment and anguish to the denizens of this world to prepare them for the release of death. I have sworn to spread devastation and destruction in the name of the Silent Lord.",이 세상의 존재들에게 고통과 괴로움과 번민을 가져다주는 건 죽음의 해방을 위해 준비시키는 거야. 난 침묵의 군주의 이름으로 파괴와 파멸을 퍼뜨리겠다고 맹세했지.,GRI,,,,,0,0
54718,Henchman,Henchman_GRI,But there was no place for me among the clans at Mithral Hall; I was shunned and reviled by my own kind.,하지만 미스랄 홀의 씨족들 사이에 내 자리는 없었어. 내 동족들에게 배척당하고 증오받았지.,GRI,,,,,0,0
54719,Henchman,Henchman_GRI,"This was long before I joined the Order of the Long Death, and at first Mithral Hall welcomed me, for even then I did not fear death and I was eager to inflict it upon my enemies.","오랜 죽음의 교단에 합류하기 한참 전 일이었고, 처음엔 미스랄 홀이 날 환영했어. 그때도 난 죽음을 두려워하지 않았고 적들에게 죽음을 안기는 걸 즐겼거든.",GRI,,,,,0,0
54720,Henchman,Henchman_GRI,There were many among Bruenor's followers who shared my love of battle and the reckless fury with which I slaughtered my foes. But none of them appreciated the terrible beauty of what was all around us.,브루노어의 추종자들 중에 내가 전투를 사랑하고 적들을 학살하는 무모한 분노를 공유하는 자들이 많았지. 하지만 그 누구도 우리 주변의 끔찍한 아름다움을 알아보지 못했어.,GRI,,,,,0,0
54721,Henchman,Henchman_GRI,Have you ever heard the glorious chorus of screams of dying drow echoing in the chambers of a dwarven mine? Or paused in battle to taste the palpable specter of death descending on the field like a cool mist?,드워프 광산의 방에서 죽어가는 드로우의 비명이 울려 퍼지는 영광스러운 합창을 들어본 적 있어? 아니면 전장에 차가운 안개처럼 내려앉는 죽음의 실체를 맛보려고 전투 중에 멈춰본 적은?,GRI,,,,,0,0
54722,Henchman,Henchman_GRI,"Have you ever stood over a dying comrade, drinking in his pain and fear as his life bleeds away, gazing into his eyes to glimpse the terrible understanding shining through in the final instant death claims him?","죽어가는 동료 위에 서서 그의 생명이 흘러나가는 동안 그의 고통과 두려움을 마시며, 죽음이 그를 가져가는 마지막 순간 그의 눈에서 빛나는 끔찍한 깨달음을 본 적 있어?",GRI,,,,,0,0
54723,Henchman,Henchman_GRI,"After the battles I would walk among the scattered corpses, fascinated by the... truth... of their deaths. The others found it disturbing, I knew, but I couldn't stop. The compulsion was too strong.","전투가 끝나면 흩어진 시체들 사이를 걸으며 그들 죽음의... 진실에... 매료됐지. 다른 이들은 그걸 불편해했지만, 멈출 수가 없었어. 충동이 너무 강렬했거든.",GRI,,,,,0,0
54724,Henchman,Henchman_GRI,"And as I wandered amidst the twisted, mangled bodies and gazed into the masks of agony forever frozen on their faces, I understood. Drow, duergar, dwarf - in death we are all the same. In death we are all... perfect.","비틀리고 찢긴 육체들 사이를 헤매며 그들의 얼굴에 영원히 얼어붙은 고뇌의 가면을 바라보면서 깨달았어. 드로우든, 듀에가르든, 드워프든 - 죽음 안에선 우린 모두 같아. 죽음 안에선 우린 모두... 완벽해.",GRI,,,,,0,0
54725,Henchman,Henchman_GRI,"I tried to share my revelations with my brothers-in-arms, but they could not understand. They only looked at me with horror and disgust.","내 계시를 전우들과 나누려 했지만, 그들은 이해할 수 없었어. 그저 공포와 혐오로 날 바라볼 뿐이었지.",GRI,,,,,0,0
54726,Henchman,Henchman_GRI,"That was what they said, as well, thought they were glad to have me at their side whenever the drow attacked.",그들도 그렇게 말했어. 드로우가 공격할 때마다 내가 옆에 있어서 기쁘긴 했지만.,GRI,,,,,0,0
54727,Henchman,Henchman_GRI,I left Mithral Hall shortly after my revelation in search of... something. I found the Order of the Long Death.,계시를 받고 얼마 안 가서 미스랄 홀을 떠났어... 뭔가를... 찾아서. 그리고 오랜 죽음의 교단을 찾았지.,GRI,,,,,0,0
54728,Henchman,Henchman_GRI,I suppose I cannot blame my fellow dwarves for their reaction. The acceptance of Death is not easy. Even among my Order there are those who cannot face the Silent Lord when their time comes.,동료 드워프들의 반응을 탓할 순 없을 것 같아. 죽음을 받아들이는 건 쉽지 않으니까. 우리 교단 안에서도 자기 때가 왔을 때 침묵의 군주를 마주할 수 없는 자들이 있어.,GRI,nw_ch_action_2,,,,0,0
54729,Henchman,Henchman_GRI,"I'm sorry, <FirstName>, I should not have said anything about this to you. This is a matter that must be solved by those of my Order.","미안해, <FirstName>, 이 얘길 꺼내지 말았어야 했는데. 이건 우리 교단 사람들이 해결해야 할 문제야.",GRI,c1journ_grim02,,,,0,0
54730,Henchman,Henchman_GRI,"You don't have to worry about that, <FirstName>. I'm eager to end this foul plague that is taking what rightfully belongs to the Silent Lord.","걱정하지 마, <FirstName>. 침묵의 군주의 정당한 몫을 빼앗는 이 저주스러운 역병을 끝내고 싶으니까.",GRI,,,,,0,0
54731,Henchman,Henchman_GRI,"If I am ever to advance further in the Order of the Long Death, I must bring back proof of Alaganda's death to my Masters.","오랜 죽음의 교단에서 더 높이 올라가려면, 알라간다의 죽음을 증명할 걸 스승들께 가져가야 해.",GRI,c1journ_grim03,,,,0,0
54732,Henchman,Henchman_GRI,Alaganda always wears a forged silver ring embossed with the crest of her family - a soaring falcon against a full moon.,알라간다는 항상 가문의 문장 - 보름달을 배경으로 날아오르는 매 - 이 새겨진 은반지를 끼고 있어.,GRI,,,,,0,0
54733,Henchman,Henchman_GRI,"After wearing it for so many years the ring will not fit over her finger, and she would never willingly remove the ring while she lives in any case.","오랜 세월 끼고 있었던 반지라 손가락에서 빠지지도 않고, 어쨌든 살아있는 동안 절대 자발적으로 반지를 빼지도 않을 거야.",GRI,,,,,0,0
54734,Henchman,Henchman_GRI,"Who among us is truly innocent, <FirstName>? Alaganda has participated in the rituals of the Long Death, she has slain many who you would call 'innocent'.","우리 중 누가 진정 무고하겠어, <FirstName>? 알라간다도 오랜 죽음의 의식에 참여했고, 네가 '무고하다'고 부를 많은 이들을 죽였어.",GRI,,,,,0,0
54735,Henchman,Henchman_GRI,"And she has broken her vows to my Order. The penalty for that is death. I will find her, <FirstName>, and I will kill her. If you cannot accept this we should part ways.","그리고 우리 교단에 대한 서약을 깼지. 그 대가는 죽음이야. 찾아낼 거고, <FirstName>, 죽일 거야. 이걸 받아들일 수 없다면 헤어지는 게 나아.",GRI,,,,,0,0
54736,Henchman,Henchman_GRI,"There is power in this amulet, <FirstName>.","이 호신부엔 힘이 담겨 있어, <FirstName>.",GRI,,,,,0,0
54737,Henchman,Henchman_GRI,"The mark of Death is upon you, <FirstName>. As long as I stay by your side I know I serve the will of the Silent Lord.","죽음의 표식이 네게 있어, <FirstName>. 네 곁에 있는 한 침묵의 군주의 뜻을 섬긴다는 걸 알아.",GRI,,,,,0,0
54738,Henchman,Henchman_GRI,That was why I answered Lord Nasher's desperate call for mercenaries to come to Port Llast. He is also anxious to root out those behind the Wailing Death.,그래서 나셰르 영주가 라스트 항구로 용병들을 부르자 응했지. 그도 울부짖는 죽음 배후를 찾는 데 혈안이니까.,GRI,,,,,0,0
54739,Henchman,Henchman_GRI,The town is a strange place; there is a foul taint upon it that we of the Long Death can feel. None of the emissaries my Order has sent south to investigate Charwood has ever returned.,그 마을은 이상한 곳이야. 우리 오랜 죽음의 교단원들이 느낄 수 있는 더러운 오염이 있지. 그을린숲을 조사하러 남쪽으로 보낸 우리 교단의 사절들이 한 명도 돌아오지 않았어.,GRI,,,,,0,0
54740,Henchman,Henchman_GRI,"The town is a strange place; there is a foul taint upon it that we of the Long Death can feel, though we have not been able to determine what curse hangs over them.",그 마을은 이상한 곳이야. 우리 오랜 죽음의 교단원들이 느낄 수 있는 더러운 오염이 있지. 어떤 저주가 드리워져 있는지는 밝혀내지 못했지만.,GRI,,,,,0,0
54741,Henchman,Henchman_GRI,"It would not surprise me to discover links to the cult behind the Wailing Death in that unnatural place, though I can tell you little else about it.",그 부자연스러운 곳에서 울부짖는 죽음 배후의 사교와 연결점을 찾게 돼도 놀랍지 않을 거야. 그 외엔 딱히 더 말해줄 게 없지만.,GRI,,,,,0,0
54742,Henchman,Henchman_GRI,"I have never been there myself, though I know it lies far, far to the South of Port Llast. However, I know there must be great danger there.","직접 가본 적은 없지만, 라스트 항구에서 아주 아주 남쪽에 있다는 건 알아. 하지만 거기엔 큰 위험이 있을 게 분명해.",GRI,,,,,0,0
54743,Henchman,Henchman_GRI,"My Order has sent many emissaries to investigate the region, but none have ever returned. There is some fell and dangerous power at work in Charwood, though what it is I cannot say.","우리 교단이 그 지역을 조사하러 많은 사절들을 보냈지만, 한 명도 돌아오지 않았어. 그을린숲에는 사악하고 위험한 힘이 작동하고 있어. 그게 뭔지는 말할 수 없지만.",GRI,,,,,0,0
54744,Henchman,Henchman_GRI,"I am Grimgnaw, a monk of the Order of the Long Death. No doubt you have come for the same reason as I: to join Aribeth in hunting and slaying the cult that was responsible for the Wailing Death.","난 그림노, 오랜 죽음의 교단의 수도사야. 나처럼 네가 온 이유도 분명하겠지: 아리베스와 함께 울부짖는 죽음의 책임이 있는 사교를 사냥하고 학살하려고.",GRI,,,,,0,0
54745,Henchman,Henchman_GRI,The town is a strange place; there is a foul taint upon it that we of the Long Death can feel. None of the emissaries my Order has sent south to investigate Charwood has ever returned.,그 마을은 이상한 곳이야. 우리 오랜 죽음의 교단원들이 느낄 수 있는 더러운 오염이 있지. 그을린숲을 조사하러 남쪽으로 보낸 우리 교단의 사절들이 한 명도 돌아오지 않았어.,GRI,,,,,0,0
54746,Henchman,Henchman_GRI,"There are some who call us evil, for they fear the pain and death we spread. But we transcend morality. Death is not good or evil, it simply *is*. It is final, undeniable and perfect.","우리를 악이라고 부르는 자들도 있어. 우리가 퍼뜨리는 고통과 죽음을 두려워하니까. 하지만 우린 도덕을 초월해. 죽음은 선도 악도 아니야. 그냥 *존재*할 뿐이지. 죽음은 최종적이고, 부정할 수 없고, 완벽해.",GRI,,,,,0,0
54747,Henchman,Henchman_GRI,"Our beliefs are difficult for most to accept, and the Order of the Long Death has many powerful enemies.","우리의 신념을 받아들이기 힘든 이들이 대부분이고, 오랜 죽음의 교단에는 강력한 적들이 많아.",GRI,,,,,0,0
54748,Henchman,Henchman_GRI,So be it. You are not bound by the tenets of my Order; you have sworn no allegiance to the Silent Lord.,그래. 넌 우리 교단의 교리에 구속되지 않아. 침묵의 군주에게 충성을 맹세하지도 않았지.,GRI,,,,,0,0
54749,Henchman,Henchman_GRI,"I have pledged to accompany you in this mission, and I will continue to do so for the mark of my Master is upon you.","이 임무에 동행하겠다고 서약했고, 계속 그럴 거야. 네게 내 주인의 표식이 있으니까.",GRI,,,,,0,0
54750,Henchman,Henchman_GRI,"The ancient rituals require rare components and we had many casualties. A few we were able to save, but the others remain traped in undeath until we can find more of the necessary components for the ritual.","고대 의식에는 희귀한 구성 요소가 필요하고 우린 많은 희생자를 냈어. 몇몇은 구할 수 있었지만, 나머지는 의식을 위한 필요한 구성 요소를 더 찾을 때까지 언데드 상태에 갇혀 있어.",GRI,,,,,0,0
54751,Henchman,Henchman_GRI,"I thank you for this, <FirstName>, on behalf of the Order of the Long Death. I have no reward to give you, save the blessing of my Order.","이것에 대해 고마워, <FirstName>, 오랜 죽음의 교단을 대신해서. 줄 보상은 없어, 우리 교단의 축복 외엔.",GRI,c2journ_grim04,,,,0,0
