StrRef,SpeakerType,SpeakerName,TextEng,Text,DLG,Scripts,Conditions,DialogueContext,SoundRef,VolumeVariance,PitchVariance
54614,Henchman,Henchman_GRI,"The essence of those claimed by the plague has been stolen from the terrible grasp of my master, Death. This sickness cheats the Silent Lord of what is rightfully his.","역병에 당한 자들의 본질은 내 주인, 죽음의 끔찍한 손아귀에서 훔쳐졌어. 이 병은 침묵의 군주께 마땅히 그분의 것을 속여 빼앗는 거지.",GRI,,,,,0,0
54615,Henchman,Henchman_GRI,"The location of the cult you seek is well hidden. However, I would not be surprised to learn they are connected with the village of Charwood.",네가 찾는 사교의 위치는 잘 숨겨져 있어. 하지만 그을린숲 마을과 연결됐을 거라 봐도 놀랍진 않아.,GRI,,,,,0,0
54616,Henchman,Henchman_GRI,"Perhaps I can help you, for long ago my dwarf clan dwelt in the Dragon Mountains, though when Bruenor Battlehammer reclaimed Mithral Hall we left to join the others of our kind who flocked to his banner.","아마 도와줄 수 있을 거야, 오래 전 내 드워프 씨족이 용의 산맥에 살았거든, 브루노어 배틀해머가 미스랄 홀을 되찾았을 때 우린 떠나서 그의 깃발 아래 몰려든 우리 종족의 다른 이들과 합류했지만.",GRI,,,,,0,0
54617,Henchman,Henchman_GRI,I have heard rumors that in that blighted district zombies walk the streets. Few things are so reviled by my order as the abomination of the undead.,그 저주받은 구역엔 좀비들이 거리를 걷는다는 소문을 들었어. 우리 교단이 언데드의 괴물만큼 혐오하는 건 거의 없지.,GRI,,,,,0,0
54618,Henchman,Henchman_GRI,It would be reasonable to imagine there is some connection between the undead and the unnatural end of those who succumb to the Wailing Death.,언데드와 울부짖는 죽음에 굴복한 자들의 부자연스러운 종말 사이에 어떤 연결고리가 있다고 상상하는 게 합리적이겠지.,GRI,,,,,0,0
54619,Henchman,Henchman_GRI,"Yes, we should continue with your mission. The Silent Lord is eager for us to feed his endless hunger with more souls.","그래, 네 임무를 계속해야지. 침묵의 군주는 우리가 더 많은 영혼으로 그분의 끝없는 굶주림을 채우길 갈망하시니까.",GRI,,,,,0,0
54620,Henchman,Henchman_GRI,"There is nothing else I can think of to tell you, <FirstName>.","네게 말해줄 다른 건 생각나는 게 없어, <FirstName>.",GRI,,,,,0,0
54621,Henchman,Henchman_GRI,"Yes, this is Alaganda's ring! This is the proof I needed; now I know she has been taken by the Silent Lord. She was a fool to flee - there is nowhere we can run that Death cannot find us.","그래, 이게 알라간다의 반지야! 내가 필요했던 증거지. 이제 그녀가 침묵의 군주께 거두어졌다는 걸 알았어. 도망친 건 어리석었지 - 죽음이 우릴 찾지 못할 곳은 어디에도 없거든.",GRI,,,,,0,0
54622,Henchman,Henchman_GRI,"I have no gold or treasure to reward you, but there is one thing I can offer. A small token, perhaps, but it is all I have.","보답할 금화나 보물은 없지만, 줄 수 있는 게 하나 있어. 작은 표시일지 모르지만, 내가 가진 전부야.",GRI,,,,,0,0
54623,Henchman,Henchman_GRI,"It will not save you from the Silent Lord when He finally chooses you, but it will grant you some protection from succumbing to those who would deliver you into his grasp before your appointed time.","침묵의 군주가 마침내 널 택하실 때 구원받진 못하겠지만, 정해진 때 전에 그분의 손아귀로 널 넘기려는 자들에게 굴복하는 것으로부터 어느 정도 보호를 줄 거야.",GRI,c1journ_grim04,,,,0,0
54624,Henchman,Henchman_GRI,"Eventually I will return to my Order and report Alaganda's death to them. But this can wait until your mission here is done, <FirstName>.","결국 교단으로 돌아가서 알라간다의 죽음을 보고할 거야. 하지만 이건 여기서 네 임무가 끝날 때까지 기다려도 돼, <FirstName>.",GRI,,,,,0,0
54625,Henchman,Henchman_GRI,"The town has isolated itself from the rest of the world, far to the South of Port Llast. Few outside my Order even remember such a place exists.","그 마을은 라스트 항구에서 한참 남쪽으로, 세상으로부터 스스로를 고립시켰지. 우리 교단 밖에선 그런 곳이 존재한다는 것조차 기억하는 자가 거의 없어.",GRI,,,,,0,0
54626,Henchman,Henchman_GRI,"I know the mountains were aptly named, for great wyrms could often be seen soaring over the moonlit skies at night.","그 산맥이 적절히 이름 붙여졌다는 걸 알아, 밤에 달빛 비치는 하늘 위로 자주 거대한 고룡들이 날아오르는 게 보였거든.",GRI,,,,,0,0
54627,Henchman,Henchman_GRI,There were many legends of the great hoards guarded by these winged serpents and the mighty artifacts that could be found within. ,이 날개 달린 뱀들이 지키는 거대한 보물과 그 안에서 찾을 수 있는 강력한 유물들에 대한 전설이 많았지.,GRI,,,,,0,0
54628,Henchman,Henchman_GRI,"I do not specifically recall mention of the Words of Power, but I can only assume such a powerful item would likely be found in a dragon's lair.","권능의 언령에 대한 언급을 구체적으로 기억하진 못하지만, 그렇게 강력한 아이템이라면 용의 둥지에서 발견될 거라고 추측할 수밖에 없어.",GRI,,,,,0,0
54629,Henchman,Henchman_GRI,"Our instructions were simply to make ourselves available to whomever requires our assistance. So, in that spirit, is there anything I can do for you?","우리 지시는 단순히 도움이 필요한 누구에게든 우리 자신을 이용 가능하게 하라는 거였어. 그래서, 그런 정신으로, 내가 널 위해 할 수 있는 게 있나?",GRI,,,,,0,0
54630,Henchman,Henchman_GRI,"The town has isolated itself from the rest of the world, far to the South of Port Llast. Few outside my Order even remember such a place exists.","그 마을은 라스트 항구에서 한참 남쪽으로, 세상으로부터 스스로를 고립시켰지. 우리 교단 밖에선 그런 곳이 존재한다는 것조차 기억하는 자가 거의 없어.",GRI,,,,,0,0
54631,Henchman,Henchman_GRI,"It would not surprisie me to discover links to the cult behind the Wailing Death in that unnatural place. Is there more I can do for you, <FirstName>?","그 부자연스러운 곳에서 울부짖는 죽음 배후의 사교와 연결고리를 발견한다 해도 놀랍진 않을 거야. 내가 널 위해 더 할 수 있는 게 있나, <FirstName>?",GRI,,,,,0,0
54632,Henchman,Henchman_GRI,I have been eagerly waiting for my chance to extract vengeance on the cult responsible for unleashing the plague on Neverwinter.,네버윈터에 역병을 풀어놓은 책임이 있는 사교에 복수할 기회를 간절히 기다리고 있었어.,GRI,,,,,0,0
54633,Henchman,Henchman_GRI,"My name is Grimgnaw, a monk of the Order of the Long Death. Like you I serve the Silent Master, spreading pain and suffering and death throughout the North.","내 이름은 그림노, 오랜 죽음의 교단의 수도사야. 너처럼 난 침묵의 주인을 섬기며, 북부 전역에 고통과 괴로움과 죽음을 퍼뜨리지.",GRI,,,,,0,0
54634,Henchman,Henchman_GRI,"Long ago my dwarf clan dwelt in the Dragon Mountains, though when Bruenor Battlehammer reclaimed Mithral Hall we left to join the others of our kind who flocked to his banner.","오래 전 내 드워프 씨족이 용의 산맥에 살았어, 브루노어 배틀해머가 미스랄 홀을 되찾았을 때 우린 떠나서 그의 깃발 아래 몰려든 우리 종족의 다른 이들과 합류했지만.",GRI,,,,,0,0
54635,Henchman,Henchman_GRI,"At night great wyrms could often be seen soaring over the moonlit skies. There were many legends of the hoards these winged serpents guarded, and many rumors of the mighty artifacts that could be found within.",밤이면 거대한 고룡들이 자주 달빛 비치는 하늘 위로 날아오르는 게 보였지. 이 날개 달린 뱀들이 지키는 보물과 그 안에서 찾을 수 있는 강력한 유물들에 대한 전설과 소문이 많았어.,GRI,,,,,0,0
54636,Henchman,Henchman_GRI,"I do not specifically recall mention of the Words of Power, but I can only assume such a poweful item would likely be found in a dragon's lair.","권능의 언령에 대한 언급을 구체적으로 기억하진 못하지만, 그렇게 강력한 아이템이라면 용의 둥지에서 발견될 거라고 추측할 수밖에 없어.",GRI,,,,,0,0
54637,Henchman,Henchman_GRI,"Long ago my dwarf clan dwelt in the Dragon Mountains, though when Bruenor Battlehammer reclaimed Mithral Hall we left to join the others of our kind who flocked to his banner.","오래 전 내 드워프 씨족이 용의 산맥에 살았어, 브루노어 배틀해머가 미스랄 홀을 되찾았을 때 우린 떠나서 그의 깃발 아래 몰려든 우리 종족의 다른 이들과 합류했지만.",GRI,,,,,0,0
54638,Henchman,Henchman_GRI,"At night great wyrms could often be seen soaring over the moonlit skies. There were many legends of the hoards these winged serpents guarded, and many rumors of the mighty artifacts that could be found within.",밤이면 거대한 고룡들이 자주 달빛 비치는 하늘 위로 날아오르는 게 보였지. 이 날개 달린 뱀들이 지키는 보물과 그 안에서 찾을 수 있는 강력한 유물들에 대한 전설과 소문이 많았어.,GRI,,,,,0,0
54639,Henchman,Henchman_GRI,"I do not specifically recall mention of the Words of Power, but I can only assume such a poweful item would likely be found in a dragon's lair.","권능의 언령에 대한 언급을 구체적으로 기억하진 못하지만, 그렇게 강력한 아이템이라면 용의 둥지에서 발견될 거라고 추측할 수밖에 없어.",GRI,,,,,0,0
54640,Henchman,Henchman_GRI,"If you wish, <FirstName>, I will gladly join with you to seek out these Words of Power. I have no doubt our partnership would result in a scourge of death throughout the land.","원한다면, <FirstName>, 기꺼이 함께 이 권능의 언령을 찾겠어. 우리의 동업이 이 땅 전역에 죽음의 재앙을 가져올 거라는 건 의심의 여지가 없지.",GRI,,,,,0,0
54641,Henchman,Henchman_GRI,"Understand, I care nothing for the petty Gods who squabble over and lay claim to death's portfolio, for I serve Death itself, the Silent Lord who rules us all.","이해해, 난 죽음의 영역을 두고 다투고 주장하는 하찮은 신들 따윈 관심 없어. 난 죽음 그 자체, 우리 모두를 다스리는 침묵의 군주를 섬기거든.",GRI,,,,,0,0
54642,Henchman,Henchman_GRI,"We of the Long Death train, study and serve our Masters. We strive to transcend the earthly world through mental discipline and philosophical understanding of Death.","우리 오랜 죽음의 교단원들은 스승님들 밑에서 훈련하고, 공부하고, 섬겨. 정신적 수양과 죽음에 대한 철학적 이해를 통해 세속 세계를 초월하려 노력하지.",GRI,,,,,0,0
54643,Henchman,Henchman_GRI,"The undead are a foul abomination, a denial of the natural order. We of the Long Death are in constant conflict with necromancers and their minions.","언데드는 더러운 괴물이야, 자연 질서의 부정이지. 우리 오랜 죽음의 교단원들은 강령술사들과 그들의 하수인들과 끊임없는 갈등을 겪어.",GRI,,,,,0,0
54644,Henchman,Henchman_GRI,"I have seen firsthand the horrors of a war with the undead, <FirstName>.","언데드와의 전쟁의 공포를 직접 봤어, <FirstName>.",GRI,c2journ_grim01,,,,0,0
54645,Henchman,Henchman_GRI,"I am not eager to dredge up those memories, but if we are to stand together you deserve to hear the tale.","그 기억들을 끄집어내고 싶진 않지만, 함께 서려면 그 이야기를 들을 자격이 있어.",GRI,,,,,0,0
54646,Henchman,Henchman_GRI,Shortly after I had come to join the Order of the Long Death one of my fellow monks returned to the monastery with ill news. He had discovered the lair of a powerful lich.,오랜 죽음의 교단에 합류한 직후에 동료 수도사 중 한 명이 수도원으로 돌아왔는데 나쁜 소식을 가져왔지. 강력한 리치의 둥지를 발견했다고.,GRI,,,,,0,0
54647,Henchman,Henchman_GRI,"Our service to the Silent Lord demands that we destroy such an affront to death, so we marched forth to destroy the foul creature and end its unholy existence.",침묵의 군주를 섬기는 우리의 의무는 죽음에 대한 그런 모독을 파괴하라고 요구하지. 그래서 그 더러운 생명체를 파괴하고 불경스러운 존재를 끝내러 진군했어.,GRI,,,,,0,0
54648,Henchman,Henchman_GRI,"I myself never faced the lich in battle, but I was one of many assigned the task of destroying the lich's zombie and skeleton servants. Never have I felt such revulsion or terror during a battle.","난 직접 리치와 전투를 벌이진 않았지만, 리치의 좀비와 해골 하수인들을 파괴하는 임무를 맡은 많은 이 중 하나였어. 전투 중 그런 혐오감이나 공포를 느낀 적이 없었지.",GRI,,,,,0,0
54649,Henchman,Henchman_GRI,There is beauty in death. The exquisite agony of a mangled soldier's screams well up in a glorious crescendo before ending on a single perfect note of eternal silence.,죽음엔 아름다움이 있어. 찢긴 병사의 비명이 내는 절묘한 고뇌가 영원한 침묵의 단 하나의 완벽한 음표로 끝나기 전에 영광스러운 절정으로 치솟지.,GRI,,,,,0,0
54650,Henchman,Henchman_GRI,"The writhing torment of a flailing body is transformed into the magnificent truth of a frozen corpse, forever stilled.",뒤틀리는 허우적거리는 육체의 고통은 영원히 고요한 얼어붙은 시체의 장엄한 진실로 변모하지.,GRI,,,,,0,0
54651,Henchman,Henchman_GRI,"But when a corpse is not still; when the dead continue to shamble and stumble forward in a gross caricature of living flesh - where is Death's beauty then, <FirstName>?","하지만 시체가 고요하지 않을 때, 죽은 자가 살아있는 육체의 우스꽝스러운 흉내를 내며 계속 비틀거리고 앞으로 나아갈 때 - 그럼 죽음의 아름다움은 어디 있는 거지, <FirstName>?",GRI,,,,,0,0
54652,Henchman,Henchman_GRI,"My Order killed scores of zombies in the crypt that day, <FirstName>. Their bodies disintegrated beneath my blows in a shower of rotting flesh, yet they pressed inexorably forward.","우리 교단은 그날 지하묘지에서 수십 마리의 좀비를 죽였어, <FirstName>. 그들의 육체는 내 타격 아래 썩어가는 살점의 소나기 속에서 해체됐지만, 그래도 끊임없이 앞으로 밀려왔어.",GRI,,,,,0,0
54653,Henchman,Henchman_GRI,But the true horror was yet to come. From the back of the tomb where the highest ranking monks of the Order battled the lich herself waves of dark necromancy spilled out over battlefield. ,하지만 진정한 공포는 아직 오지 않았어. 교단의 최고위 수도사들이 리치 본인과 싸우던 지하묘지 뒤쪽에서 어둠의 강령술의 파도가 전장 위로 쏟아져 나왔지.,GRI,,,,,0,0
54654,Henchman,Henchman_GRI,"Several of my companions had fallen during the battle and as the foul spell touched their corpses they clambored to their feet, zombies under the will of the enemy we sought to destroy.","전투 중 내 동료 몇 명이 쓰러졌고 그 더러운 주문이 그들의 시체에 닿자 허둥지둥 일어서더니, 우리가 파괴하려던 적의 의지 아래 좀비가 됐지.",GRI,,,,,0,0
54655,Henchman,Henchman_GRI,"We do not fear death, <FirstName>, and had I been able to bring the Silent Lord's touch to my fallen comrades I would not have felt such revulsion at this memory.","우린 죽음을 두려워하지 않아, <FirstName>, 쓰러진 동료들에게 침묵의 군주의 손길을 가져다줄 수 있었다면 이 기억에 그런 혐오감을 느끼지 않았을 거야.",GRI,,,,,0,0
54656,Henchman,Henchman_GRI,"But a zombie has no mind, it feels nothing. The pain that purifies and prepares us for death has no effect on such creatures; the understanding that comes during the moment of death is forever denied to such creatures.","하지만 좀비는 정신이 없고, 아무것도 느끼지 못해. 우리를 정화하고 죽음을 위해 준비시키는 고통이 그런 생명체들에겐 아무 효과가 없어. 죽음의 순간에 오는 깨달음은 그런 생명체들에게 영원히 거부되지.",GRI,,,,,0,0
54657,Henchman,Henchman_GRI,"I destroyed the animated lumps of flesh that were once my brothers and sisters in the Order, but I could not truly kill them. The undead can never be given such release.","교단의 내 형제자매들이었던 육체의 움직이는 덩어리들을 파괴했지만, 진정으로 죽일 순 없었어. 언데드는 그런 해방을 결코 받을 수 없거든.",GRI,,,,,0,0
54658,Henchman,Henchman_GRI,"The lich was destroyed, as were all its minions. We burned its lair, setting fire to the crypt so that the dark magic might be cleansed from a sacred place of death.","리치는 파괴됐고, 그 하수인들도 모두 그랬지. 우리는 그놈의 둥지를 불태웠어, 죽음의 성스러운 장소에서 어두운 마법이 정화될 수 있도록 지하묘지에 불을 질렀지.",GRI,,,,,0,0
54659,Henchman,Henchman_GRI,"I thank you for your words, <FirstName>, though I doubt you truly understand. You bring death and destruction, but you do not understand it as we of the Long Death.","네 말에 감사하지만, <FirstName>, 네가 진정으로 이해한다곤 의심스러워. 넌 죽음과 파괴를 가져오지만, 우리 오랜 죽음처럼 그걸 이해하진 못해.",GRI,,,,,0,0
54660,Henchman,Henchman_GRI,The true horror of what happened to my brothers and sisters is too terrible to comprehend; but I have vowed to free them from the torment of their undeath.,내 형제자매들에게 일어난 진정한 공포는 이해하기엔 너무 끔찍해. 하지만 난 그들을 언데드의 고통에서 해방시키겠다고 맹세했어.,GRI,,,,,0,0
54661,Henchman,Henchman_GRI,"You couldn't possibly understand, <FirstName>. You are a harbinger of death, but you do not understand it as we of the Long Death.","넌 이해할 수 없을 거야, <FirstName>. 넌 죽음의 전령이지만, 우리 오랜 죽음처럼 그걸 이해하진 못해.",GRI,,,,,0,0
54662,Henchman,Henchman_GRI,"You are a servant of the Silent Lord, <FirstName>; you bring death and pain to the world. Yet even so you are not a member of the Long Death. My Order has secrets I am not yet ready to share with you.","넌 침묵의 군주의 종이야, <FirstName>. 세상에 죽음과 고통을 가져오지. 하지만 그래도 넌 오랜 죽음의 일원은 아니야. 우리 교단엔 아직 네게 나눌 준비가 안 된 비밀들이 있어.",GRI,c2journ_grim02,,,,0,0
54663,Henchman,Henchman_GRI,You aided me in finding the ring of Alaganda; I believe you would have helped me bring death to her had she still been alive when we found her.,알라간다의 반지를 찾는 걸 도와줬잖아. 우리가 그녀를 찾았을 때 그녀가 살아있었다면 그녀에게 죽음을 가져다주는 걸 도와줬을 거라 믿어.,GRI,,,,,0,0
54664,Henchman,Henchman_GRI,"Perhaps you can be of service to my Order once more, for without your aid I fear my brothers and sisters will never escape their terrible fate.","아마 다시 한번 우리 교단을 도울 수 있을 거야, 네 도움 없이는 내 형제자매들이 그들의 끔찍한 운명에서 결코 벗어나지 못할까 두렵거든.",GRI,,,,,0,0
54665,Henchman,Henchman_GRI,"I should begin by explaining what happened after we burned the lich's lair. The corpses of our own, those who had risen against us, were brought back to the monastery of my Order.",리치의 둥지를 불태운 후 무슨 일이 있었는지 설명하는 것부터 시작해야겠네. 우리에게 맞서 일어섰던 우리 자신들의 시체들을 우리 교단의 수도원으로 돌려보냈지.,GRI,,,,,0,0
54666,Henchman,Henchman_GRI,There we sought to enact ancient rituals to release their essence from the curse that had bound them to their animated corpses. But the chains of undeath are not easily broken.,거기서 우리는 그들을 살아 움직이는 시체들에 묶어둔 저주로부터 그들의 본질을 풀어줄 고대 의식을 치르려 했어. 하지만 언데드의 사슬은 쉽게 끊어지지 않지.,GRI,,,,,0,0
54667,Henchman,Henchman_GRI,"The components must come from the crypt of a powerful undead monster, but it must be something that has not yet been tainted by the creature's necromancy.","구성 요소는 강력한 언데드 괴물의 지하묘지에서 나와야 하지만, 그 생명체의 강령술로 아직 오염되지 않은 것이어야 해.",GRI,,,,,0,0
54668,Henchman,Henchman_GRI,"For example, we would require the preserved hand from an inanimate corpse within a mummy's crypt.","예를 들어, 미라의 지하묘지 내 살아 움직이지 않는 시체에서 보존된 손이 필요할 거야.",GRI,c2journ_grim03,,,,0,0
54669,Henchman,Henchman_GRI,Only the power of such an item can release the essence of my brothers and sisters into the grasp of the Silent Lord.,그런 아이템의 힘만이 내 형제자매들의 본질을 침묵의 군주의 손아귀로 풀어줄 수 있어.,GRI,nw_ch_action_8,,,,0,0
54670,Henchman,Henchman_GRI,"This is but one aspect of my sevice to the Silent Lord, <FirstName>. The other is to follow your lead as you spread death and destruction across the land.","이건 침묵의 군주를 섬기는 내 일의 한 측면일 뿐이야, <FirstName>. 다른 하나는 네가 땅 전역에 죽음과 파괴를 퍼뜨리는 동안 네 지휘를 따르는 거지.",GRI,,,,,0,0
54671,Henchman,Henchman_GRI,"For the sake of my undead brothers and sisters, I can only hope so.","내 언데드 형제자매들을 위해서라도, 그렇길 바랄 수밖에 없어.",GRI,,,,,0,0
54672,Henchman,Henchman_GRI,You will find that the blessing has enhanced the properties of the amulet I gave you when you found Alaganda's ring for me.,축복이 내가 네게 알라간다의 반지를 찾았을 때 준 호신부의 속성을 강화시켰다는 걸 알게 될 거야.,GRI,,,,,0,0
54673,Henchman,Henchman_GRI,As a member of the Order of the Long Death her reaction to an inevitable event seems rather childish. The Silent Lord comes for us all; we might as well learn to accept it.,오랜 죽음의 교단 일원으로서 그녀의 필연적인 사건에 대한 반응은 꽤 유치해 보여. 침묵의 군주는 우리 모두를 위해 오시니까. 받아들이는 법을 배우는 편이 나아.,GRI,,,,,0,0
54674,Henchman,Henchman_GRI,"Much like the members of your own Order, a monk of the Long Death learns the skill to serve the will of the master.","네 자신의 교단원들처럼, 오랜 죽음의 수도사는 주인의 뜻을 섬기는 기술을 배우지.",GRI,,,,,0,0
54675,Henchman,Henchman_GRI,Before an initiate can be accepted into the Order they must first learn to appreciate the beauty of death. We must walk the cemeteries and graveyards in search of this beauty.,입문자가 교단에 받아들여지기 전에 먼저 죽음의 아름다움을 인식하는 법을 배워야 해. 우린 이 아름다움을 찾아 묘지와 공동묘지를 걸어야 하지.,GRI,,,,,0,0
54676,Henchman,Henchman_GRI,We must live and dwell amongst the dead and dying. We must surround ourselves with that which others consider gruesome or macabre.,죽어가고 있는 자들 사이에서 살고 머물러야 해. 다른 이들이 끔찍하거나 섬뜩하다고 여기는 것으로 우리 자신을 둘러싸야 하지.,GRI,,,,,0,0
54677,Henchman,Henchman_GRI,"The next phase of our training is to understand the tools the Silent Lord uses to prepare us for death. Pain, suffering, sorrow, agony.","우리 훈련의 다음 단계는 침묵의 군주가 우리를 죽음에 준비시키기 위해 사용하는 도구들을 이해하는 거야. 고통, 괴로움, 슬픔, 고뇌.",GRI,,,,,0,0
54678,Henchman,Henchman_GRI,"We participate in the torture of victims, we witness the sweet release they achieve when at last they succumb to death.","우린 희생자들의 고문에 참여하고, 마침내 죽음에 굴복할 때 그들이 얻는 달콤한 해방을 목격하지.",GRI,,,,,0,0
54679,Henchman,Henchman_GRI,And then we subject ourselves to the same torments as our victims. We taste the pain and suffering as it burns away that part of us which clings to the mortal world.,그리고 나서 우리 자신을 희생자들과 같은 고통에 내맡겨. 우린 필멸의 세계에 매달리는 우리의 일부를 불태우는 고통과 괴로움을 맛보지.,GRI,,,,,0,0
54680,Henchman,Henchman_GRI,"Only through experiencing such pain can we understand how it prepares us to kneel at the altar of the Silent Lord. Pain is of this world, but it can release us to the next.","그런 고통을 경험함으로써만 그것이 우리를 침묵의 군주의 제단에 무릎 꿇도록 어떻게 준비시키는지 이해할 수 있어. 고통은 이 세상의 것이지만, 우리를 다음 세상으로 풀어줄 수 있지.",GRI,,,,,0,0
