StrRef,SpeakerType,SpeakerName,TextEng,Text,DLG,Scripts,Conditions,DialogueContext,SoundRef,VolumeVariance,PitchVariance
35602,Dialog,HERO,Who has summoned me? Who claims the title of Champion? Who is my inheritor?,누가 나를 소환했느냐? 누가 영웅의 칭호를 주장하느냐? 누가 내 후계자인가?,M2Q3B01HERO,nw_d1_talktime,,,,0,0
35603,Dialog,HERO,"A contendor approaches. My cause... my people... vanished long ago, but my spirit is vain, and I will have the respect I am due.","도전자가 다가오는구나. 내 대의... 내 백성... 오래전에 사라졌지만, 내 영혼은 자존심이 강하여 마땅히 받아야 할 존경을 받으리라.",M2Q3B01HERO,,,,,0,0
35604,Dialog,HERO,"Answer my question and prove you are my proper inheritor. Fail, and burn for dishonoring my legacy with your ignorance.","내 질문에 답하여 네가 합당한 후계자임을 증명하라. 실패하면, 무지로 내 유산을 모욕한 대가로 타오르라.",M2Q3B01HERO,,,,,0,0
35605,Dialog,HERO,"So be it. Show your knowledge of my legacy. The clan of my siblings, now dust, just as I... What was it called?","좋다. 내 유산에 대한 지식을 보여라. 나처럼 이제는 먼지가 된 내 형제들의 씨족... 그것의 이름이 무엇이었느냐?",M2Q3B01HERO,,,,,0,0
35606,Dialog,HERO,You would be pointless by choice?! Not good enough!,일부러 무의미하게 굴겠다는 거냐?! 그건 안 돼!,M2Q3B01HERO,,,,,0,0
35607,Dialog,HERO,"You tilt without reason. I am a shade of what I was, and cannot be made less than I am. You will have nothing.","쓸데없이 덤비는구나. 나는 예전 모습의 그림자일 뿐, 이 이상 초라해질 수 없다. 넌 아무것도 못 얻는다.",M2Q3B01HERO,,,,,0,0
35608,Dialog,HERO,"It's... it's not stupid, it's a good one. See, it ensures that you quested to know what I have done, and are therefore worthy of what is mine.","이건... 이건 멍청한 게 아니라고, 좋은 질문이야. 봐, 내가 뭘 했는지 알려고 수고했다는 증거가 되고, 그래서 내 것을 받을 자격이 있다는 거야.",M2Q3B01HERO,,,,,0,0
35609,Dialog,HERO,"Quest for the legacy I left. Know the glory of my lost kingdom and you shall have what is mine. Now burn, and learn of your failure.","내가 남긴 유산을 탐구하라. 내 잃어버린 왕국의 영광을 알면 내 것을 얻으리라. 이제 타오르며, 네 실패를 배워라.",M2Q3B01HERO,,,,,0,0
35610,Dialog,HERO,That is... correct. You did not hesitate. How did you come by this difficult information? My legacy must have reached far.,그것은... 맞다. 망설이지 않았구나. 이 어려운 정보를 어떻게 얻었느냐? 내 유산이 멀리까지 닿았나 보군.,M2Q3B01HERO,,,,,0,0
35611,Dialog,HERO,You are just guessing! Respect me and quest for what I want! Search and be rewarded! Taunt me again and I shall not be so lenient!,그냥 추측하는 거잖아! 나를 존경하고 내가 원하는 것을 탐구하라! 찾으면 보상받으리라! 다시 조롱하면 이렇게 관대하지 않을 것이다!,M2Q3B01HERO,,,,,0,0
35612,Dialog,HERO,You are doing that on purpose! Do not mock my fate! Quest for my answer and be rewarded! Taunt me again and suffer further!,일부러 그러는 거지! 내 운명을 조롱하지 마라! 내 답을 탐구하면 보상받으리라! 다시 조롱하면 더 고통받을 것이다!,M2Q3B01HERO,,,,,0,0
35613,Dialog,HERO,"Your manner is strange, but the answer satisfies. Take my great possessions and fulfill the prophecies laid down at my death.","네 태도는 이상하지만, 답은 만족스럽다. 내 위대한 소유물을 가져가고 내 죽음에 내려진 예언을 실현하라.",M2Q3B01HERO,,,,,0,0
35614,Dialog,HERO,"I was not forgotten. At last, I can rest.","나는 잊히지 않았구나. 마침내, 쉴 수 있겠다.",M2Q3B01HERO,m2q3herolc2,,,,0,0
35615,Dialog,HERO,"A corpse's book? This isn't right. He must have quested. You just had the answer served on a platter, swiped from his backpack.","시체의 책이라고? 이건 아닌데. 그는 분명 수고했을 거야. 넌 그냥 그의 배낭에서 슬쩍해서 답을 공짜로 얻은 거잖아.",M2Q3B01HERO,,,,,0,0
35616,Dialog,HERO,"What? No, no I don't. See, I'm dead so I don't get out much. Idiot. ""Another riddle,"" <he/she> says. Thanks a lot.","뭐? 아니, 없어. 봐, 난 죽었으니까 밖에 잘 안 나가거든. 바보 같으니라고. ""다른 수수께끼""래. 정말 고맙다.",M2Q3B01HERO,,,,,0,0
35617,Dialog,HERO,Do you know how long I've been here? Hah? I've watched water drips melt rock. A snail is a year's worth of excitement!,내가 여기 얼마나 있었는지 알아? 응? 물방울이 바위를 녹이는 걸 봤다고. 달팽이 한 마리가 1년치 흥분거리야!,M2Q3B01HERO,,,,,0,0
35618,Dialog,HERO,"Yes, but... that's not the way it was supposed to be... You're supposed to be on a great quest to fulfill my legacy.","그래, 하지만... 이러면 안 되는데... 넌 내 유산을 이루기 위한 위대한 모험을 해야 하잖아.",M2Q3B01HERO,,,,,0,0
35619,Dialog,HERO,Should'a walked toward the light when I had the chance. I don't believe this.,기회가 있을 때 빛을 향해 걸어갔어야 했는데. 이건 못 믿겠어.,M2Q3B01HERO,,,,,0,0
35620,Dialog,HERO,"What?! What do you want? Look, I'm done, all right? My stuff is in the casket. It's yours. Go nuts. I'm out of here.","뭐?! 뭘 원해? 이봐, 난 끝났어, 알겠어? 내 물건은 관 안에 있어. 네 거야. 마음대로 해. 난 여기서 떠날 거야.",M2Q3B01HERO,m2q3herolc1,,,,0,0
35621,Dialog,HERO,"Oh yes, I am ever so pleased to be a diversion from something important. Don't patronize me. I was great once.","오 그래, 중요한 일에서 잠깐 한눈파는 대상이 되어서 정말 기쁘군. 날 업신여기지 마. 나도 한때는 위대했다고.",M2Q3B01HERO,,,,,0,0
35622,Dialog,HERO,"Hunting... bears? You were killing simple animals and just stumbled on my centuries old tomb? Well, I certainly feel important now. Yes <sir/madam>.","사냥... 곰을? 그냥 동물이나 잡다가 수백 년 된 내 무덤을 우연히 발견했다고? 뭐, 확실히 내가 대단한 존재인 게 느껴지는군. 네, <sir/madam>.",M2Q3B01HERO,,,,,0,0
