StrRef,SpeakerType,SpeakerName,TextEng,Text,DLG,Scripts,Conditions,DialogueContext,SoundRef,VolumeVariance,PitchVariance
26354,Creature,Morag,Morag,모라그,2Q6K_MORAG|M2Q06CMORAG|M3Q02G01MORA|M4Q01D08MORA,,,,,0,0
42517,Creature,Morag,"You are welcome in my service, paladin. I have awaited your arrival with great anticipation.","내 휘하에 온 걸 환영한다, 성기사. 네가 오길 크게 기대하며 기다렸다.",2Q6K_MORAG,mpatchcutscene,,,vs_nmoragf_050,0,0
42524,Creature,Morag,"Remember, Maugrim, that it is of great importance that the other Words of Power be located. You must beware Haedraline, however, as she will ---","기억해라, 모그림, 다른 권능의 언령을 찾는 것이 매우 중요하다. 하지만 하에드랄린을 조심해야 한다, 그녀가---",2Q6K_MORAG,,,,vs_nmoragf_051,0,0
42525,Creature,Morag,"You have been lax, Maugrim. We have intruders.","해이해졌구나, 모그림. 침입자가 있다.",2Q6K_MORAG,,,,vs_nmoragf_052,0,0
42526,Creature,Morag,The Word of Power cannot fall into the hands of the enemy. Take Aribeth and leave now. I shall summon my own servants to deal with these... fools.,"권능의 언령이 적의 손에 들어가선 안 된다. 아리베스를 데리고 지금 떠나라. 이 멍청이들은 내 종복을 불러 처리하겠다.",2Q6K_MORAG,2q6k_startfight,,,vs_nmoragf_053,0,0
45093,Creature,Morag,"What manner of slave are you, that does not cast down <his/her> eyes in my presence! (hiss) I could have you flayed for this!","(쉭) 네가 대체 무슨 노예냐, 내 앞에서 눈을 깔지 않다니! 이런 짓 때문에 살가죽을 벗겨버릴 수도 있어!",M3Q02G01MORA,,,,,0,0
45094,Creature,Morag,Guards! Protect me from this creature!,"경비병! 이 생명체에게서 나를 지켜라!",M3Q02G01MORA,m3q02g01moraesc,,,,0,0
45095,Creature,Morag,"There is something strange about you, creature. Where is your collar? (hiss) Why is your forehead not branded with the mark of the house you serve?","네게 뭔가 이상한 게 있어, 생명체. 목걸이는 어디 있지? (쉭) 왜 이마에 네가 섬기는 가문의 낙인이 찍혀 있지 않은 거지?",M3Q02G01MORA,,,,,0,0
45096,Creature,Morag,"Do you not recognize me? I am Morag, First Daughter of the Queen and heir to the throne! (hiss) How dare you approach me?","나를 모르겠느냐? 나는 모라그, 여왕의 첫째 딸이자 왕위 계승자다! (쉭) 감히 어떻게 내게 다가오느냐?",M3Q02G01MORA,,,,,0,0
45097,Creature,Morag,Your mistress should have removed your tongue for such defiance! (hiss) But wait... ,"네 여주인이 그런 반항에 혀를 잘라버렸어야 해! (쉭) 하지만 잠깐...",M3Q02G01MORA,,,,,0,0
45098,Creature,Morag,"Your clothes and appearance are unknown to me. (hiss) You are no slave! Who are you, creature?","네 옷차림과 생김새는 내게 낯설다. (쉭) 넌 노예가 아니야! 넌 누구냐, 생명체?",M3Q02G01MORA,,,,,0,0
45099,Creature,Morag,"Of course, the time sink! (hiss) This is not the world you know, creature. The secrets of the Creator Race are not yours for the taking.","물론이지, 시간의 늪! (쉭) 여기는 네가 아는 세계가 아니야, 생명체. 창조자 종족의 비밀은 네가 가져갈 것이 아니다.",M3Q02G01MORA,,,,,0,0
45100,Creature,Morag,"You are arrogant, when you should tremble before the terrible power of the Creator Race. (hiss) How can this be? Unless... ","창조자 종족의 무시무시한 힘 앞에 떨어야 할 네가 오만하구나. (쉭) 어떻게 이럴 수가 있지? 혹시...",M3Q02G01MORA,,,,,0,0
45101,Creature,Morag,Guards! Slay this creature! (hiss) It must not escape back to its own time!,"경비병! 이 생명체를 죽여라! (쉭) 자기 시대로 도망가게 해선 안 돼!",M3Q02G01MORA,m3q02g01moraesc,,,,0,0
45102,Creature,Morag,"(hiss) I see your mind is simple, even for a slave. I wonder that your mistress would let you wander unsupervised.","(쉭) 노예치고도 머리가 단순하구나. 네 여주인이 어떻게 감시 없이 돌아다니게 놔뒀는지 모르겠다.",M3Q02G01MORA,,,,,0,0
45103,Creature,Morag,"I could have your tongue removed for daring to speak to me, slave. (hiss) But your brazen courage amuses me. It is rare for a slave to show such bravery.","감히 내게 말을 걸다니 혀를 잘라버릴 수도 있어, 노예. (쉭) 하지만 네 뻔뻔한 용기가 재밌구나. 노예가 그런 용기를 보이는 건 드물지.",M3Q02G01MORA,,,,,0,0
45104,Creature,Morag,This is a temple to the glory of the Creator Race! (hiss) The power and might of our people shall be housed within the heart of these walls for all eternity!,"여기는 창조자 종족의 영광을 위한 신전이다! (쉭) 우리 민족의 힘과 위력이 이 벽의 심장 속에 영원히 보존될 것이다!",M3Q02G01MORA,,,,,0,0
45105,Creature,Morag,"I shall answer your questions, creature, though if you displease me your life shall be forfeit. (hiss) What is it you wish to know, slave?","네 질문에 대답해주마, 생명체, 하지만 내 마음에 안 들면 네 목숨을 잃게 될 거다. (쉭) 알고 싶은 게 뭐냐, 노예?",M3Q02G01MORA,,,,,0,0
45106,Creature,Morag,"As a slave you need not understand more than that. (hiss) It is the will of your mistresses that you build this temple, and you will bow down to that will.","노예로서 그 이상 이해할 필요 없다. (쉭) 네 여주인들의 뜻에 따라 이 신전을 짓는 것이고, 넌 그 뜻에 복종해야 해.",M3Q02G01MORA,,,,,0,0
45107,Creature,Morag,Has your mistress taught you nothing? (hiss) The translation amulet I wear gives you an understanding of my words.,"네 여주인이 아무것도 안 가르쳤냐? (쉭) 내가 찬 번역 호신부가 네게 내 말을 이해하게 해주는 거야.",M3Q02G01MORA,,,,,0,0
45108,Creature,Morag,(hiss) If not for the amulets we would have no use for your kind. It is the only way we can make our servants and slaves bow down to our orders.,"(쉭) 호신부가 없었다면 너희 같은 것들은 쓸모가 없었을 거다. 종복과 노예들을 우리 명령에 복종시킬 수 있는 유일한 방법이야.",M3Q02G01MORA,,,,,0,0
45109,Creature,Morag,I will not discuss my royal person with a mere slave. (hiss) The intrigue and political machinations of court would be lost on a lowly creature like you in any case.,"한낱 노예와 내 왕족의 신분을 논하지 않겠다. (쉭) 어차피 궁정의 음모와 정치적 술책은 너 같은 하찮은 생명체에겐 이해할 수 없을 테니.",M3Q02G01MORA,,,,,0,0
45110,Creature,Morag,"Poison slipped into a mother's cup, an assassin's blade twisted in the belly of an elder sister, an ally betrayed by a false rumor, an infant sibling smothered in his sleep... (hiss) What could a slave know of the motivation behind such things?","어머니의 잔에 독을 타고, 언니의 배에 암살자의 칼을 꽂고, 거짓 소문으로 동맹자를 배신하고, 잠든 어린 남매를 질식시키고... (쉭) 노예가 그런 일들의 동기를 뭘 알겠느냐?",M3Q02G01MORA,,,,,0,0
45111,Creature,Morag,My actions transcend mere life and death! I am of royal blood and I seek the immortality of the throne! (hiss) But your life is void of ambition. You are a slave. Your only concern is to bow to the will of your mistress.,"내 행동은 단순한 삶과 죽음을 초월한다! 나는 왕족의 피를 이었고 왕좌의 불멸을 추구한다! (쉭) 하지만 네 삶은 야망이 없다. 넌 노예야. 네 유일한 관심사는 여주인의 뜻에 복종하는 것뿐이야.",M3Q02G01MORA,,,,,0,0
45112,Creature,Morag,"How dare you speak the name of our most sacred relics? (hiss) I could have your entrails torn from your body for profaning the holy Words, slave!","감히 우리의 가장 신성한 유물의 이름을 입에 담느냐? (쉭) 신성한 언령을 모독한 죄로 네 내장을 끄집어낼 수도 있어, 노예!",M3Q02G01MORA,,,,,0,0
45113,Creature,Morag,I demand you tell me how you heard of the Words of Power! No slave must know of such things! (hiss) But wait... ,"권능의 언령을 어떻게 알게 됐는지 말해! 어떤 노예도 그런 것을 알아선 안 돼! (쉭) 하지만 잠깐...",M3Q02G01MORA,,,,,0,0
49032,Creature,Morag,"You are powerful - for a <race> slave. You have slain Maugrim, the prophet who heralded my coming.","<race> 노예치곤 강하구나. 내 도래를 예고한 예언자 모그림을 죽였어.",M4Q01D08MORA,,,,vs_nmoragf_064,0,0
49033,Creature,Morag,"My priests shield me from harm! Your attacks are useless, slave!","내 사제들이 나를 해로부터 보호한다! 네 공격은 소용없어, 노예!",M4Q01D08MORA,,,,vs_nmoragf_069,0,0
49034,Creature,Morag,"You have defeated Aribeth, the champion I chose from among the slave races. You have slaughtered many of my warriors and priests.","노예 종족 중에서 내가 선택한 용사 아리베스를 물리쳤구나. 내 전사들과 사제들을 많이 학살했어.",M4Q01D08MORA,,,,vs_nmoragf_065,0,0
49035,Creature,Morag,"But now you face Morag, Queen of the Old Ones, High Priestess of the Creators! Kneel, slave, and I shall let you live!","하지만 이제 넌 태고의 존재들의 여왕이자 창조자들의 대사제인 모라그와 마주한다! 무릎 꿇어라, 노예, 그러면 살려주지!",M4Q01D08MORA,,,,vs_nmoragf_066,0,0
49036,Creature,Morag,I shall rip away your flesh and feast upon your soul!,"네 살점을 찢어내고 영혼을 탐식해주마!",M4Q01D08MORA,nw_d1_attonend,,,vs_nmoragf_068,0,0
49037,Creature,Morag,"No - I cannot die! I am Morag, Queen of the Creators! I am immortal! No! NOOO!!!!","안 돼 - 난 죽을 수 없어! 나는 창조자들의 여왕 모라그다! 난 불멸이야! 안 돼! 안 돼애애!!!",M4Q01D08MORA,m4q1d08_moragdie,,,vs_nmoragf_067,0,0
