StrRef,SpeakerType,SpeakerName,TextEng,Text,DLG,Scripts,Conditions,DialogueContext,SoundRef,VolumeVariance,PitchVariance
60493,Dialog,NEUR,"Ah, <FirstName> - I see you are back. But... where is your trial notebook? You agreed to defend Rolgan; without that book no one will recognize you as an officer of the court!","아, <FirstName> - 돌아오셨군요. 하지만... 재판 수첩은 어디 있습니까? 롤간을 변호하기로 하셨잖아요. 그 수첩 없이는 아무도 당신을 법정의 대리인으로 인정하지 않을 것입니다!",M3Q01A01NEUR,,,,,0,0
60494,Dialog,NEUR,"Please, <FirstName>, I know you have much on your mind. But if you are to participate in Rolgan's trial you must keep that notebook with you at all times.","<FirstName>, 마음에 많은 것들이 있으시다는 건 알지만, 롤간의 재판에 참여하시려면 그 수첩을 항상 지니고 계셔야 합니다.",M3Q01A01NEUR,,,,,0,0
60495,Dialog,NEUR,"In the meantime, is there anything else I can do for you before Rolgan's trial, <FirstName>?","그동안, <FirstName>, 롤간의 재판 전에 다른 도움이 필요하신 건 없습니까?",M3Q01A01NEUR,,,,,0,0
60496,Dialog,NEUR,"Of course, <FirstName>. Here is another copy of the notebook. Remember, you must keep it on at all times as a symbol ofTyr's authority.","물론입니다, <FirstName>. 여기 수첩 사본이 있습니다. 기억하십시오, 티르의 권위의 상징으로 항상 지니고 계셔야 합니다.",M3Q01A01NEUR,,,,,0,0
60497,Dialog,NEUR,"Without it, no one will recognize you as an officer of the court. Now, is there anything else I can do for you, <FirstName>?","그것 없이는 아무도 당신을 법정의 대리인으로 인정하지 않을 것입니다. 자, <FirstName>, 다른 도움이 필요하신 건 없습니까?",M3Q01A01NEUR,m3q01a01neurjour,,,,0,0
