StrRef,SpeakerType,SpeakerName,TextEng,Text,DLG,Scripts,Conditions,DialogueContext,SoundRef,VolumeVariance,PitchVariance
82325,Dialog,LEOPARD,"The leopard responds to your empathic communication with images from his mind. He explains that his mistress is a druid of the desert realms, and that while she stays in this camp she is not like the other humans here.","표범이 당신의 공감적 의사소통에 마음속 이미지로 응답합니다. 그는 주인이 사막 영역의 드루이드이며, 이 야영지에 머물고 있지만 여기 다른 인간들과는 다르다고 설명합니다.",Q5A_LEOPARD,,,,,0,0
82326,Dialog,LEOPARD,He has little else to add other than his great affection for her. He warns you not to commit any violence against her or the people of the camp. His mistress commands powerful magic which she will use to defend them.,그녀에 대한 큰 애정 외에는 덧붙일 말이 거의 없습니다. 그는 당신에게 그녀나 야영지 사람들에게 폭력을 행사하지 말라고 경고합니다. 그의 주인은 그들을 방어하는 데 사용할 강력한 마법을 다룹니다.,Q5A_LEOPARD,,,,,0,0
82327,Dialog,LEOPARD,You fish into your pack for a few strips of dried meat. The leopard sniffs at them but declines. It prefers live prey.,배낭에서 말린 고기 몇 조각을 꺼냅니다. 표범이 냄새를 맡지만 거절합니다. 살아있는 먹이를 선호합니다.,Q5A_LEOPARD,,,,,0,0
94829,Creature,LaFontaine,LaFontaine,라폰테인,CUT1_LAFONTAINE,,,,,0,0
97177,Dialog,LOSTNAMES,"A sea of names has been etched into the ice, buried between its countless layers. Many of them are so deep that you can only make out their dim outlines amidst the soft blue light.","수많은 이름의 바다가 얼음에 새겨져 있으며, 끝없는 층 사이에 묻혀 있습니다. 그 중 많은 것들이 너무 깊어서 부드러운 푸른 빛 속에서 희미한 윤곽만 겨우 알아볼 수 있습니다.",H2_LOSTNAMES,,,,,0,0
100098,Creature,Lazy the Quarry Imp,Lazy the Quarry Imp,게으름뱅이 채석장 임프,H2_LAZYBODY,,,,,0,0
100128,Creature,Lava Beast,Lava Beast,용암 짐승,HX_FIREELEM,,,,,0,0
105111,Dialog,LIZARD1,"This lizard folk looks you up and down, then hisses out: ""A sssurfacer? Odd. Are you a ssslaver, then, up on your sssun-ssscorched world? Or have you come here to watch the pit fightsss?""","이 도마뱀인이 당신을 위아래로 훑어본 뒤 쉿 소리를 내며 말합니다: ""쉿쉿... 지상인? 이상한데. 그럼 당신은 노예상인가, 스스... 태양에 그을린 세계에서? 아니면 투기장 구경하러 왔나?""",Q2D6LIZARD1,nw_d1_talklevel,,,,0,0
105112,Dialog,LIZARD1,"""Goodbye, sssurfacer.""","""안녕, 쉿... 지상인.""",Q2D6LIZARD1,,,,,0,0
105113,Dialog,LIZARD1,"His reptilian eyes narrow in suspicion. ""I don't like questionsss. If you plan to trade thrallsss with the illithid, you should learn to keep information to yourself, sssurfacer.""","파충류 눈이 의심스럽게 가늘어집니다. ""질문은 쓰읏... 좋아하지 않아. 일리시드와 노예 거래할 생각이라면, 정보는 자기만 알고 있는 법을 배워야 해, 지상인.""",Q2D6LIZARD1,,,,,0,0
105114,Dialog,LIZARD1,"""The illithid do not come to thisss place. It could be they understand we need a place to be away from their thought-probing and ssstrange appearance, and they respect our privacy.""","""일리시드는 쉿... 이 장소에 오지 않아. 우리가 그들의 생각 탐지와 이상한 외모에서 벗어날 장소가 필요하다는 걸 이해하고, 스스... 우리 사생활을 존중하는 것 같아.""",Q2D6LIZARD1,,,,,0,0
105115,Dialog,LIZARD1,"""Or it could be they are afraid of the golem at the bar. Their mind powersss have no effect on a construct. In any case, thisss is the one place in Zorvak'Mur the illithid will never go.""","""아니면 술집 골렘을 두려워하는 걸지도. 그들의 정신 능력은 쓰읏... 구조물에 효과가 없거든. 어쨌든 쉿쉿... 여기는 조르박무르에서 일리시드가 절대 가지 않는 유일한 장소야.""",Q2D6LIZARD1,,,,,0,0
105116,Dialog,LIZARD1,"The lizard laughs at you, flicking his forked tongue in and out. ""Only the illithid are given accessss to the Elder Brain. They won't let you in, sssurfacer.""","도마뱀인이 갈라진 혀를 날름거리며 당신을 비웃습니다. ""엘더 브레인에 접근할 수 있는 건 스스... 일리시드뿐이야. 들여보내 주지 않을 거야, 쉿... 지상인.""",Q2D6LIZARD1,,,,,0,0
105117,Dialog,LIZARD1,"""You could sssspeak to the guards by the teleporter in the sssoutheast, if you're desperate. But they're more likely to send you off to the fighting pitsss than take you to the Elder Brain.""","""정말 다급하다면 쓰읏... 남동쪽 순간이동기 근처 경비병들에게 말해볼 수 있어. 하지만 엘더 브레인으로 데려가기보다 쉿쉿... 투기장으로 보낼 가능성이 높지.""",Q2D6LIZARD1,,,,,0,0
105118,Dialog,LIZARD1,"""Sssome like to watch their purchases battle each other in combat, though I think it is a foolish waste of merchandise.""","""쉿쉿... 어떤 이들은 구입한 것들끼리 전투하는 걸 보는 걸 좋아하지. 하지만 난 스스... 어리석은 상품 낭비라고 생각해.""",Q2D6LIZARD1,,,,,0,0
105119,Dialog,LIZARD1,"""Even if your thrall winsss, the illithid destroy their mindsss in preparation for the contest. They turn them into sssavage animalsss. It makesss for better fightsss.""","""네 노예가 이긴다 해도, 쉿... 일리시드는 경기 준비로 그들의 정신을 파괴해. 야만적인 동물로 만들지. 스스... 그래야 더 나은 싸움이 되니까.""",Q2D6LIZARD1,,,,,0,0
105120,Dialog,LIZARD1,"""If you are interested in thisss ssspectacle, you should ssspeak to the illithid pit boss in the center of town. He will handle any wagersss you wish to make.""","""이 구경거리에 관심 있다면, 쉿쉿... 마을 중앙의 일리시드 투기장 관리인에게 말해봐. 하고 싶은 내기는 뭐든 쓰읏... 처리해 줄 거야.""",Q2D6LIZARD1,,,,,0,0
105121,Dialog,LIZARD1,"""You ssshould check out the auction lot in the center of town, then. I'll be going there myself, later. If you purchase a thrall, they will prepare them for the pitsss at no extra charge.""","""그럼 쉿... 마을 중앙의 경매장을 확인해 봐. 나도 나중에 거기 갈 거야. 노예를 구입하면, 스스... 추가 비용 없이 투기장 준비를 해줄 거야.""",Q2D6LIZARD1,,,,,0,0
105122,Dialog,LIZARD1,"The lizard folk nods at you by way of greeting. Though you are of a different race, he obviously prefers your company to that of the illithid. ""Welcome back, sssurfacer.""","도마뱀인이 인사로 당신에게 고개를 끄덕입니다. 당신이 다른 종족이지만, 분명 일리시드보다는 당신의 동행을 선호합니다. ""쉿쉿... 다시 왔군, 지상인.""",Q2D6LIZARD1,,,,,0,0
105123,Dialog,LIZARD1,"""I heard the sssounds of battle outside. That's why I'm ssstaying in here... I'm a ssslaver, not a warrior."" ","""밖에서 전투 소리가 들렸어. 쉿... 그래서 여기 머물러 있는 거야... 난 스스... 노예상인이지, 전사가 아니거든."" ",Q2D6LIZARD1,,,,,0,0
105131,Dialog,LIZARD2,"Ssspeak to my master, if you wish. But don't try anything.","원한다면 내 주쓰인과 이야기해. 하지만 이상한 짓은 하지 마.",Q2D6LIZARD2,,,,,0,0
107808,Creature,Lavoera,Lavoera,라보에라,Q2DLAVOERA|Q3C_LAVOERA,,,,,0,0
