StrRef,SpeakerType,SpeakerName,TextEng,Text,DLG,Scripts,Conditions,DialogueContext,SoundRef,VolumeVariance,PitchVariance
84631,Dialog,PILG_SENSEI,"""Greetings, <FullName>. Like all who struggle in this life, I knew you would come to lay your troubles at the feet of the Sleeping Man... How is your Pilgrimage thus far?""","""어서 오세요, <FullName>. 세상의 고통에 시달리는 모든 이들처럼, 당신도 잠자는 자께 고민을 털어놓으러 올 줄 알았습니다... 순례는 어떠신가요?""",H2_PILG_SENSEI,,,,vs_nx2sensf_50,0,0
84632,Dialog,PILG_SENSEI,"""Very well. Let us see if you are ready... Answer me, Pilgrim: Who is the Sleeping Man?""","""좋습니다. 준비가 되셨는지 볼까요... 대답해 보세요, 순례자여. 잠자는 자는 누구입니까?""",H2_PILG_SENSEI,,,,vs_nx2sensf_51,0,0
84633,Dialog,PILG_SENSEI,"""I am Dharvana, a sensei of the githzerai and a fellow Pilgrim of the Sleeping Man. I have made the journey to be by his side many times and every time I've grown in wisdom.""","""저는 다르바나, 기스제라이 사부이자 잠자는 자의 동료 순례자입니다. 그분 곁으로 가는 여정을 여러 번 했고, 매번 지혜가 깊어졌습니다.""",H2_PILG_SENSEI,,,,vs_nx2sensf_52,0,0
84634,Dialog,PILG_SENSEI,"""Since you have asked, I shall answer. This is the first-fold mystery of the Sleeping Man, so remember it well... He is a celestial planetar, a creature of good. Like you and like I, he is a Pilgrim, traveling the planes.""","""물으셨으니 답하겠습니다. 잠자는 자의 첫 번째 수수께끼이니 잘 기억하세요... 그분은 천상의 플레네타, 선의 존재입니다. 당신이나 저처럼, 그분도 차원을 떠도는 순례자입니다.""",H2_PILG_SENSEI,h2a_sens_learn1,,,vs_nx2sensf_53,0,0
84635,Dialog,PILG_SENSEI,"""As the Sleeping Man teaches, sometimes home is not enough. One always comes in search of something. Perhaps when you find it, the path home will be more clear.""","""잠자는 자께서 가르치시듯, 때로는 고향만으로는 부족할 때가 있습니다. 누구나 무언가를 찾아 오기 마련이죠. 그것을 찾으면, 돌아갈 길이 더 또렷해질 겁니다.""",H2_PILG_SENSEI,,,,vs_nx2sensf_54,0,0
84636,Dialog,PILG_SENSEI,"""Alas, I do not. My Pilgrims grow impatient for the journey home. They have not mastered the Five-Fold Mysteries of the Sleeping Man and have yet to grasp the nature of his patience.""","""아쉽게도, 안 됩니다. 제 순례자들이 귀향을 서두르고 있거든요. 잠자는 자의 오중 수수께끼를 터득하지 못했고, 그분의 인내가 무엇인지 아직 이해하지 못했습니다.""",H2_PILG_SENSEI,,,,vs_nx2sensf_55,0,0
84637,Dialog,PILG_SENSEI,"""Nooo!!!! No one disturbs the Sleeping Man!""","""안 됩니다!!!! 누구도 잠자는 자를 방해할 수 없습니다!""",H2_PILG_SENSEI,,,,vs_nx2sensf_56,0,0
84638,Dialog,PILG_SENSEI,"""Welcome, <FirstName>. Be very quiet as you enter the chambers. The Sleeping Man must not be disturbed.""","""어서 오세요, <FirstName>. 방에 들어가실 때 조용히 해주세요. 잠자는 자를 깨워선 안 됩니다.""",H2_PILG_SENSEI,,,,vs_nx2sensf_57,0,0
84639,Dialog,PILG_SENSEI,"""You have found your answers in the Sleeping Man's dream, haven't you... Now follow them, Pilgrim, wherever they may lead.""","""잠자는 자의 꿈에서 답을 찾으셨군요... 이제 그 답을 따라가세요, 순례자여. 어디로 이끌든.""",H2_PILG_SENSEI,,,,vs_nx2sensf_58,0,0
84640,Dialog,PILG_SENSEI,"""Yes, his is a pure soul with no trace of pride or vice or vengeance. In following him, we take on his beneficence... Now answer me, Pilgrim: From where did he come?""","""맞습니다. 그분은 교만도, 악덕도, 복수심도 없는 순수한 영혼입니다. 그분을 따르면 우리도 그분의 자비를 닮아가죠... 자, 대답해 보세요, 순례자여. 그분은 어디서 오셨습니까?""",H2_PILG_SENSEI,,,,vs_nx2sensf_59,0,0
84641,Dialog,PILG_SENSEI,"""That he does. Elysium is a place of beauty and peace and perfection, yet he turned his back on it and never returned, choosing instead to roam the planes... So answer me, Pilgrim: Why did he leave?""","""맞습니다. 엘리시움은 아름다움과 평화, 완벽함의 땅이지만, 그분은 그곳을 등지고 돌아가지 않았습니다. 차원을 떠도는 길을 택하셨죠... 자, 대답해 보세요, 순례자여. 왜 떠나셨습니까?""",H2_PILG_SENSEI,,,,vs_nx2sensf_60,0,0
84642,Dialog,PILG_SENSEI,"""He knew that without passion we are nothing and thus he journeyed many years in search of his true love. His journey brought him here, to the frozen wastes of Cania... Answer me, Pilgrim: Who did he seek?""","""그분은 열정 없이는 아무것도 아니라는 걸 아셨고, 그래서 진정한 사랑을 찾아 오랜 세월 여행하셨습니다. 그 여정 끝에 여기, 카니아의 얼어붙은 황무지에 이르렀죠... 대답해 보세요, 순례자여. 누구를 찾으셨습니까?""",H2_PILG_SENSEI,,,,vs_nx2sensf_61,0,0
84643,Dialog,PILG_SENSEI,"""The Knowers ruled this plane before the Baatezu claimed it as one of their Hells. In his wisdom, the Sleeping Man asked simply where his true love would be found... Tell me, Pilgrim: What was the answer?""","""바테주가 이곳을 지옥으로 삼기 전에 현자들이 이 차원을 다스렸습니다. 잠자는 자께서는 지혜롭게도 진정한 사랑을 어디서 찾을 수 있는지만 물으셨죠... 말해 보세요, 순례자여. 답이 무엇이었습니까?""",H2_PILG_SENSEI,,,,vs_nx2sensf_62,0,0
84644,Dialog,PILG_SENSEI,"""So he returned here, to the Gates, content in the knowledge that she would find him. Weary from his journeys, he fell asleep. That was all long, long ago but still he waits here, dreaming of his true love.""","""그래서 그분은 여기, 관문으로 돌아왔습니다. 그녀가 자신을 찾아올 거라 믿으며. 긴 여정에 지친 그분은 잠드셨죠. 아주 오래전 일이지만, 여전히 그분은 여기서 진정한 사랑을 꿈꾸며 기다리고 계십니다.""",H2_PILG_SENSEI,,,,vs_nx2sensf_63,0,0
84645,Dialog,PILG_SENSEI,"""You have mastered the Five-Fold Mysteries of the Sleeping Man, Pilgrim. When you enter his chambers, wear this crystal around your neck... It will help you see his dreams.""","""잠자는 자의 오중 수수께끼를 터득하셨군요, 순례자여. 그분의 방에 들어갈 때 이 수정을 목에 거세요... 그분의 꿈을 보는 데 도움이 될 겁니다.""",H2_PILG_SENSEI,h2a_sens_amulet,,,vs_nx2sensf_64,0,0
97487,Dialog,PILG_SENSEI,"""That is alright. They have little inherent value and are easily fashioned. I always keep a few on hand for new Pilgrims that come my way.""","""괜찮아요. 본래 가치가 거의 없고 만들기도 쉬워요. 새로 오는 순례자들을 위해 항상 몇 개 준비해 두거든요.""",H2_PILG_SENSEI,h2a_sens_amulet,,,,0,0
97488,Dialog,PILG_SENSEI,"""Among the githzerai, crystals of various sorts are used to focus and amplify the thoughts of others, making them easier to read. I'm not sure if it will work for one such as you.""","""기스제라이는 여러 종류의 수정을 써서 타인의 생각을 집중하고 증폭시켜 읽기 쉽게 만들어요. 당신 같은 분에게도 효과가 있을지는 잘 모르겠네요.""",H2_PILG_SENSEI,,,,,0,0
97489,Dialog,PILG_SENSEI,"""Simply wear it about your neck as you reach out to the Sleeping Man. With a little luck, you will see his dreams.""","""잠자는 자께 다가갈 때 그냥 목에 걸기만 하세요. 운이 좋으면 그분의 꿈을 보게 될 거예요.""",H2_PILG_SENSEI,,,,,0,0
97490,Dialog,PILG_SENSEI,"The sensei smiles as you approach but her eyes remain closed in meditation. In your mind, you feel her grant you permission to speak.","당신이 다가가자 사부가 미소 짓지만, 명상 중이라 눈은 감긴 채입니다. 마음속으로 그녀가 말해도 좋다는 허락을 내려주는 게 느껴집니다.",H2_PILG_SENSEI,,,,,0,0
97491,Dialog,PILG_SENSEI,"""Before they can behold the Sleeping Man, new Pilgrims must answer his Five-Fold Mysteries: Who is he? From where did he come? Why did he leave? Who did he seek? What was the answer?""","""잠자는 자를 뵙기 전에, 새 순례자는 오중 수수께끼에 답해야 해요. 그분은 누구인가? 어디서 오셨는가? 왜 떠나셨는가? 누구를 찾으셨는가? 답은 무엇이었는가?""",H2_PILG_SENSEI,h2a_sens_5fold,,,,0,0
97492,Dialog,PILG_SENSEI,"""All who come to the Sleeping Man are Pilgrims on this journey we call life. Like him, we travel the planes, restless for answers. Like him, we'll someday find them.""","""잠자는 자께 오는 모든 이는 삶이라 부르는 이 여정의 순례자예요. 그분처럼 우리도 답을 찾아 끊임없이 차원을 떠돌죠. 그분처럼 언젠가는 찾게 될 거예요.""",H2_PILG_SENSEI,,,,,0,0
97493,Dialog,PILG_SENSEI,"""There are countless ways: spells, portals, vortices, shifting banks of fog or shadow. Not all work in all places, either. Here in Cania, there are only two: the Gate and the tributaries of the River Styx.""","""방법은 셀 수 없이 많아요. 주문, 차원문, 소용돌이, 흘러다니는 안개나 그림자 덩어리 같은 것들이요. 다만 모든 곳에서 다 통하진 않죠. 여기 카니아에는 두 가지뿐이에요. 관문과 스틱스 강의 지류들.""",H2_PILG_SENSEI,,,,,0,0
97494,Dialog,PILG_SENSEI,"""The Gate leads almost anywhere, provided the Reaper will do your bidding. The tributaries of the River Styx, however, flow only downwards, to Nessus, the Ninth and final layer of Baator. I have not traveled them, nor do I intend to.""","""관문은 사신이 말을 들어준다면 거의 어디든 갈 수 있어요. 하지만 스틱스 강의 지류는 아래로만 흘러요. 베이아터의 아홉 번째이자 마지막 층인 네서스로요. 저는 가본 적도 없고, 갈 생각도 없어요.""",H2_PILG_SENSEI,,,,,0,0
97495,Dialog,PILG_SENSEI,"""Beyond using his True Name to bind him to your will as Mephistopheles has, I cannot say. Perhaps the Sleeping Man once knew. Until he dreams the answer, my Pilgrims and I are trapped here, just like you.""","""메피스토펠레스처럼 진명을 써서 사신을 뜻대로 부리는 것 말고는, 모르겠어요. 잠자는 자께서 한때는 아셨을지도요. 그분이 답을 꿈꾸기 전까지는, 우리 순례자들도 당신처럼 여기 갇혀 있어요.""",H2_PILG_SENSEI,,,,,0,0
97496,Dialog,PILG_SENSEI,"""The Sleeping Man dreams many things and, when he does, those dreams dance across the surface of his thoughts where I can see them. Much of what I have learned of his mysteries I learned through dreams.""","""잠자는 자께서는 많은 것을 꿈꾸세요. 그러실 때면 그 꿈들이 생각의 표면에서 춤추는 게 제 눈에 보여요. 그분의 신비에 대해 배운 것 대부분은 꿈을 통해서였죠.""",H2_PILG_SENSEI,,,,,0,0
97497,Dialog,PILG_SENSEI,"""His dreams have formed the very tenets of my faith and brought my Pilgrims and I closer to our enlightenment. Through his dreams I have come to know the Five-Fold Mysteries of the Sleeping Man...""","""그분의 꿈이 제 신앙의 근본을 이루었고, 저와 순례자들을 깨달음에 더 가까이 이끌었어요. 꿈을 통해 잠자는 자의 오중 수수께끼를 알게 됐죠...""",H2_PILG_SENSEI,,,,,0,0
97498,Dialog,PILG_SENSEI,"""Who is he? From where did he come? Why did he leave? Who did he seek? What was the answer? ...All who wish to behold the Sleeping Man must learn these Five-Fold Mysteries.""","""그분은 누구인가? 어디서 오셨는가? 왜 떠나셨는가? 누구를 찾으셨는가? 답은 무엇이었는가? ...잠자는 자를 뵙고 싶은 이라면 이 오중 수수께끼를 배워야 해요.""",H2_PILG_SENSEI,,,,,0,0
97499,Dialog,PILG_SENSEI,"""Where would such a tale begin and where would it end? The planes are as infinite in variety as they are in their number. They cannot be described; they must be lived.""","""그런 이야기가 어디서 시작하고 어디서 끝날까요? 차원의 다양함은 그 수만큼이나 무한해요. 말로는 표현할 수 없어요. 직접 살아봐야 하죠.""",H2_PILG_SENSEI,,,,,0,0
97500,Dialog,PILG_SENSEI,"""My home monastery in Limbo floats within a sphere of water that, in turn, orbits an ever-changing chunk of rock on which grows and dies an endless forest. What words can make that plain?""","""림보에 있는 제 고향 수도원은 물의 구체 안에 떠 있어요. 그 구체는 계속 변하는 바위 덩어리 주위를 돌고, 그 위에는 끝없는 숲이 자라고 죽기를 반복해요. 어떤 말로 그걸 설명할 수 있겠어요?""",H2_PILG_SENSEI,,,,,0,0
97501,Dialog,PILG_SENSEI,"""It is refreshing to see such an inquisitive mind. As the Sleeping Man teaches, until you find your answer, you must never stop asking questions. Now what is it you wish to know?""","""호기심 많은 분을 보니 반갑네요. 잠자는 자께서 가르치시듯, 답을 찾을 때까지 질문을 멈춰선 안 돼요. 자, 무엇을 알고 싶으세요?""",H2_PILG_SENSEI,,,,,0,0
97502,Dialog,PILG_SENSEI,"""I am a sensei of the githzerai. I have trained all my life to read the surface thoughts of those before me.""","""저는 기스제라이의 사부입니다. 평생 제 앞에 있는 이들의 표면 생각을 읽는 훈련을 했습니다.""",H2_PILG_SENSEI,,,,,0,0
97503,Dialog,PILG_SENSEI,"""It is refreshing to see such an inquisitive mind. As the Sleeping Man teaches, until you find your answer, you must never stop asking questions. Now what is it you wish to know?""","""이렇게 탐구적인 마음을 보니 상쾌합니다. 잠자는 자께서 가르치시듯, 답을 찾을 때까지, 질문을 멈춰서는 안 됩니다. 이제 무엇을 알고 싶으십니까?""",H2_PILG_SENSEI,,,,,0,0
97504,Dialog,PILG_SENSEI,"""Once, long ago, we were almost human. The Mindflayers held an empire that spanned the planes and, under their vicious command, we suffered countless centuries of slavery.""","""옛날, 오래전에, 우리는 거의 인간이었습니다. 마인드 플레이어들이 차원들에 걸친 제국을 지배했고, 그들의 잔혹한 명령 아래에서, 우리는 셀 수 없는 세기 동안 노예 생활로 고통받았습니다.""",H2_PILG_SENSEI,,,,,0,0
97505,Dialog,PILG_SENSEI,"""Little by little, we adapted. Our skin turned grey and mottled from lack of sun and leathery to withstand the beatings. They prized the mind above all else and bred us accordingly. Over time, our minds became like theirs.""","""조금씩, 우리는 적응했습니다. 우리의 피부는 햇빛 부족으로 회색으로 변하고 얼룩덜룩해졌으며, 구타를 견디기 위해 가죽처럼 질겨졌습니다. 그들은 무엇보다 정신을 중시했고 그에 따라 우리를 번식시켰습니다. 시간이 지나면서, 우리의 정신은 그들과 같아졌습니다.""",H2_PILG_SENSEI,,,,,0,0
97506,Dialog,PILG_SENSEI,"""Slowly, we learned to defend ourselves against their mental probing and small pockets of escaped slaves emerged. A hero by the name of Gith rose up among their number and ultimately overthrew the oppressors.""","""천천히, 우리는 그들의 정신 탐색에 맞서 자신을 방어하는 법을 배웠고, 탈출한 노예들의 작은 무리가 나타났습니다. 기스라는 이름의 영웅이 그들 사이에서 일어났고, 결국 압제자들을 타도했습니다.""",H2_PILG_SENSEI,,,,,0,0
97507,Dialog,PILG_SENSEI,"""Together with our brothers, the githyanki, we are the children of that rebellion, many generations now removed. A split came between the githyanki and ourselves but that is a story for another time.""","""우리의 형제인 기스양키와 함께, 우리는 그 반란의 자손들이며, 이제 여러 세대가 지났습니다. 기스양키와 우리 사이에 분열이 있었지만, 그것은 다음 기회의 이야기입니다.""",H2_PILG_SENSEI,,,,,0,0
97508,Dialog,PILG_SENSEI,"""The githyanki keep largely to the Astral Plane and the githzerai to our monasteries on the plane of Limbo though some, like myself, still travel beyond.""","""기스양키는 주로 영계에 머물고, 기스제라이는 림보 차원의 우리 수도원에 머물지만, 저처럼 일부는 여전히 그 너머로 여행합니다.""",H2_PILG_SENSEI,,,,,0,0
97509,Dialog,PILG_SENSEI,"""There are countless ways: spells, portals, vortices, shifting banks of fog or shadow. Not all work in all places, either. Here in Cania, there are only two: the Gate and the tributaries of the River Styx.""","""셀 수 없이 많은 방법이 있습니다: 주문, 차원문, 소용돌이, 이동하는 안개나 그림자 덩어리. 모든 곳에서 모든 방법이 작동하는 것은 아닙니다. 여기 카니아에는 단 두 가지만 있습니다: 관문과 스틱스 강의 지류들.""",H2_PILG_SENSEI,,,,,0,0
97510,Dialog,PILG_SENSEI,"""The Gate leads almost anywhere, provided the Reaper will do your bidding. The tributaries of the River Styx, however, flow only downwards, to Nessus, the Ninth and final layer of Baator. I have not traveled them, nor do I intend to.""","""관문은 사신이 당신의 명령을 따른다면, 거의 어디든 인도합니다. 하지만 스틱스 강의 지류들은 오직 아래로만, 베이아터의 아홉 번째이자 마지막 층인 네서스로만 흐릅니다. 저는 그곳을 여행한 적도 없고, 그럴 의도도 없습니다.""",H2_PILG_SENSEI,,,,,0,0
97511,Dialog,PILG_SENSEI,"""Beyond using his True Name to bind him to your will as Mephistopheles has, I cannot say. Perhaps the Sleeping Man once knew. Until he dreams the answer, my Pilgrims and I are trapped here, just like you.""","""메피스토펠레스처럼 그의 진명을 사용해 당신의 의지에 묶는 것 외에는, 말할 수 없습니다. 아마도 잠자는 자께서 한때는 아셨을 것입니다. 그분이 답을 꿈꾸기 전까지는, 제 순례자들과 저는 당신처럼 여기 갇혀 있습니다.""",H2_PILG_SENSEI,,,,,0,0
97512,Dialog,PILG_SENSEI,"""The Sleeping Man dreams many things and, when he does, those dreams dance across the surface of his thoughts where I can see them. Much of what I have learned of his mysteries I learned through dreams.""","""잠자는 자께서는 많은 것을 꿈꾸시고, 그럴 때, 그 꿈들은 제가 볼 수 있는 그분의 생각 표면을 가로질러 춤춥니다. 제가 그분의 신비에 대해 배운 것의 대부분은 꿈을 통해 배웠습니다.""",H2_PILG_SENSEI,,,,,0,0
97513,Dialog,PILG_SENSEI,"""His dreams have formed the very tenets of my faith and brought my Pilgrims and I closer to our enlightenment. Through his dreams I have come to know the Five-Fold Mysteries of the Sleeping Man...""","""그분의 꿈들은 제 신앙의 바로 그 교리를 형성했고, 제 순례자들과 저를 깨달음에 더 가깝게 만들었습니다. 그분의 꿈을 통해 저는 잠자는 자의 오중 수수께끼를 알게 되었습니다...""",H2_PILG_SENSEI,,,,,0,0
97514,Dialog,PILG_SENSEI,"""Who is he? From where did he come? Why did he leave? Who did he seek? What was the answer? ...All who wish to behold the Sleeping Man must learn these Five-Fold Mysteries.""","""그분은 누구인가? 어디서 오셨는가? 왜 떠나셨는가? 누구를 찾으셨는가? 답은 무엇이었는가? ...잠자는 자를 뵙기 원하는 모든 이는 이 오중 수수께끼를 배워야 합니다.""",H2_PILG_SENSEI,h2a_sens_5fold,,,,0,0
97515,Dialog,PILG_SENSEI,"""Where would such a tale begin and where would it end? The planes are as infinite in variety as they are in their number. They cannot be described; they must be lived.""","""그런 이야기가 어디서 시작하고 어디서 끝날까요? 차원들은 그 수만큼이나 다양성도 무한합니다. 그것들은 묘사될 수 없습니다; 살아야만 합니다.""",H2_PILG_SENSEI,,,,,0,0
97516,Dialog,PILG_SENSEI,"""My home monastery in Limbo floats within a sphere of water that, in turn, orbits an ever-changing chunk of rock on which grows and dies an endless forest. What words can make that plain?""","""림보에 있는 제 고향 수도원은 물의 구체 안에 떠 있고, 그것은 다시 끊임없이 변하는 바위 덩어리 주위를 공전하는데, 그 위에는 끝없는 숲이 자라고 죽습니다. 어떤 말로 그것을 명확히 할 수 있겠습니까?""",H2_PILG_SENSEI,,,,,0,0
97517,Dialog,PILG_SENSEI,"""As masters of mind, body, and spirit, we sensei lead our fellow githzerai both to greater wisdom and to victory over our enemies. In your language we would be known as monks though much is lost in the translation.""","""정신, 육체, 영혼의 대가로서, 우리 사부들은 동료 기스제라이를 더 큰 지혜와 적에 대한 승리로 이끕니다. 당신들의 언어로는 수도사로 알려져 있지만, 번역에서 많은 것이 상실됩니다.""",H2_PILG_SENSEI,,,,,0,0
97518,Dialog,PILG_SENSEI,"""We githzerai strive to be a peaceful people and have separated ourselves from others in our attempts to find that peace.""","""우리 기스제라이는 평화로운 민족이 되고자 노력하며, 그 평화를 찾으려는 시도 속에서 다른 이들로부터 분리되었습니다.""",H2_PILG_SENSEI,,,,,0,0
97519,Dialog,PILG_SENSEI,"""Our brothers, the githyanki, continue to hunt us, however, and we have not yet forgiven the Mindflayers who we once served as slaves. It could be argued that our enemies have made us who we are.""","""하지만 우리의 형제인 기스양키는 계속 우리를 사냥하고, 우리는 아직 한때 노예로 섬겼던 마인드 플레이어들을 용서하지 않았습니다. 우리의 적들이 우리를 지금의 우리로 만들었다고 주장할 수 있습니다.""",H2_PILG_SENSEI,,,,,0,0
97520,Dialog,PILG_SENSEI,"""Of a sort... Your mind is like a vast library and my talents let me run my finger across the spines of its many tomes. I can read their titles and guess their contents but I can never take them down and truly read.""","""어느 정도는... 당신의 마음은 광대한 도서관과 같고, 제 재능은 그 많은 책들의 등을 손가락으로 훑을 수 있게 합니다. 제목을 읽고 내용을 추측할 수 있지만, 결코 그것들을 꺼내 진정으로 읽을 수는 없습니다.""",H2_PILG_SENSEI,,,,,0,0
97521,Dialog,PILG_SENSEI,"""Even with its limits, it is a gift I treasure for this is how, title by title, spine by spine, I have come to know the secret wisdom of the Sleeping Man. It is through my gift that I have touched his dreams.""","""한계가 있지만, 이것은 제가 소중히 여기는 재능입니다. 이렇게, 제목마다, 등마다, 저는 잠자는 자의 비밀 지혜를 알게 되었기 때문입니다. 제 재능을 통해 그분의 꿈을 접했습니다.""",H2_PILG_SENSEI,,,,,0,0
97522,Dialog,PILG_SENSEI,"""There are countless ways: spells, portals, vortices, shifting banks of fog or shadow. Not all work in all places, either. Here in Cania, there are only two: the Gate and the tributaries of the River Styx.""","""셀 수 없이 많은 방법이 있습니다: 주문, 차원문, 소용돌이, 이동하는 안개나 그림자 덩어리. 모든 곳에서 모든 방법이 작동하는 것은 아닙니다. 여기 카니아에는 단 두 가지만 있습니다: 관문과 스틱스 강의 지류들.""",H2_PILG_SENSEI,,,,,0,0
97523,Dialog,PILG_SENSEI,"""The Gate leads almost anywhere, provided the Reaper will do your bidding. The tributaries of the River Styx, however, flow only downwards, to Nessus, the Ninth and final layer of Baator. I have not traveled them, nor do I intend to.""","""관문은 사신이 당신의 명령을 따른다면, 거의 어디든 인도합니다. 하지만 스틱스 강의 지류들은 오직 아래로만, 베이아터의 아홉 번째이자 마지막 층인 네서스로만 흐릅니다. 저는 그곳을 여행한 적도 없고, 그럴 의도도 없습니다.""",H2_PILG_SENSEI,,,,,0,0
97524,Dialog,PILG_SENSEI,"""Beyond using his True Name to bind him to your will as Mephistopheles has, I cannot say. Perhaps the Sleeping Man once knew. Until he dreams the answer, my Pilgrims and I are trapped here, just like you.""","""메피스토펠레스처럼 그의 진명을 사용해 당신의 의지에 묶는 것 외에는, 말할 수 없습니다. 아마도 잠자는 자께서 한때는 아셨을 것입니다. 그분이 답을 꿈꾸기 전까지는, 제 순례자들과 저는 당신처럼 여기 갇혀 있습니다.""",H2_PILG_SENSEI,,,,,0,0
97525,Dialog,PILG_SENSEI,"""The Sleeping Man dreams many things and, when he does, those dreams dance across the surface of his thoughts where I can see them. Much of what I have learned of his mysteries I learned through dreams.""","""잠자는 자께서는 많은 것을 꿈꾸시고, 그럴 때, 그 꿈들은 제가 볼 수 있는 그분의 생각 표면을 가로질러 춤춥니다. 제가 그분의 신비에 대해 배운 것의 대부분은 꿈을 통해 배웠습니다.""",H2_PILG_SENSEI,,,,,0,0
97526,Dialog,PILG_SENSEI,"""His dreams have formed the very tenets of my faith and brought my Pilgrims and I closer to our enlightenment. Through his dreams I have come to know the Five-Fold Mysteries of the Sleeping Man...""","""그분의 꿈들은 제 신앙의 바로 그 교리를 형성했고, 제 순례자들과 저를 깨달음에 더 가깝게 만들었습니다. 그분의 꿈을 통해 저는 잠자는 자의 오중 수수께끼를 알게 되었습니다...""",H2_PILG_SENSEI,,,,,0,0
