StrRef,SpeakerType,SpeakerName,TextEng,Text,DLG,Scripts,Conditions,DialogueContext,SoundRef,VolumeVariance,PitchVariance
79412,Creature,Stone Butler,You have retuuurned to talk with meee some more? I aaaam grateful for the coooompany...,다아아시 돌아와서 나아아와 더 이야기하러 왔나아아? 동행이 있어서 고오오마워...,STONEBUTLER,,,,,0,0
79413,Creature,Stone Butler,"Voooooices? It's been loooong since I've heard voooooices... And the mythaaaaal, that too has been gooooone too loooooong. At last, liiiiife returns to Undrentiiiiiiiiide...","목소오오오리? 목소오오오리를 들은 지 너무오오오 오래됐어... 미이이살도 너무오오오 오래 사라져 있었지. 드디어 생명이 언드렌타아아아이드로 돌아오는구나...",STONEBUTLER,,,,,0,0
79414,Creature,Stone Butler,"Yes, yeeeeesss, you know the naaaame? Entertainers, clockwork poooonies, children's toys that waaaalked and taaaalked. And guardians, toooo, for those scared of thieeeeves...","그래애애, 그 이이이름을 아아아는구나? 연예인들, 태엽 조오오랑말, 걸어 다니며 말하아아는 아이들 장난감. 도둑이 두려운 이들을 위한 수호자아아도 있었지...",STONEBUTLER,,,,,0,0
79415,Creature,Stone Butler,"The myyythal? Someone haaas repaired the mythallaaar atop the Temple of the Wiiinds and reactivated the myyythal after sooo long... A paaart of me is excited, another part afraaaid...","미이이살? 누군가가 바람의 신전 꼭대기의 미이이살라를 수리하고 오오오랜만에 미이이살을 다시 활성화했어... 나의 일부는 기대되고 다른 일부는 두려어어워...",STONEBUTLER,,,,,0,0
79416,Creature,Stone Butler,Once this ciiiity flew upon the mythal's wiiiings... We loved the mythal and we truuusted it but one day it abaaandoned us... It tooook less than a minute for uuuus to faaall...,한때 이 도시이이는 미살의 날개로 날았어어어... 우리는 미살을 사랑했고 믿었지만 어느 날 미살이 우리를 버어어렸어... 추락하는 데는 1분도 걸리지 않았지이이...,STONEBUTLER,,,,,0,0
79417,Creature,Stone Butler,"In only seconds, all but the greaaatest buildings shattered... more than half of thooose who liiived were dead... The others fled into the deserrrrrt and were lost... Only those like me remained to watch the saaand slowly cover us...","단 몇 초 만에 가장 큰 건물들을 제외하고 다아아 부서졌어... 살아 있던 이들의 절반 이상이 죽었지이이... 나머지는 사막으로 도망쳐 사라져어어... 오직 나 같은 자들만 남아 모래가 천천히 우리를 덮는 것을 지켜보았어어어...",STONEBUTLER,,,,,0,0
79418,Creature,Stone Butler,Who can knoooow the myyythal's heart? But abandon us she diiiid and greaaaat is the price we paid for trusting herrrr... The mythaaal has returned but I daaare not hope she has retuuuurned for good...,누가 미이이살의 마음을 알 수 있겠어어어? 하지만 그녀는 우리를 버렸고 그녀를 믿은 대가는 컸지이이... 미이이살이 돌아왔지만 영원히 돌아온 것인지 감히 바라지이이 못하겠어...,STONEBUTLER,,,,,0,0
79420,Creature,Stone Butler,"There was liiiife here once and haaappiness. Once, this cityyy flew and I knew the taaaste of wiiind. Now there is only gloom and daaarkness and the slow decaaay of memmmmory...","한때 여기에 생명이 있었고 행복이 있었지이이. 한때 이 도시이이는 날았고 나는 바람의 맛을 알았어어어. 이제는 우울과 어둠과 기억의 느린 쇠퇴만 있을 뿐이지이이...",STONEBUTLER,,,,,0,0
79421,Creature,Stone Butler,"For a strooong mythal, there are no bounds upon its pooower. Some have placed new staaars within the skyyyy or changed the spinning of the spheeeres... This one is weak but even nooow I feel it growing...","강한 미이이살에게는 그 힘에 한계가 없어어어. 어떤 미살은 하늘에 새 별을 놓거나 천구의 회전을 바꾸기도 했지이이... 이것은 약하지만 지이이금도 자라나는 게 느껴져...",STONEBUTLER,a_butler_mythal,,,,0,0
79422,Creature,Stone Butler,They are the cryyystals from which the mythaaal receives its strength... They capture the maaagic of all the world and put it in the hands of who controoools them.... Destroy the mythallaaar and you destroy the myyythal...,그것들은 미이이살이 힘을 받는 수정이야아아... 세상의 모든 마법을 포착해서 그것을 지배하는 자의 손에 쥐어 주지이이... 미이이살라를 파괴하면 미이이살을 파괴하는 거야아아...,STONEBUTLER,a_butler_mythal,,,,0,0
79423,Creature,Stone Butler,"Yes, froooom the center of Uuuundrentide rose the great temple. There the aaaarchwizards controlled the myyythal and were controoolled by it in tuuurn...","그래애애, 언드렌타아아이드 중심에서 거대한 신전이 솟아올랐지이이. 거기서 대마법사들이 미이이살을 지배하고 차례로 미살에 지배받았어어어...",STONEBUTLER,,,,,0,0
79424,Creature,Stone Butler,"A butler. Yes, a stooooooone butler... I would serve and entertaaaaain, tell witty joooooookes to maaaaake the customers laaaaaaugh... It was a long, looooong time ago...","집사. 그래애애, 도오올 집사아아아... 시중들고 즐거움을 주고, 재치 있는 농담으로 손님들을 웃기곤 했지이이... 아주 오래, 오오오래전 일이야아아...",STONEBUTLER,,,,,0,0
79425,Creature,Stone Butler,"People? Why they bought golllllems, of course... Entertainers, clockwork poooonies, children's toys that waaaalked and taaaalked. And guardians, toooo, for those scared of thieeeeves...","사람들? 왜 골렘을 사아아냐고? 물론이지이이... 연예인들, 태엽 조오오랑말, 걸어 다니며 말하아아는 아이들 장난감. 도둑이 두려운 이들을 위한 수호자아아도...",STONEBUTLER,,,,,0,0
79426,Creature,Stone Butler,"Only the guardians remaaaain... Our master made them wellllll, made them to laaaast, as he did me, his faaavorite, hiiiiis love... I was his buuuutler... I miiiiiiss him veryyyyy much...","수호자들만 남아아아 있어... 우리 주인님은 그들을 잘 만들었지이이, 오래가도록, 나처럼, 그분이 가장 좋아하던 것, 사랑하던 것이이이... 나는 그분의 집사아아였어... 그분이 너무오오오 그리워...",STONEBUTLER,,,,,0,0
79427,Creature,Stone Butler,"Destrooooy them? Noooo, they are my maker's creeeeations. They guard, as is their duuuuty but they were always gentle with hiiiiim when he visited them to make repaaaairs...","파괴하라아아고? 안 돼애애, 그들은 내 창조자의 피조물이야아아. 그들은 지키지이이, 그게 그들의 의무니까. 하지만 주인님이 수리하러 방문할 때는 항상 온순했어어어...",STONEBUTLER,,,,,0,0
79428,Creature,Stone Butler,He wore a riiiiiing that would disaaaable them so he could view their mechaniiiiisms. He used it for all of his creeeeations... It felt so niiiiice to be at peeeace...,"그분은 반지이이를 끼셨어. 그들을 무력화해서 기계 장치를 살펴볼 수 있게 하는 반지이이. 모든 피조물에 사용했지이이... 평화로운 느낌이 정말 좋았어어어...",STONEBUTLER,a_butler_ring,,,,0,0
79429,Creature,Stone Butler,"I buuuuried it with hiiiiim long agoooo. I built a coffin for hiiiim over there, in that rooooom and put flowers on it beeeecause I loved hiiim. Please, do not distuuuurb his rest.","오래애애전에 그분과 함께 묻었어어어. 저기 저 방에 그분을 위해 관을 만들어 꽃을 올렸지이이. 그분을 사랑했으니까아아. 제발, 그분의 안식을 방해하지 마아아...",STONEBUTLER,,,,,0,0
79430,Creature,Stone Butler,Noooo... Those who would distuuuurb my maaaker are not welllllcome heeeere... Please leeeeave me beeee.,안 돼애애... 내 창조자를 방해하려는 자들은 여기서 환영받지 못해애애... 제발 나를 내버려 두어어어.,STONEBUTLER,,,,,0,0
79431,Creature,Stone Butler,"I loooved hiiiiim... He gave me liiiife, and puuuurpose... I meant to tell him but then he diiiiiiiied... It was very long agooooo... I entombed him here in the store with his creaaaaations and watch ooover him aaaall my daaays...","나는 그분을 사랑했어어어... 그분이 내게 생명과 목적을 주셨지이이... 말하려 했지만 그분이 돌아가셨어어어... 아주 오래애애전 일이야아아... 그분을 가게에 그분의 피조물들과 함께 안장하고 평생 지켜보고 있어어어...",STONEBUTLER,,,,,0,0
79435,Creature,Stone Butler,"Oooonce, when I was younger, I waaaas more eloquent. But that was loooong agoooo and I've grooown oooold. Little by little, I am faaaadinnnng.","한때애애, 내가 젊었을 때는 더 말을 잘했지이이. 하지만 그건 오래애애전이고 난 늙었어어어. 조금씩, 나는 사라져 가고 있어어어.",STONEBUTLER,,,,,0,0
79436,Creature,Stone Butler,A meduuuuusa? I have not seen one of thooooooose since my earliest daaaaays... Why did she come to Uuuuundrentide? Tell me that and maybeeee I can tell you wheeeeere she might have goooooone.,메두우우사? 내가 처음 태어난 날 이후로 그런 존재를 본 적이 없어어어... 왜 그녀가 언드렌타아아이드로 왔지이이? 그걸 말해 주면 어디로 갔을지 말해 줄 수 있을지도 모르지이이.,STONEBUTLER,,,,,0,0
79437,Creature,Stone Butler,"Yes, it is gooooood to speak again and to heeeear vooooices...","그래애애, 다시 말하고 목소리이이를 듣는 건 좋은 일이야아아...",STONEBUTLER,,,,,0,0
79438,Creature,Stone Butler,"Yes, the Great Liiiiibrary! Many would visit it and greaaaat was its collection... There was a boooook there that was said to be enchaaaanted. Soooo well was it written that it felt as iiiiif you were really there...","그래애애, 대도서관이이이! 많은 이들이 방문했고 소장품이 대단했지이이... 마법에 걸렸다고 알려진 책이 있었어어어. 너무오오오 잘 쓰여서 정말 그곳에 있는 것 같은 느낌이 들었지이이...",STONEBUTLER,,,,,0,0
79439,Creature,Stone Butler,"Aaancient? Is that what weeee've become? Yes, once there was magic heeere. All things were magiiiiic, once. Perhaps it will come agaaaain, with the mythaaaal now renewed... ","고대애애라고? 우리가 그렇게 됐나아아? 그래, 한때 여기에 마법이 있었어어어. 한때 모든 것이 마법이었지이이. 아마 미이이살이 다시 활성화됐으니 다시 돌아올지도 몰라아아...",STONEBUTLER,,,,,0,0
79440,Creature,Stone Butler,"The Arcanist's Tower was where maaaagic was taught and studied, though. Maybeeee you will find your meduuuusa there, bent in studyyyyy...","비전술사의 탑은 마법을 가르치고 연구하던 곳이었지이이. 아마도 거기서 공부에 빠져 있는 네 메두우우사를 찾을 수 있을 거야아아...",STONEBUTLER,,,,,0,0
79441,Creature,Stone Butler,"Plunderrrrrr... Is this the fate of Undrentiiiiide? If it is the treasuuuuuure of the dead she seeks, perhaps you will fiiiiind her in the Crypts, stealing from the Burning Mennnnn...","약탈이이이라... 이것이 언드렌타아아이드의 운명인가아아? 그녀가 찾는 게 죽은 자들의 보물이라면 아마 지하 납골당에서 불타는 자들에게서 훔치고 있을 거야아아...",STONEBUTLER,,,,,0,0
79442,Creature,Stone Butler,"Aaaaaah, then sheeee must be the one who re-aaaaaaaactivated the mythaaaaal... It is controooolled from the Temple of the Wiiiiinds at the city's heart, so thaaaat is where you will fiiiiiind her...","아아아아, 그렇다면 그녀가 미이이살을 다시 활성화한 자로구나아아... 미살은 도시 중심의 바람의 신전에서 제어되니이이, 거기서 그녀를 찾을 수 있을 거야아아...",STONEBUTLER,,,,,0,0
79443,Creature,Stone Butler,"But now that the myyyyyythaaal is restored, the Temple will beeeee encased in glowing waaaalls through which you shall haaaave no paaassage... It is safer that waaaay...","하지만 미이이이살이 복원됐으니이이, 신전은 빛나는 벽으로 둘러싸여 통과할 수 없을 거야아아... 그게 더 안전하니까아아...",STONEBUTLER,a_mythallar,,,,0,0
79444,Creature,Stone Butler,"The city, whiiiile it flew, spread out in aaaall directions... Pick one and I wiiiiill tell you what waaaas there. The directions might have chaaaanged when we fell but their associaaaations are still the saaaaame...","도시가 날아아아 있을 때는 모든 방향으로 뻗어 있었어어어... 하나를 고르면 거기에 뭐가 있었는지 말해 줄게에에. 우리가 떨어졌을 때 방향이 바뀌었을 수도 있지만 연관성은 여전히 같아아아...",STONEBUTLER,,,,,0,0
79445,Creature,Stone Butler,"At the heart of the city roooose the Temple of the Wiiiiinds. From there, all Uuuundrentide's power was controlled as there were kept the fragile mythallaaaar.","도시 중심에는 바람의 신전이 솟아아아 있었어. 거기서 언드렌타아아이드의 모든 힘이 제어됐지이이. 깨지기 쉬운 미이이살라가 거기 보관돼 있었으니까아아.",STONEBUTLER,,,,,0,0
79446,Creature,Stone Butler,"The crypts looooomed in the western quarter... They could not spread out or diiiig beloooow, so as more died, they built uuuuupward, corpses in the skyyyy.","납골당은 서쪽 구역에 우뚝 솟아아아 있었어... 옆으로 퍼지거나 아래로 팔 수 없어서 죽는 이가 늘수록 위로 지었지이이, 하늘의 시체들이야아아.",STONEBUTLER,,,,,0,0
79447,Creature,Stone Butler,"Those in the south liiiived in the shadows of the Arcanists' Tower... There they trained for centuuuuuries, many of them becoming liches befoooore the faaaall. Too arrogant, they were. Tooooo arrogant by faaaar...","남쪽에 사는 이들은 비전술사의 탑 그늘에서 살았어어어... 거기서 수백 년간 훈련했고 많은 이들이 추락 전에 리치가 됐지이이. 너무 오만했어어어. 너무오오오 오만했어...",STONEBUTLER,,,,,0,0
79448,Creature,Stone Butler,"To the eeeeast? To the east there was nothing, oooonly the quarters of slaaaaves and servants. They got the early sun to waaaake them for their duuuuties...","동쪽으로오오? 동쪽에는 아무것도 없었어어어, 오직 노예와 하인들의 숙소뿐이었지이이. 그들은 일찍 뜨는 태양을 받아 임무를 위해 일어났어어어...",STONEBUTLER,,,,,0,0
79449,Creature,Stone Butler,"To the north was the Great Liiiibrary, home to a thousand tooomes. People came from all ooooover the empire to read the works of the authooooors of Undrentiiiiide...","북쪽에는 대도서관이 있었지이이, 천 권의 책이 있는 곳이야아아. 제국 전역에서 언드렌타아아이드 저자들의 작품을 읽으러 사람들이 왔어어어...",STONEBUTLER,,,,,0,0
79450,Creature,Stone Butler,"Three Winds were hidden iiiiiiiin three great buildings of Uuuuundrentide. If there was an emergency, the ooooowners could bring them to the Ark thaaaat rests at the Temple's baaaase. Only then would the temple oooopen...","세 개의 바람이 언드렌타아아이드의 세 거대한 건물에 숨겨져 있었어어어. 비상사태가 있으면 소유자들이 신전 기단에 있는 방주로 가져갈 수 있었지이이. 그래야만 신전이 열렸어어어...",STONEBUTLER,,,,,0,0
79451,Creature,Stone Butler,"The Wiiiiise Wind was hidden in the Great Liiiibrary. In their oooown tower, the Arcanists hid the Daaark Wind. And the cleriiiiics housed the Dead Wind with the bodies in the Cryyyypt... Thoooose were the threeeeee.","지혜의 바람은 대도서관에 숨겨져 있었어어어. 비전술사들은 자기 탑에 어둠의 바람을 숨겼지이이. 그리고 성직자들은 죽음의 바람을 납골당의 시신들과 함께 보관했어어어... 그 셋이었지이이.",STONEBUTLER,a_three_winds,,,,0,0
79618,Creature,Stone Butler,Stone Butler,돌 집사,STONEBUTLER,,,,,0,0
